2019,Brilliant Classics,BRI95605,5028421956053,Johann Ladislaus Dussek ,"Dussek: Complete Piano Sonatas, Vol. 5 - Op. 18 No. 2 & Op. 45",Wolfgang Brunner,1,CD,7.79,11.99,"Wolfgang Brunner presents two opus numbers composed by Dussek in 1792 and 1800, around the time of the beginning and then the painful end of his marriage to the singer and harpist Sophia Corri. The comparatively early Op.18 No.2 shares the modest dimensions of Haydn's early keyboard sonatas, though by then Dussek was 32 years old and Haydn had already paid fulsome tribute to the younger man's 'remarkable talents'. Upon his marriage to Sophia he ran a moderately successful music publishing firm with his new father-in-law, Domenico Corri, but when the firm went bust late in 1799 Dussek abandoned Sophia and their daughter and fled to Hamburg; during the following year he wrote a trio of sonatas published in 1802 as Op.45. These are all more ambitious in scale and expressive reach. The slow movement of Op.45 No.1 bears the significant marking of Adagio patetico, and it explores reaches of grave feeling through harmonies in advance of their time. The two-movement Op.45 No.2 opens with a Larghetto sostenuto of grave concentration, though the mood is lifted by a gently circular, almost Schubertian Andantino. A lighter, more cheerful character pervades the D major Sonata Op.45 No.3, which concludes with one of the effervescent Rondos for which Dussek was celebrated in his own lifetime. On this recording Wolfgang Brunner plays a pair of instruments from Dussek's time: an 1804 Broadwood, and a modern copy of a Viennese fortepiano originally made around 1810 by Michael Rosenberger. Once complete, the cycle will form the first-ever recording of Dussek's sonatas on historically appropriate instruments.",,https://b2b.naxosusa.com/Album.aspx?product=BRI95605&medium=phy,01 Classical,Classical,,Germany,2018 Brilliant Classics,2018 Brilliant Classics,,,,,,,,,,,,,,,,,,,,
2019,Brilliant Classics,BRI95623,5028421956237,Johann Pachelbel ,Pachelbel: Complete Keyboard Music,Simone Stella,13,CD,34.31,52.99,"During his lifetime, Johann Pachelbel (1653-1706) was best known as an organ composer. He wrote more than two hundred pieces for the instrument, both liturgical and secular, and explored most of the genres that existed at the time. He is considered to be the apex of the 17th century's south German organ school and generally one of the most important composers of the middle Baroque. His sphere of activity included central and southern Germany (modern Bavaria, Thuringia and Stuttgart), as well as important formative years in Vienna in his early 20s, during which he absorbed the Habsburg Empire's dominant Italian and south German influences. The southern organ-builders' emphasis on manual divisions is also apparent in much of Pachelbel's liturgical organ music, which is relatively simple and written for manuals only. With this 13-disc set covering Pachelbel's pivotal contributions to the chorale prelude, fugue and variation forms, internationally acclaimed organist Simone Stella adds another milestone to his already prolific discography of baroque keyboard music surveys on Brilliant Classics.",,https://b2b.naxosusa.com/Album.aspx?product=BRI95623&medium=phy,01 Classical,Classical,,Germany,2018 Brilliant Classics,2018 Brilliant Classics,,,,,,,,,,,,,,,,,,,,
2019,Brilliant Classics,BRI95627,5028421956275,Teresa de Rogatis ,Cinzia Milani: A Tribute to Teresa de Rogatis,Cinzia Milani,1,CD,10.13,15.99,"Born in Naples in 1893, Teresa de Rogatis was a child prodigy who gave her first recital at the age of seven. She studied piano, composition, counterpoint, harmony, conducting and voice at the Conservatorio San Pietro in Naples. While in Egypt on a concert tour, she met and soon married a Swiss man of means living in Cairo, Paolo Feninger. Settling there in the 1920s, Rogatis helped to found the National Conservatory of Egypt, where she also taught piano and guitar for over 40 years. Her husband's death prompted her retirement in 1963 back to Naples, where she lived quietly until her death in 1979. Her career as a teacher allowed little time for composition, but de Rogatis took a selfless attitude to her own work. 'If teaching hundreds of young people about the poetry and beauty of music, instead of composing works and symphonies, means giving one's life up, then that's what I've done. But if some of these young people, who are now adults, can understand a Beethoven symphony or sonata and find in it solace and a guide for their own lives, then I will live in their memories just as I would have done in my works, and my life will have been equally useful.' Her relatively slender output - 60 acknowledged works - is dominated by piano music, but de Rogatis also wrote instrumental songs and dances for the guitar, and a four-movement Sonatina of no less ready melodic appeal, all presented here by her modern-day counterpart, the Italian guitarist Cinzia Milani. In a personal introduction to the scholarly booklet note, Milani observes how de Rogatis 'reconciled brilliant virtuoso flair with an elegantly feminine touch, even when the overall tone is jocular or ironic.' Milani's decision to record this music on a distinctly modern instrument is part of 'an imaginary dialogue between different periods and the changes they heralded: like glancing backwards while walking towards the future.'",,https://b2b.naxosusa.com/Album.aspx?product=BRI95627&medium=phy,01 Classical,Classical,,Germany,2018 Brilliant Classics,2018 Brilliant Classics,,,,,,,,,,,,,,,,,,,,
2019,Brilliant Classics,BRI95789,5028421957890,Alonso Lobo ,Lobo: Sacred Vocal Music,Coro Victoria,1,CD,7.79,11.99,"On this new recording, Coro Victoria offers a portrait of Alonso Lobo (1555-1617) through a cross-section of his sacred output (his works in Spanish are all lost). The group also illustrates the variety of interpretative practices of the period. The concluding O quam suavis est Domine is sung by a single soprano while the vihuela accompaniment supplies the remaining five parts. Church choirs sang this music in the liturgy, but minstrels also played it during processions, and there was free traffic between sacred and secular contexts. Coro Victoria was founded by its director, Ana Fernández-Vega, to recover and preserve a native, historically informed tradition of singing Spanish polyphony from its Renaissance-era high noon, exemplified not only by Victoria himself but also his contemporaries such as the Seville-born and bred Alonso Lobo (indeed, Victoria considered Lobo his equal). He is now best known for a haunting, six-voice setting of the Requiem, and his magnificent motet for the obsequies of King Philip II, Versa est in luctum shares the Requiem's tone of mourning and remembrance, established by a dense mesh of overlapping counterpoint. Coro Victoria also presents other sides to a composer whose style is far more various than is commonly assumed. As well as the beautifully handled techniques of canon and counterpoint in Marian motets such as Ave Maria and Ave Regina coelorum, distinguishing features of Lobo's style are his jagged melodic lines, a far cry from Palestrina's smooth curves, and his more animated conclusions, both vividly demonstrated by Vivo ego, dicit Dominus. There is also a complete, portmanteau setting of the Mass, drawn from his Missa O Rex gloriae, Missa Petre ego pro te rogavi and Missa Simile est regnum caelorum, with the Credo filled in by the separate Credo Romano, which is underpinned by a figured bass and continued to be popular long after his death. These polished performances should renew wider interest in Lobo's music.",,https://b2b.naxosusa.com/Album.aspx?product=BRI95789&medium=phy,01 Classical,Classical,,Germany,2018 Brilliant Classics,2018 Brilliant Classics,,,,,,,,,,,,,,,,,,,,
2019,Brilliant Classics,BRI95793,5028421957937,Cesar Auguste Franck ,Cesar Franck Edition,Arnhem Philharmonic Orchestra; Sofia Symphony Orchestra; Vilnius String Quartet; Mariana Sîrbu; Mihai Dancila; Mihail Sarbu; Julia Severus; Francesco Bertoldi; Muza Rubackyte; Adriano Falcioni; Joris Verdin; Isabel Kabatu; Marc Laho; Chorus and Orchestra of the Opera Royal de Wallonie; Paolo Arrivabeni; Gachinger Kantorei Stuttgart; Radio-Sinfonieorchester Stuttgart des SWR; The Netherlands Radio Choir; Netherlands Radio Philharmonic Orchestra; Mariann Bodi; Attila Wendler; Istvan Racz; Kodaly Korus Debrecen; Mainzer Domchor; Daniel Beckmann; Mainzer Domorchester; Francesca Scaini; Mattio Ometto; Kristof Barati; Klara Wurtz; Roberto Trainini; Cristiano Burato,23,CD,45.23,69.99,"This remarkable release reveals the full breadth and genius of a creative career known to most merely by the tip of the iceberg: a small number of seminal works written in the composer's final decade of life. Ceìsar Franck (1822-1890), although considered one of the foremost 19th-century French composers, was not in fact French by birth, but Belgian. He only became a full French citizen in 1873 after he had been appointed organ professor at the Paris Conservatoire. His career can be divided into three distinct periods, each characterised by the production of very different types of music. From 1834 to 1846, under pressure from his father, he concertised as a piano virtuoso, and most of the works of this period were written with that purpose in mind. In the decade following his marriage in 1848 he composed virtually nothing but became celebrated as an organist, and he would bring the spacious dimensions of that instrument to his sound world in the years to come. His 'middle period' - from about 1858 to 1879 - was devoted to the production of works for organ, church music and a series of monumental choral pieces on religious or biblical subjects. In these three decades he wrote virtually nothing for the piano. From 1879 begins the decade of his late flowering in the great chamber and orchestral works, ushered in by his well-loved Piano Quintet and containing the pieces for which Franck is widely known. Spanning all three periods were opera and his small output of 18 mélodies.",,https://b2b.naxosusa.com/Album.aspx?product=BRI95793&medium=phy,01 Classical,Classical,,Germany,2018 Brilliant Classics,2018 Brilliant Classics,,,,,,,,,,,,,,,,,,,,
2019,Brilliant Classics,BRI95813,5028421958132,Mauro Giuliani ,Giuliani: Guitar Solo & Chamber Music,Stefano Cardi; Enrico Casularo; Laura Polimeno; Andrea Orsi; Lorenzo Rubboli; Ilaria Mancino,1,CD,7.79,11.99,"A series of Brilliant Classics albums has uncovered the beguiling output of Mauro Giuliani (1781-1829) and revealed his importance to a modern audience. Concerto, duos, songs and arrangements of Rossini, Cimarosa and others demonstrate Giuliani's verve and versatility in marrying Spanish guitar traditions to the emerging Italian bel canto style. Giuliani always had an ear for a memorable tune, whether his or someone else's. There are two versions here of The Last Rose of Summer, and one of The Blue Bells of Scotland, though the Puglian composer never travelled beyond the shores of mainland Europe. The fashionable genre of variations on an operatic theme - of which Giuliani produced some 60 examples - is represented here by a set on 'Io ti vidi e t'adorai', from the opera Amazilia by Giovanni Pacini, who enjoyed a vastly more celebrated reputation than he does today. Stefano Cardi has also made selections from longer collections such as the Divertimenti notturni, the Choix de mes fleurs cheries and Zwölf neue Wald-Ländler: all brief, simple and yet colorful melodies. He plays them here on an original 1821 guitar made by Gennaro Fabricatore. Though it now resides in the possession of a Genovese museum, the instrument was originally owned by the writer and political activist Giuseppe Mazzini, who spearheaded the republican movement towards a unified Italy. In fact, as the booklet note reveals, Mazzini was also an enthusiastic amateur guitarist. This album thus holds a fascination as a multi-layered cultural artifact.",,https://b2b.naxosusa.com/Album.aspx?product=BRI95813&medium=phy,01 Classical,Classical,,Germany,2018 Brilliant Classics,2018 Brilliant Classics,,,,,,,,,,,,,,,,,,,,
2019,Brilliant Classics,BRI95868,5028421958682,Ermanno Wolf-Ferrari ,Wolf-Ferrari: Piano Music,Costantino Catena,1,CD,8.57,13.99,"The name of Ermanno Wolf-Ferrari (1876-1948) is now emerging from the shadow cast by his wartime collaboration with Italy's Fascist regime. Operas such as I quattro rusteghi and I gioielli della Madonna occupy a place on the fringes of the repertoire, and Brilliant Classics have made a persuasive case for him as a composer of chamber music in a post-Brahmsian mould with the release of his piano trios. This album was recommended by Classics Today for the 'eloquently sustained' performance of Trio Archè, displaying 'a whimsical discursiveness... that might be described as the lovechild of Schubert and Fauré.' Much the same might be said of Wolf-Ferrari's piano music on the evidence of this new recording by the Italian pianist Costantino Catena, who has made many well-received albums with the Camerata Tokyo. To open the album, Catena has made his own completion of an early, substantial (19-minute) Bagatelle that Wolf-Ferrari left unfinished. Theatricality and high contrast mark the Bagatelle throughout, as one would expect from an experienced composer for the stage, and they lend beguiling variety to the other first recordings here, of Variations on the minuet from Verdi's Falstaff, a Chopin-Phantasie in B minor and a Scherzino, all dating from Wolf-Ferrari's prodigious twenties when he was the toast of new Italian music. Wolf-Ferrari turned to the Romantic genre of character-piece in three Impromptus Op.13 (1904) and three Klavierstücke Op.14 (1905), but he addressed the form in a personal and authentic manner. Some of the rhythmic sophistication may remind us of Brahms, and the delicately embroidered harmony of Hugo Wolf, but Wolf-Ferrari's characteristic sweetness of tone does not descend into decorative mannerism or affected sentimentalism: he was, to the core, a German-Italian composer with a foot on both sides of the Alps.",,https://b2b.naxosusa.com/Album.aspx?product=BRI95868&medium=phy,01 Classical,Classical,,Germany,2018 Brilliant Classics,2018 Brilliant Classics,,,,,,,,,,,,,,,,,,,,
2019,Brilliant Classics,BRI95869,5028421958699,Anonymous; Giuseppe Antonio Brescianello ,Gabor Tokodi: Music for Mandora,Gabor Tokodi,1,CD,7.79,11.99,"It is an unfortunate accident of history that the mandora, if heard at all, is now encountered in company with the 'Jew's harp' thanks to a pair of undistinguished concertos by Albrechtberger. In fact the mandora has a far more mellifluous timbre than its instrumental cousin, and its subtle palette of tone-colors is heard to best advantage in solo repertoire, such as the pair of anonymous Suites and the G minor Sonata by Giuseppe Antonio Brescianello (1690-1757) played on this new recording by Gábor Tokodi. A closer comparison to the mandora would be with the lute. They share a transparent, silvery sound that is often lost in ensemble; the biggest difference is their outward appearance. An 8-course Renaissance lute usually has 15 strings, and a 13-course Baroque lute has 24, whereas the anonymous Budapest manuscript from which Tokodi has drawn this Suite in C major requires an instrument with only six. In fact, the mandora evolved during the 18th century into an instrument tuned to the same strings as the classical guitar. The mandora and its music were cultivated primarily in South Germany and in the neighbouring Danube region of the Habsburg Empire. One particular aristocrat of the region cultivated her playing of the mandora and accordingly accumulated a substantial library of music for the instrument, among which may be found 16 sonatas by Brescianello, which make demands far beyond the capabilities of a dilettante. Further library sources in Bratislava and Budapest supply the material for the other two composite works to be enjoyed here. A cellist by early training, Tokodi began to play the guitar at the age of 15, and it was with this instrument that he graduated as a performer, and has since toured Europe and further afield with distinguished early-music ensembles such as the Savaria Baroque Orchestra and the Baroque Ensemble of the Budapest Festival Orchestra.",,https://b2b.naxosusa.com/Album.aspx?product=BRI95869&medium=phy,01 Classical,Classical,,Germany,2018 Brilliant Classics,2018 Brilliant Classics,,,,,,,,,,,,,,,,,,,,
2019,Brilliant Classics,BRI95916,5028421959160,Johannes Brahms ,Michael Volle Sings Brahms,Michael Volle,3,CD,10.91,16.99,"''I'm very happy,' remarks Michael Volle in a booklet interview accompanying this reissue, which gathers together the three albums of Brahms Lieder he made in the spring of 2007. 'Normally if you listen to a recording you would like to redo it immediately, because you discover so many mistakes or things you would have done better. But this one, it's OK. Recordings will not always make money or sell a lot of discs, but for an artist, they can be a wonderful memory of a certain period in your life.' For Klassik.com, these recordings were deemed a 'beautiful achievement': especially in 'Es träumte mir' and 'Unbewegte laue Luft' Op.57 Nos. 3 and 8: as exciting as it is atmospheric, reaching a climax of subtly varied timbre in the Vier ernste Gesänge. Volle also scores highly in Die schöne Magelone.' Volle is joined here by his brother Hartmut for the recitation of Tieck's complementary prose text, which many recordings omit. Klassik.com also drew particular attention to the sympathetic partnership of Volle with the mezzo-soprano Stephanie Irányi and Volle, 'perfectly coordinated' in the Four Duets Op.28 and a selection from the Deutsche Volkslieder WoO33, from which Brahms took particular pleasure late in life. Volle's 'warm, sympathetic baritone' (Gramophone) and personal conviction illuminate all the repertoire here, which is drawn from throughout the composer's song-writing career. 'When I sing Brahms,' reflects Volle, 'I feel the deep musicality and also humanity and maybe also unfulfilled love he was looking for. Like Schubert he puts his feelings in the music and it takes everything from me when I do it. For me he's a really great Lieder composer.'",,https://b2b.naxosusa.com/Album.aspx?product=BRI95916&medium=phy,01 Classical,Classical,,Germany,2018 Brilliant Classics,2018 Brilliant Classics,,,,,,,,,,,,,,,,,,,,
2019,Calliope,CAL1852,3760039833242,Antonio Vivaldi ,Vivaldi: Concerti da camera,Il delirio Fanntastico,1,CD,14.81,22.99,"Absolute gems of the Vivaldian production, the Concerti da Camera belong to a unique genre, invented by the composer: they are concertos for several soloists but without orchestra! Vivaldi develops an extraordinary inventiveness, fertile in discoveries and fantasy. Founded by harpsichordist Vincent Bernhardt, the ensemble Il delirio fantastic is a group of young musicians specialized in Baroque music and in the playing of historical instruments. It consists mainly of former student of the famous European universities and conservatories. Il delirio fantastic explores actively unheard music from the Italian and German baroque repertoire, while approaching as well the classics and particularly the music of Antonio Vivaldi. Between 2009 and 2012, Il delirio fantastic has presented a series of concerts every month in Lyon, dedicated to the sacred cantatas of J.S. Bach and to some other lesser-known Baroque composers such as Fux, Graupner, Heinichen, Pisendel, Frey, Pfeifer, Graun, Camerloher, Somis, Giay, and others.",,https://b2b.naxosusa.com/Album.aspx?product=CAL1852&medium=phy,01 Classical,Classical,,,2018 Music Square,2018 Calliope Music Square,,,,,,,,,,,,,,,,,,,,
2019,Cantaloupe Music,CA21145,713746314521,Scott Wollschleger ,Wollschleger: American Dream,Bearthoven,1,CD,15.59,23.99,"The members of Bearthoven (pianist Karl Larson, double bassist Pat Swoboda, and percussionist Matt Evans) are a piano trio in the jazz sense of the term, but in practice, they're a progressive classical ensemble that has become an expressive vehicle for a growing contingent of young composers. The trio's second release on Cantaloupe Music, American Dream, focuses on the work of composer Scott Wollschleger, and includes three new pieces: the epic title work, as well as Gas Station Canon Song and We See Things That Are Not There. Larson describes American Dream as "a reflection of the contemporary American state of mind." Rather than making a direct political statement, the album reflects the contradictory nature of the "American Dream" in our current socio-economic climate. "This music expresses the strongest sense of urgency I've experienced in my entire life," Wollschleger explains, "channeling feelings of doom, optimism, hopelessness, and the sublime. Much like a dream, these pieces weave an interconnected musical fabric of contradictory worlds." In essence, it's a direct reference to a modern American paradox: how the majestic and the repellent always seem to coexist in a state of flux, no matter the medium. American Dream is laden with rich melodies and jarring dissonances that interconnect throughout, creating a sonic experience that's by turns cinematic, surreal, contemplative, provocative -- and ultimately, empowering.",https://www.youtube.com/watch?v=eiBnXDuemFw,https://b2b.naxosusa.com/Album.aspx?product=CA21145&medium=phy,01 Classical,Classical,Classical|Modern Era,United States,2019 Cantaloupe Music,2019 Cantaloupe Music,,,,,,,,,,,,,,,,,,,,
2019,Capriccio,C5305,845221053059,Astor Piazzolla ,Piazzolla: Maria de Buenos Aires,Daniel Bonilla Torres; Luciana Mancini; Johannes Mertes; Lothat Henser; Beethoven Orchester Bonn,2,CD,19.49,29.99,"'María de Buenos Aires brought me inner peace, a partial serenity that has changed my way of approaching music. I reached the zenith of my musical life at the time. (Astor Piazzolla) Piazzolla himself equated María to the tango and its historical ups and downs; and this is probably also the primary aid to understanding the reception of the contents of the piece. Next to that, there is also a musical diction that is entirely unique in the second half of the 20th century, indeed in the New Music scene as a whole. 'I learnt something: to be patient, to be self-critical, to co-ordinate reflection with passion. Now I am told: 'That is a different Piazzolla', but that is not the case. I am the same man, but I have reached a synthesis'. (Astor Piazzolla)",,https://b2b.naxosusa.com/Album.aspx?product=C5305&medium=phy,01 Classical,Classical,Classical|Opera,Austria,2019 Capriccio,2019 Capriccio,,,,,,,,,,,,,,,,,,,,
2019,Capriccio,C5357,845221053578,Gottfried von Einem,von Einem: Orchestral Works,Berlin Radio Symphony Orchestra,1,CD,13.25,20.99,"Gottfried von Einem was one of those great composer personalities that played a major role in rebuilding the waste of the Austrian music scene after 1945, following the devastating cultural policies of Austrofascism, which were above all hostile to modern trends, and even more so those of the Nazis. We owe Einem not least his rescue of the note material of many works by banned colleagues from destruction. Catchy thematic and melodic ideas, sharply accentuated rhythm, strong gestural and dance-like energy and a pronounced feeling for differentiated timbres determined Gottfried von Einem's musical diction at an early age, features he retained throughout his life. On this release, the Rundfunk-Sinfonieorchester Berlin explores some of Einem's finest compositions.",,https://b2b.naxosusa.com/Album.aspx?product=C5357&medium=phy,01 Classical,Classical,Classical|Orchestral,Austria,2019 Capriccio,2019 Capriccio,,,,,,,,,,,,,,,,,,,,
2019,Capriccio,C5364,845221053646,Isang Yun ,Yun: Chamber Music,Shota Takahashi; Georg Arzberger; Maria Stange; Egidius Streiff; Mariana Doughty; Walter Grimmer; Kaya Han; Markus Stange ,1,CD,13.25,20.99,"Isang Yun's works are inconceivable without the East Asian philosophy of the Tao. The more than one hundred works composed by Isang Yun in Europe combine national tradition with international modernity. Yun found his way to an individual sound in Europe through the reminiscence of Chinese-Korean court music. Furthermore, the oeuvre is characterized by the flexible, lively tone of the traditional music of his home, by the art of the flowing transition from the spirit of the Tao. The chamber music occupies an important role in Yun's oeuvre; the composer experimented with not only the most diverse and also unusual combinations of instruments, but also continued to compose in traditional classical genres. The present release features his East-West-Miniatures, his Quartet for Oboe and String Trio, and more.",,https://b2b.naxosusa.com/Album.aspx?product=C5364&medium=phy,01 Classical,Classical,Classical|Chamber Music,Austria,2019 Capriccio,2019 Capriccio,,,,,,,,,,,,,,,,,,,,
