2019,Double Moon Records,DMCHR71360,0608917136029,Michel Reis; Sigurdur Flosason; Marc Demuth; Jeff Herr ,Sigurdur Flosason DeLux 4Tet: Here & Now,Sigurdur Flosason DeLux 4Tet,1,CD,13.25,20.99,"Saxophonist Sigurdur Flosason writes: "'Music is the universal language of mankind' is a frequently cited quote by the 19th century American poet Henry Wadsworth Longfellow. Well, if that's the case, jazz is certainly my favorite dialect. The spontaneity and collaborative nature of jazz makes it ideal for swiftly building bridges between groups of musicians and audiences alike. Nothing is as musically exciting and refreshing as a newly forged relationship of outstanding jazz performers and composers, especially when brought together in the close comfort and proximity of one's living room. This was to be the beginning of what has now developed into a well-brewed and mature unity of musicians that have since then performed at jazz festivals in both Luxembourg and Reykjavik and have now recently recorded this outstanding album, featuring compositions from all four members." The compositions on this album provide a good framework for the musical dialogue. Ranging from melodic ballads such as Flosason's 'Father of Light' and Reis' 'Thank you letter,' the folkish melody and melancholy of Demuth's 'Dante' and Reis' 'Tundra,' to Flosason's more calculated and intellectually infused 'Counting sheep' and 'Forty-nine,' over to Herr's mystic and haunting 'Moonglow.'",,https://b2b.naxosusa.com/Album.aspx?product=DMCHR71360&medium=phy,02 Jazz,Jazz,,Austria,2018 Challenge Records,2018 Challenge Records,,,,,,,,,,,,,,,,,,,,
2019,DUX,DUX1298,5902547012988,Grazyna Bacewicz; Mikolaj Gorecki; Krzysztof Lenczowski; Dawid Lubowicz; Karol Szymanowski,NFM Leopoldinum Chamber Orchestra: Made in Poland,Atom String Quartet; NFM Leopoldinum Chamber Orchestra; Christian Danowicz,1,CD,15.59,23.99,"There is no doubt that music is one of the best Polish export goods, at least since the times of Zielenski and Chopin. It is no different with the A-list of twentieth-century composers where Karol Szymanowski and Grazyna Bacewicz certainly occupy one of the highest places in rank. Their music paved the way for many years ahead, creating patterns, such as interest in folklore or formal discipline and melodic invention, which are still important points of reference for contemporary composers. The present release features a lineup of works by contemporary Polish composers, including Lubowicz, Szymanowski, Goreki, and more, performed by the Atom String Quartet and the NFM Leopoldinum Chamber Orchestra under Christian Danowicz.",,https://b2b.naxosusa.com/Album.aspx?product=DUX1298&medium=phy,01 Classical,Classical,,Poland,2017 DUX Recording Producers,2017 DUX Recording Producers,,,,,,,,,,,,,,,,,,,,
2019,Farao Classics,B108104,4025438081045,Franz Doppler; Carl Doppler ,Andras Adorjan & Emmanuel Pahud: Doppler Discoveries,Andras Adorjan; Emmanuel Pahud; Jan Philip Schulze; Arcis Horn Quartet ,1,CD,13.25,20.99,"With his discoveries, András Adorján has put paid to the long-held misconception that the works for flute by the Doppler brothers consist only of popular paraphrases, potpourris and variations. In the early 1970s, for example, he found an unpublished and thus unknown Double Concerto for two flutes by Franz Doppler, and recently - among several other works that were thought to be lost - a Sonata by the same composer. As if the Double Concerto had been just the composition the flute world was waiting for, it immediately became a standard work in the repertoire. It has been very frequently performed since then and was already recorded in 1976 by András Adorján together with the doyen of flautists, Jean-Pierre Rampal (ERATO). Now, these new Doppler ""Discoveries"" are also so attractive that the most eminent representative of the current flute scene, Emmanuel Pahud, enthusiastically agreed to help record them. With their highly appealing musical effects, the Doppler brothers have thus managed to create a bridge between two leading flautists of their respective generations.",,https://b2b.naxosusa.com/Album.aspx?product=B108104&medium=phy,01 Classical,Classical,Classical|Chamber Music,Germany,2018 FARAO classics,2018 FARAO classics,,,,,,,,,,,,,,,,,,,,
2019,Genuin,GEN 19650,4260036256505,Thomas Haigh; Joseph Haydn; Christian Ignatius Latrobe ,Rebecca Maurer: Joseph Haydn & his London Disciples,Rebecca Maurer,1,CD,14.81,22.99,"What did Haydn sound like while he was on tour in London, giving concerts and teaching? Today, nobody perhaps comes closer to the sound from that time than Rebecca Maurer, who plays here on her original London fortepiano from 1816. Furthermore, the internationally sought-after fortepiano virtuoso does this with dazzling technique and immaculate stylistic confidence. The repertoire is also sensational, above all because it is not every day that one finds world premiere recordings by Haydn students on program flyers: fragrant music of Sentimentalism with some hints of Romanticism by Thomas Haigh and Christian Ignatius Latrobe. Outstanding repertoire! Equally at home on the fortepiano and harpsichord, Rebecca Maurer is acclaimed as one of the outstanding specialists for historical keyboard instruments of her generation. She studied piano, harpsichord and fortepiano in Freiburg, Amsterdam and at Cornell University where she held a fellowship. Her previous recording was nominated for the Preis der Deutschen Schallplattenkritik as well as for an International Classical Music Award in the Baroque instrumental category.",,https://b2b.naxosusa.com/Album.aspx?product=GEN%2019650&medium=phy,01 Classical,Classical,Classical|Piano,Germany,GENUIN classics,GENUIN classics,,,,,,,,,,,,,,,,,,,,
2019,Genuin,GEN 19637,4260036256376,Ludwig van Beethoven; Johannes Brahms; Frederic Chopin; Claude Debussy; Franz Liszt ,Jennifer Lim: ... into the night,Jennifer Lim,1,CD,14.81,22.99,"Jennifer Lim presents a quiet, introspective piano album with GENUIN: just in time for Valentine's Day, her recording of Romantic works such as Liszt's Liebestraum, Beethoven's Moonlight Sonata and Debussy's Clair de Lune is being released. Lim's transparent playing allows these classics to radiate from within, lending them contours so that the well-known works receive a new glow. Several nocturnes and a small, fine Andantino by Brahms round off a program that, according to the interpreter's wishes, allows us to travel ""into the night"" - Into its magic, mysterious darkness. Having started to play the piano before the age of five, Korean-Canadian pianist Jennifer Lim made her first public appearance one year later and came into the spotlight when she captured the Grand Prize at the Korea Times National Music Competition at age eight. She studied privately with Jane Coop and Anton Kuerti in Canada, and with Peter Serkin at The Curtis Institute of Music in Philadelphia, where she was awarded the coveted Rachmaninoff/Festorazzi prize. She then completed her master's degree at The Juilliard School in New York City as a protégée of the legendary pianist Bella Davidovich.",,https://b2b.naxosusa.com/Album.aspx?product=GEN%2019637&medium=phy,01 Classical,Classical,Classical|Piano,Germany,GENUIN classics,GENUIN classics,,,,,,,,,,,,,,,,,,,,
2019,Genuin,GEN 19635,4260036256352,Ludwig van Beethoven; Alban Berg; Claude Debussy; Christoph Schneider; Carl Maria von Weber ,Christoph Schneider: Spectrum,Christoph Schneider; Yuliya Balabicheva,1,CD,14.81,22.99,"The young clarinetist Christoph Schneider is not only the 1st solo clarinetist of the Deutsche Oper am Rhein, but also winner of numerous prizes (such as the ARD Music Competition and the Concours International ""Henri Tomasi""). And his GENUIN debut release as a duo with the equally highly acclaimed pianist Yuliya Balabicheva demonstrates why: this is playing at the highest level, featuring chamber music performed with great sensitivity. From classics such as Weber's Grand Duo to adaptations such as Beethoven's Spring Sonata to new music - and even by the musician himself: Schneider's crazy virtuoso ""Konstrukt"" experiences its world premiere recording on the present release. More of it!",,https://b2b.naxosusa.com/Album.aspx?product=GEN%2019635&medium=phy,01 Classical,Classical,Classical|Chamber Music,Germany,GENUIN classics,GENUIN classics,,,,,,,,,,,,,,,,,,,,
2019,Genuin,GEN 19634,4260036256345,Gaspar Cassado; Guillaume Connesson; Claude Debussy; Manuel de Falla; Enrique Granados; Francis Poulenc ,Maria Kliegel: Voyages Sonores,Maria Kliegel; Oliver Triendl,1,CD,14.81,22.99,"Maria Kliegel, one of the most sought-after cellists today, was once heralded by the great Rostropovich as ""La Cellissima."" She has won numerous prizes and two Grammy nominations. A personal compilation of exciting music for cello and piano is now available with her piano partner Oliver Triendl on her new GENUIN release ""Voyages Sonores."" The duo refers to the collection of works from Spain and France as a ""musical journey"" - music that shimmers in the sun and is Mediterranean, but at the same time is full of passion and darkness. And all this played in such an electrifying way that you immediately think you are on the Mediterranean: from Poulenc to de Falla, from Debussy to Granados ... Olé!",,https://b2b.naxosusa.com/Album.aspx?product=GEN%2019634&medium=phy,01 Classical,Classical,Classical|Chamber Music,Germany,GENUIN classics,GENUIN classics,,,,,,,,,,,,,,,,,,,,
2019,Genuin,GEN 19554,4260036255546,Manuel de Falla; Franz Liszt; Maurice Ravel; Robert Schumann; Marko Tajcevic ,Mirjana Rajic: Dances,Mirjana Rajic,1,CD,10.13,15.99,"Fire and passion, rhythm, and pulsating joie de vivre: that's what virtually jumps out when you put Mirjana Rajic's GENUIN debut album into the player and press ""play." There are original Balkan beats by Marko Tajcevic, nobles et sentimentales from France by Maurice Ravel as well as unworldly romantic frenzy by Robert Schumann. Mirjana Rajic, the young, internationally award-winning and celebrated pianist based in Dresden, pours her heart and soul into this release - and at an extremely high pianistic level! Born in Belgrade, Mirjana Rajic studied under legendary pianist Lazar Berman in Weimar and in Imola, Italy, in Belgrade under Srdjan Grbic and in Munich under Bianca Bodalia. She completed her piano performance degree with distinction in Dresden with Windfried Apel. She has also attended master classes with Andrew Ball, Aldo Ciccolini, Michel Dalberto, Rudolf Kehrer and Amadeus Webersinke. She is in great demand as a juror for international competitions and is herself the initiator and artistic director of the International Carl Maria von Weber Piano Competition in Dresden.",,https://b2b.naxosusa.com/Album.aspx?product=GEN%2019554&medium=phy,01 Classical,Classical,Classical|Piano,Germany,GENUIN classics,GENUIN classics,,,,,,,,,,,,,,,,,,,,
2019,Gramola Records,GR99183,9003643991835,Henriette Bosmans; Vitezslava Kapralova; Bohuslav Martinu; Charlotte Schlesinger; Vally Weigl ,EntArteOpera Festival - Chamber Music,Hermine Haselbock; Franz Bartolomey; Clemens Zeilinger,1,CD,14.81,22.99,"Since the year 2012, the association EntArteOpera has dedicated itself to holding yearly festivals celebrating the lively culture of remembrance and the revival of the extensive opus of forgotten, ostracized, persecuted by the Nazi regime, exiled or even murdered composers. The present recording's main focus is on songs and works by the female composers Henriette Bosmans, Vally Weigl, Charlotte Schlesinger and Vitezslava Kapralova, with the addition of the "Love Song" H 259 by Bohuslav Martinu. Hermine Haselböck, mezzo soprano, Franz Bartolomey, cello and pianist Clemens Zeilinger take you into the passionate and at the same time poetic sound worlds of four extraordinary female composers whose music is heard as rarity and discovery.",,https://b2b.naxosusa.com/Album.aspx?product=GR99183&medium=phy,01 Classical,Classical,Classical|Chamber Music,Austria,2018 Gramola,2018 Gramola,,,,,,,,,,,,,,,,,,,,
2019,Gramola Records,GR99173,9003643991736,Nico Dostal; Ernst Fischer; George Gershwin; Franz Lehar; Arnold Schonberg; Alexander Zemlinsky ,Junge Philharmonie Wien: Leichte Muse von Zemlinsky bis Gershwin,Ildiko Raimondi; Junge Philharmonie Wien,1,CD,14.81,22.99,"Soprano Ildiko Raimondi, the ensemble Young Philharmonic of Vienna and conductor Michael Lessky present immortal melodies from the first decades of the 20th century. Besides the world premiere recording of the "Lustspielouvertüre" (Comedy Overture) by Alexander Zemlinsky, which has been discovered by Michael Lessky as well as three songs from his estate that have been orchestrated by Lessky, two "Brettl-Lieder" by Schönberg as well as works by Lehár, Dostal and even Gershwin are featured - a compilation that is unusual only at first glance: it spins an arc from the "serious" composer to the "light muse" in the years from 1900 until the thirties, revealing interesting musical interrelations.",,https://b2b.naxosusa.com/Album.aspx?product=GR99173&medium=phy,01 Classical,Classical,Classical|Orchestral,Austria,2018 Gramola,2018 Gramola,,,,,,,,,,,,,,,,,,,,
2019,Gramola Records,GR99189,9003643991897,Anton Bruckner ,Bruckner: Symphony No. 7,Altomonte Orchester St. Florian,1,Hybrid SACD,17.15,26.99,"Dedicated to Ludwig II of Bavaria, Anton Bruckner's Symphony No. 7 in E major brought Bruckner the greatest success he had known in his life. The symphony is sometimes referred to as the "Lyric," though the appellation is not the composer's own, and is seldom used. The present release is part of the world's first major Bruckner cycle from his home of St. Florian, with the Altomonte Orchestra under Remy Ballot. Since 2013, the award-winning ensemble has recorded Bruckner's Third, Eighth, Ninth, Sixth, Fifth, and now Seventh symphonies. The "Gramola Bruckner Days Set" is already half full! The Altomonte Festival Orchestra was founded in 1996, the 100th anniversary of Bruckner's death, by the legendary church musician Augustinus Franz Dropfreiter and the cellist Thomas Wall. It counts among its members several of the highest-ranking musicians from the leading orchestras of Europe, together with some of the most outstanding of today's emerging young players. The name of the orchestra is taken from the18th Century father-and-son painters Martino and Barholomeo Altomonte, who adorned the magnificent rooms of the St. Florian Monastery with their beautiful, large-scale frescoes. Matthias Giessen has led the orchestra since 2003. From 2013, Rémy Ballot has conducted the orchestra, achieving widespread acclaim with his Bruckner interpretations.",,https://b2b.naxosusa.com/Album.aspx?product=GR99189&medium=phy,01 Classical,Classical,Classical|Orchestral,Austria,2018 Gramola,2018 Gramola,,,,,,,,,,,,,,,,,,,,
2019,Grand Piano,GP783,747313978328,Sulkhan Tsintsadze,Tsintsadze: 24 Preludes for Piano,Inga Fiolia,1,CD,13.25,20.99,"Lauded as one of the most original and brilliant of Georgian composers, Sulkhan Tsintsadze synthesized 20th-century classical elements with the rhythmic, melodic, harmonic, and modal characteristics of Georgian folk music. In so doing he developed, across a wide spectrum of the repertoire, his own highly personal and approachable idiom. His 24 Preludes for Piano were composed in 1971 and are unmistakably national in character. He gave new life to traditional Georgian folk songs and dances in a masterfully structured cycle that flows with the seamless eloquence of a film. This virtuosic kaleidoscope of contrasting images reveals music that is both extravagant and vibrant. Inga Fiolia studied at the Central Music School of the Tchaikovsky Conservatory in Moscow and the Cologne Musikhochschule with Alexey Nasedkin, Rudolf Kehrer and Vassily Lobanov. She has collaborated with orchestras including the Brussels Philharmonic, the Georgian State Chamber Orchestra and National Philharmonic, and the South Westphalia Philharmonic, and has broadcast on all the major German TV and radio stations.",,https://b2b.naxosusa.com/Album.aspx?product=GP783&medium=phy,01 Classical,Classical,,Germany,2019 HNH International Ltd. ,2019 HNH International Ltd. ,,,,,,,,,,,,,,,,,,,,
2019,Grand Piano,GP788,747313978823,Alexandre Tansman,Tansman: Piano Music played by Giorgio Koukl,Giorgio Koukl,1,CD,13.25,20.99,"The career of Polish composer Alexandre Tansman flourished in Paris after the First World War, though it's only in recent years that it has begun to be explored in depth in recordings. A refined but spiritually engaged neo-Classicism remained a constant feature of his music-making in Europe and in his temporary American exile, whether in the beautifully evocative travelogue Visit to Israel or in the clarity of the Interludes and Caprices. Giorgio Koukl is a pianist/harpsichordist and composer. He studied at both the Conservatories of Zurich and Milan, where he took part in the masterclasses of Nikita Magaloff, Jacques Fevrier, and Stanislaus Neuhaus, and with Rudolf Firkusny, friend and advocate of Czech composer Bohuslav Martinu. It was through Firkusny that Koukl first encountered Martinu's music, prompting him to search out his compatriot's solo piano works. Since then he has developed these into an important part of his concert repertoire and is now considered one of the world's leading interpreters of Martinu's piano music. As a logical continuation of this work, Koukl has recorded the complete solo piano works of Paul Le Flem, Alexander Tchereprnin, Arthur Lourie, Vitezslava Kapralova, and Witold Lutoslawski.",,https://b2b.naxosusa.com/Album.aspx?product=GP788&medium=phy,01 Classical,Classical,,Germany,2019 HNH International Ltd. ,2019 HNH International Ltd. ,,,,,,,,,,,,,,,,,,,,
2019,Haenssler Classic,HC19008,881488190083,Johann Sebastian Bach; Domenico Scarlatti; Claude Debussy; Franz Liszt; Jean-Philippe Rameau ,Helene Schuetz: Saitenwechsel - Works for Solo Harp,Helene Schuetz,1,CD,14.81,22.99,"Helene Schuetz writes of this new release: "The inspiration for this recording and the choice of works came from the Gigue that ends J.S. Bach's Partita in B flat major. When I first heard it in concert I knew immediately that this composition would work wonderfully for the harp. With the Gigue as my starting point, I began to arrange the Partita for harp. Of course, the instrument does have other tonal qualities than the piano - and, like any instrument, it has its technical limits when it comes to performance practice. When it comes to chromaticism, the mechanics of the harp are more limited than those of the piano, and one only has eight rather than ten fingers to play with. But it was precisely that challenge that fascinated me in the process of arranging the works: you first need to have a clear idea of the work's intention and to have formed your own view of its interpretation. The task then is to find ways and means to develop one's ideas and perhaps to achieve an even clearer interpretation than would have been possible on the original instrument. In this way, arranging the work for another instrument intensifies the performance, because the use of a new instrument allows other, new facets in the compositions to be illustrated and new tonal nuances achieved..."",,https://b2b.naxosusa.com/Album.aspx?product=HC19008&medium=phy,01 Classical,Classical,Classical|Solo Instrumental,Germany,2018 Profil Medien,2018 Profil Medien,,,,,,,,,,,,,,,,,,,,
2019,Haenssler Classic,HC18072,881488180725,Johann Sebastian Bach,Bach: Flauto traverso obbligato!,Peter-Lukas Graf ,2,CD,17.93,27.99,"The flute solos from the Bach cantatas require great performers. Some 300 years after they were premiered, the Bach Collegium Stuttgart and Hänssler Classic are pleased to celebrate Peter-Lukas Graf, one of their most eminent soloists! Our selection presents them in what we hope is a pleasing, varied manner and concentrates on bringing out a wide color palette: in addition to the well-known trio sonata form (i.e. two instruments and continuo), the listener will also find pieces associating the flute with another instrument (or more) - such as a second flute, one or two oboi d'amore, a violin sometimes playing in unison - or works in which the flute is accompanied by the full string section, and four choruses from four different cantatas, each with a concertante flute part.",,https://b2b.naxosusa.com/Album.aspx?product=HC18072&medium=phy,01 Classical,Classical,Classical|Baroque Era,Germany,2018 Profil Medien,2018 Profil Medien,,,,,,,,,,,,,,,,,,,,
2019,Haenssler Classic,HC18103,881488181036,Johann Nepomuk Hummel,Hummel: Flute Sonatas,Dorothea Seel; Christoph Hammer ,1,CD,14.81,22.99,"Dorothea Seel has engaged intensively both with the instruments and also with the playing techniques and sound aesthetics of 19th-century flutes and presented her findings in her artistic and scientific dissertation "Der Diskurs um den Klang der Flöte im 19. Jahrhundert" ("the discourse about the sound of the flute in the 19th century", Kunstuniversität Graz 2017, in preparation for publication). Evaluation of teaching works put her on the track of forgotten playing techniques. These practices, many of which would meet with the disapproval of modern-day exponents, include overlapping of notes, a glissando effect that the keys of modern instruments no longer permit. Dorothea Seel uses this and other techniques on the present recording. In congenial partnership with Christoph Hammer, she also sheds new light on the extraordinarily varied sound world of the 19th century and puts proven theory into virtuoso practice. She challenges the conventions that govern our listening and admirably illustrates the potential of research-based period performance practice. Above all, however, the works of Johann Nepomuk Hummel sound so utterly new, fresh and stimulating.",,https://b2b.naxosusa.com/Album.aspx?product=HC18103&medium=phy,01 Classical,Classical,Classical|Chamber Music,Germany,2018 Profil Medien,2018 Profil Medien,,,,,,,,,,,,,,,,,,,,
2019,III Millennio,IIIMIL 0169,8026097020501,Joan Ambrosius; Anonymous; Thoinot Arbeau; Pierre Attaignant; Domenico Baronio; Fabritio Caroso; Guglielmo Ebreo; Giovanni Giacomo Gastoldi; Pierre Phalese Liber; Giorgio Mainerio; Cesare Negri; Domenico da Piacenza; Tieleman Susato ,La Rossignol: Arie e Danze Cortigiane - Musica Rinascimentale,La Rossignol ,1,CD,14.03,21.99,"The Italian Renaissance was an extraordinarily creative period in all areas of knowledge. Music and dance belonged to a season of incredible richness in which all the great masterpieces followed one after another in a fascinating and astonishing rise in all the town courts poets, painters, sculptors, musicians, and dancers gave life and movement to an ever-changing society. Although dance was prohibited in medieval times, it, was later considered a moral activity of educational merit and was thus treated as a refined and elegant art with a precise written form. Festivities were the natural context for dance, a complex cast of movement often reflecting ceremonial celebrations of the royalty (engagement, wedding, birth, battle victory etc... all Renaissance court activity). On the present release, the ensemble La Rossignol explores dance tunes by Renaissance composers.",,https://b2b.naxosusa.com/Album.aspx?product=IIIMIL%200169&medium=phy,01 Classical,Classical,Classical|Renaissance,Italy,III Millennio,III Millenio,,,,,,,,,,,,,,,,,,,,
2019,Incises,INC003,3701174600078,Various ,Fabrice Moreau Quintet: Double Portrait,Fabrice Moreau,1,CD,14.81,22.99,"Fabrice Moreau writes of his new release: "As a drummer I think of improvisation the moment I play a note, written or not. The rehearsal/creation of my compositions was a two-stage process- firstly, playing the music as written in the score like a 'traditional' orchestra would do, then detaching oneself from the score and working on stepping back, on silence and the emergence of melodic lines like memories that suddenly surface. I wanted to link my music with my painting, to connect the drummer's gesture to the painter's. I make no distinction between the two disciplines, I have always had a very close relationship with them and I've always felt an almost simultaneous desire to play/compose and to paint, to externalize a vision and an inner song. And navigating this sometimes limpid, sometimes mysterious musical or pictorial language, one foot in reality, the other elsewhere, I like to feel a giddiness and find what I haven't been looking for."",,https://b2b.naxosusa.com/Album.aspx?product=INC003&medium=phy,02 Jazz,Jazz,,France,2018 unik access,2018 unik access,,,,,,,,,,,,,,,,,,,,
