2019,Accentus Music,PHR0110,7640165881101,Anton Bruckner ,"Bruckner: Symphony No. 4 ""Romantic""",Philharmonia Zurich,1,CD,13.25,20.99,"Anton Bruckner described his Fourth Symphony as "Romantic," and under this name it soon became his most popular work. Introduced by an idyllic horn call motif, the Fourth Symphony - Bruckner's first in a major key - is characterized by a warm, natural, luminous underpinning. Both the slow movement, with its funeral march character, and the sometimes frighteningly dark and powerful final movement are in stark contrast to the symphony's initial warmth. As was often the case, Bruckner revised the symphony numerous times in the run-up to its premiere, which was given by the Vienna Philharmonic in 1881. Fabio Luisi recorded the 1878 version, with the finale from the 1880 version, with the Philharmonia Zürich. This version has long-since established itself as the official concert version of Bruckner's Fourth Symphony.",,https://b2b.naxosusa.com/Album.aspx?product=PHR0110&medium=phy,01 Classical,Classical,Classical|Orchestral,Switzerland,2018 Philharmonia Records,2019 Philharmonia Records,,,,,,,,,,,,,,,,,,,,
2019,Accentus Music,ACC30471,4260234831849,Johann Sebastian Bach ,"Bach: Cantatas BWV 33, 17, 99",Thomanerchor Leipzig; Julia Sophie Wagner; Stefan Kahle; Wolfram Lattke; Tobias Berndt; Sachsisches Barockorchester,1,CD,13.25,20.99,""Dealing with the Bach cantatas is a lifelong and wonderful task and challenge. Despite decades of experience with the works, new aspects are being discovered every day," says Gotthold Schwarz, 17th Thomaskantor after Johann Sebastian Bach. The cantatas on this first recording of the Thomanerchor Leipzig under the musical direction of Schwarz, speak about the human certainty of being secure in and with God (BWV 17: "How a father has mercy on his young children") and the confidence that God will deliver man from all trouble (BWV 33: "I call on thee in whom I trust"). There is no better credo that the Thomanerchor Leipzig and their Thomaskantor could base their joint path on.",,https://b2b.naxosusa.com/Album.aspx?product=ACC30471&medium=phy,01 Classical,Classical,Classical|Baroque Era,Germany,2018 Accentus Music,2018 Accentus Music,,,,,,,,,,,,,,,,,,,,
2019,Accentus Music,ACC10440,4260234831788,Aaron Avshalomov; Pyotr Ilyich Tchaikovsky; Dmitri Shostakovich,Avshalomov: Hutongs of Peking; Tchaikovsky: Violin Concerto; Shostakovich: Symphony No. 5,Maxim Vengerov; Shanghai Symphony Orchestra,1,Blu-ray,31.19,47.99,"For the first time ever, a Chinese symphony orchestra is performing at Lucerne Festival. If yet more evidence that classical music has long since become a global language were needed, it would be this appearance by the Shanghai Symphony Orchestra under music director Long Yu. These musicians from Asia have planned a program of three Russian composers. Aaron Avshalomov, who was born in 1894, served as a professor at the Shanghai Conservatory, where he taught from 1919 on; he was one of the founders of China's Western musical tradition. His tone poem Hutongs of Peking captures the sounds and voices that once echoed through the narrow alleys of the Chinese capital. Tchaikovsky's immortal Violin Concerto will be performed by one of the leading virtuosos of our time, Maxim Vengerov. And the orchestra will demonstrate the degree to which a composer under Stalin had to wrestle with his own identity with Shostakovich's Fifth Symphony. Here the composer reacts to the political demand to be popular and monumental - which leads to an absurdly overstated "jubilant" conclusion.",,https://b2b.naxosusa.com/Album.aspx?product=ACC10440&medium=phy,DVD/Blu-ray,DVD/Blu-ray,,EU,,2018 Accentus Music,,7,Long Yu; Maxim Vengerov; Michael Beyer; Shanghai Symphony Orchestra,,1,,2018 Accentus Music,,NR,NTSC,0,BD-25,,,"PCM Stereo, DTS HD Master Audio",Color,16:9,110,2018,
2019,Accentus Music,ACC20440,4260234831795,Aaron Avshalomov; Pyotr Ilyich Tchaikovsky; Dmitri Shostakovich,Avshalomov: Hutongs of Peking; Tchaikovsky: Violin Concerto; Shostakovich: Symphony No. 5,Maxim Vengerov; Shanghai Symphony Orchestra,1,DVD,19.49,29.99,"For the first time ever, a Chinese symphony orchestra is performing at Lucerne Festival. If yet more evidence that classical music has long since become a global language were needed, it would be this appearance by the Shanghai Symphony Orchestra under music director Long Yu. These musicians from Asia have planned a program of three Russian composers. Aaron Avshalomov, who was born in 1894, served as a professor at the Shanghai Conservatory, where he taught from 1919 on; he was one of the founders of China's Western musical tradition. His tone poem Hutongs of Peking captures the sounds and voices that once echoed through the narrow alleys of the Chinese capital. Tchaikovsky's immortal Violin Concerto will be performed by one of the leading virtuosos of our time, Maxim Vengerov. And the orchestra will demonstrate the degree to which a composer under Stalin had to wrestle with his own identity with Shostakovich's Fifth Symphony. Here the composer reacts to the political demand to be popular and monumental - which leads to an absurdly overstated "jubilant" conclusion.",,https://b2b.naxosusa.com/Album.aspx?product=ACC20440&medium=phy,DVD/Blu-ray,DVD/Blu-ray,,EU,,2018 Accentus Music,,7,Long Yu; Maxim Vengerov; Michael Beyer; Shanghai Symphony Orchestra,,1,,2018 Accentus Music,,NR,NTSC,0,DVD-9,,,"PCM Stereo, Dolby Digital 5.1, DTS 5.1",Color,16:9,110,2017,
2019,Accentus Music,ACC30470,4260234831818,Karol Szymanowski; Alexander Zemlinsky ,Szymanowski: Violin Concerto No. 1; Zemlinsky: Lyric Symphony,Polish National Radio Symphony Orchestra; Elina Vahala; Johanna Winkel; Michael Nagy,1,CD,13.25,20.99,"Karol Szymanowski's Violin Concerto No. 1 and Alexander von Zemlinsky's Lyric Symphony, composed only seven years apart, while differing widely differing in their choice of soloists, are united in their source of inspiration. The Lyric Symphony is Zemlinsky's best known work and an homage to Mahler's "Das Lied von der Erde". It sets poems by Bengali writer Rabindranath Tagore (1861-1941) to equally poetic music. Szymanowski likely received his inspiration for the violin concerto from "Noc Majowa" (May Night), a poem by the Polish poet Tadeusz Micinski. The work is recognized as the first "modern" violin concerto, as Szymanowski rejects the 19th-century tradition and the major-minor system, introducing a new music language full of ecstatic raptures and poetic tension.",,https://b2b.naxosusa.com/Album.aspx?product=ACC30470&medium=phy,01 Classical,Classical,Classical|Orchestral,Germany,2018 Accentus Music,2018 Accentus Music,,,,,,,,,,,,,,,,,,,,
2019,ACT Music and Vision,ACT9877-2,614427987723,Paulo Fresu; Richard Galliano; Jan Lundgren; Quincy Jones; Eduardo Di Capua; Alfredo Mazzucchi; Michel Legrand,"Fresu, Galliano, Lundgren: Mare Nostrum III",Paolo Fresu; Richard Galliano; Jan Lundgren ,1,CD,20.27,31.99,"The old saying that 'all good things come in threes' might be a cliché with no particular logic to it, but as a way to describe the virtues of Mare Nostrum, it's right on the money. Twelve years ago, Sardinian trumpeter Paolo Fresu, French accordionist Richard Galliano and Swedish pianist Jan Lundgren, all from the upper echelons of European jazz, formed their trio. Each has his roots in the musical tradition of his home country, and each has used it to develop his own musical language. These are musicians who bring their individuality and inspiration to a multitude of projects in modern jazz, and so transcend borders and connect genres. All three men have poetry in their playing. Their love of melody binds them together, and does so more than ever in this new third album. In fact, "Mare Nostrum III" completes a trilogy of albums. Right from the beginning of their decade-long collaboration, the group has had the idea of recording an album in each of their home countries. They made the first in Italy in 2007, and it took these busy musicians until 2016 to go to France and to record the sec ond. Their third destination was Sweden and the Nilento Studio in Gothenburg. "Once again," says Rene Hess, the Swiss producer of this album, "it was a pure pleasure to see the sheer ease with which Paolo, Richard and Jan can create such great music."",,https://b2b.naxosusa.com/Album.aspx?product=ACT9877-2&medium=phy,02 Jazz,Jazz,,Germany,2019 ACT Music + Vision GmbH & Co. KG,2019 ACT Music + Vision GmbH & Co. KG,,,,,,,,,,,,,,,,,,,,
2019,ACT Music and Vision,ACT9877-1,614427987716,Paulo Fresu; Richard Galliano; Jan Lundgren; Quincy Jones; Eduardo Di Capua; Alfredo Mazzucchi; Michel Legrand,"Fresu, Galliano, Lundgren: Mare Nostrum III",Paolo Fresu; Richard Galliano; Jan Lundgren ,2,Vinyl,33.53,51.99,"The old saying that 'all good things come in threes' might be a cliché with no particular logic to it, but as a way to describe the virtues of Mare Nostrum, it's right on the money. Twelve years ago, Sardinian trumpeter Paolo Fresu, French accordionist Richard Galliano and Swedish pianist Jan Lundgren, all from the upper echelons of European jazz, formed their trio. Each has his roots in the musical tradition of his home country, and each has used it to develop his own musical language. These are musicians who bring their individuality and inspiration to a multitude of projects in modern jazz, and so transcend borders and connect genres. All three men have poetry in their playing. Their love of melody binds them together, and does so more than ever in this new third album. In fact, "Mare Nostrum III" completes a trilogy of albums. Right from the beginning of their decade-long collaboration, the group has had the idea of recording an album in each of their home countries. They made the first in Italy in 2007, and it took these busy musicians until 2016 to go to France and to record the sec ond. Their third destination was Sweden and the Nilento Studio in Gothenburg. "Once again," says Rene Hess, the Swiss producer of this album, "it was a pure pleasure to see the sheer ease with which Paolo, Richard and Jan can create such great music."",,https://b2b.naxosusa.com/Album.aspx?product=ACT9877-1&medium=phy,02 Jazz,Jazz,,Germany,2019 ACT Music + Vision GmbH & Co. KG,2019 ACT Music + Vision GmbH & Co. KG,,,,,,,,,,,,,,,,,,,,
2019,Alba,ABCD 425,6417513104257,Pehr Henrik Nordgren ,Nordgren: A Finnish Elegy,Jari Valo; Jukka Harju; Ostrobothnian Chamber Orchestra,1,Hybrid SACD,14.81,22.99,"Pehr Henrik Nordgren (1944-2008) is considered by many composer colleagues, musicians and music experts as one of the leading and most interesting composers of his generation. Works on this recording (Horn Concerto, Violin Concerto Nr 4 and Rock Score) have all been recorded before, but are now updated to super audio sound with new soloists on ALBA records. The three works were composed between 1994 and 1997. In the beginning, Nordgren wrote most of his solo concertos in several separate movements. Later on, he preferred the one-movement form. The whole league of performers including the orchestra itself are Ostrobothnians, where the composer settled to work too.",,https://b2b.naxosusa.com/Album.aspx?product=ABCD%20425&medium=phydig,01 Classical,Classical,,Finland,2018 Alba Records,2018 Alba Records,,,,,,,,,,,,,,,,,,,,
2019,Alba,ABCD 429,6417513104295,John Cage; Henry Cowell; Timothy Ferchen; Lou Harrison; She-e Wu ,Osuma Ensemble: Hits,Osuma Ensemble; She-e Wu,1,CD,14.81,22.99,"Ms. Wu and Osuma met at the Majaoja percussion competition in 2015 in Tampere, where Ms. Wu was invited to act as a judicator. Being the organizing members of the competition, the players of Osuma joined forces with Ms. Wu in a concert that was held on the final night of the competition. The collaboration on Blue Identity's Finnish premiere proved to be fruitful and the idea for a recording was immediately established. Three years later, the result of the collaboration can be heard on Tim Ferchen's Partials of Colour and She-e Wu's Blue Identity. Osuma Ensemble was founded in 2006 in Finland. The ensemble has performed at various Finnish festivals such as the Tampere Biennale, the "Time of Music" in Vitasaari and the Kuhmo Chamber Music Festival, as well as the Summer Music Academy and Festival in Toronto. Osuma Ensemble performs classics of percussion music alongside new works, as well as the music of several cultures from around the world.",,https://b2b.naxosusa.com/Album.aspx?product=ABCD%20429&medium=phydig,01 Classical,Classical,,Finland,2018 Alba Records,2018 Alba Records,,,,,,,,,,,,,,,,,,,,
2019,Alba,ABCD 436,6417513104363,Heino Kaski ,Janne Mertanen: Yo Meren Rannalla - Heino Kaski Piano Works,Janne Mertanen ,1,CD,14.81,22.99,"The catalogue of Heino Kaski (1885 -1957) contains more than a hundred piano works, almost all of which are miniatures not exceeding four minutes. Kaski's style is typically lyrical, melody-centric, and serene in character. With a few exceptions, his piano music has remained in obscurity. Pianist Janne Mertanen studied at the Sibelius Academy in Helsinki, where his teachers included Erik T. Tawaststjerna and Dmitri Baskirov. He then completed his studies with Lazar Berman at the Accademia Pianistica in Imola, Italy. Mertanen was selected as the Young Artist of the 1st Espoo International Piano Festival in May 1991. Mertanen's first recording, Chopin Recital, was released in 1994 by Finlandia Records. Chopin Nocturnes vol. 1-2 won an award in the sixth International Record Competition Grand Prix Du Disque Frederic Chopin 2005 in Warsaw in October 2005. He is a Steinway Artist, and the Artistic Director of the Joensuu Music Festival.",,https://b2b.naxosusa.com/Album.aspx?product=ABCD%20436&medium=phy,01 Classical,Classical,,Finland,2018 Alba Records,2018 Alba Records,,,,,,,,,,,,,,,,,,,,
2019,Aliud,ACDBN0992,8717775551232,Antonio Vivaldi ,Vivaldi: Concertos per oboe,Joris van den Hauwe; Collegium Instrumentale Brugense,1,CD,13.25,20.99,""These girls are educated at the expense of the state to distinguish themselves in music. They sing like angels and play violin, flute, harpsichord, organ, oboe, cello and bassoon; in short, no instrument can deter them, however big it may be." That is what French humanist and historian Charles de Brosses wrote in1739 about the girls who received their schooling in the Venetian orphanages which he visited. In one of these institutions, the Ospedale della Pietà, Antonio Vivaldi worked as 'maestro di violino' and 'maestro di concerti'. One of his tasks was 'to provide concertos for our girls and compositions for all types of instrument'. This release features oboe concertos that Vivaldi wrote for these girls, performed by Joris Van den Hauwe who gained highest honors for his post graduate 'higher diploma' in oboe playing at the Royal Conservatoire of Music in Brussels. With this album he won the Choc de Classica.",,https://b2b.naxosusa.com/Album.aspx?product=ACDBN0992&medium=phy,01 Classical,Classical,,,2018 Aliud Records,2018 Aliud Records,,,,,,,,,,,,,,,,,,,,
2019,Alpha,ALPHA437,3760014194375,Jacques Offenbach ,Jodie Devos: Offenbach Colorature,Jodie Devos; Munchner Rundfunkorchester,1,CD,14.81,22.99,"Soprano Jodie Devos, who has signed with Alpha for several recordings, here pays homage to Offenbach, whose bicentenary of his birth is celebrated in 2019. This programme shows Offenbach's fascination with the vocal fireworks of coloratura divas. This kind of 'lyric coloratura' or 'soprano leggero' voice runs like a thread through most of the composer's oeuvre, from his first pieces for two or three soloists to those grand frescoes of his maturity, La Vie parisienne, Robinson Crusoe, and Orphee aux Enfers. The coloratura soprano also adorns Offenbach's less frivolous operettas (such as Fantasio), as well as his only serious opera, Les Contes d'Hoffmann, in which the role of the doll (with only one aria, but what an aria!) is among the most famous in the entire French repertoire. Concocted collaboratively with Alexandre Dratwicki and the Palazzetto Bru Zane, this recorded programme- tailor-made for Jodie Devos- presents innumerable rarities from Mesdames de la Halle, Boule-de-Neige, Un mari a la porte, Le Roi Carotte, Le Voyage dans la lune, and Vert-Vert. In the famous duet, Oiseaux dans la charmille, she is joined by up and coming mezzo-soprano Adele Charvet.",,https://b2b.naxosusa.com/Album.aspx?product=ALPHA437&medium=phy,01 Classical,Classical,Classical|Opera,Austria,2018 Palazetto Bru Zane & BR-Klassik & Alpha Classics / Outhere Music France,2018 Alpha Classics / Outhere Music France,,,,,,,,,,,,,,,,,,,,
2019,Alpha,ALPHA718,3760014197185,Francesco Cavalli ,Cavalli: Il Giasone,Capella Mediterranea; Valer Sabadus; Kristina Hammarstrom; Kristina Mkhitaryan; Willard White; Raul Gimenez; Dominique Visse; Mariana Flores; Migran Agadzharian; Mary Feminear,1,DVD,31.19,47.99,"This production of Francesco Cavalli's Il Giasone was filmed in January 2017 at the Grand Théâtre of Geneva. It forms a part of the 'Cavalli tetralogy' of the past few years, conducted by the man who has become Cavalli's great ambassador: Leonardo Garcia Alarcón. Il Giasone, Dramma musicale, in a Prologue and Three Acts, first performed on 5 January 1649, alternates the tragic with the comic, with no concern for fidelity to the mythological legend of Jason and Medea. Francesco Cavalli's opera, composed for the carnival season in Venice, presents a mosaic of contrasted episodes, rich in musical emotions. His music here attains a remarkable degree of evocative power, with la musica having the upper hand over la dramma. Il Giasone represents the subtle equilibrium between lyricism and narrative. The comic, the tragic, and the supernatural all meet and mingle, and Cavalli's Lamenti - forming the climax of the work - are particularly unequalled,. Resolutely burlesque and zany, Serena Singaglia's production celebrates the opera's sensuality. Le Temps commented: 'In the pit, the Cappella Mediterranea with Garcia Alarcón pursue a sense of musical flux with delicacy, lightness and quick-footedness, ideally responding to the score's demands. With an instrumental sound that is both round and sprightly, they succeed in capturing the ludic dimension of the work, its melodic freshness, and its harmonic tensions. Drama and rapture are artfully fused together."",,https://b2b.naxosusa.com/Album.aspx?product=ALPHA718&medium=phy,DVD/Blu-ray,DVD/Blu-ray,,Austria,,2018 Alpha Classics / Outhere Music France ,,18,Francesco Cavalli (Composer); Isabelle Soulard; Leonardo Garciá Alarcón; Valer Sabadus,,1,,,AT,NR,NTSC,0,DVD-5,,,,Color,16:9,1,2018,
2019,Animal Music,ANI070-2,8594155991358,Najponk; Count Basie; Con Conrad; Ervin Drake; Eddy Durham; Bill Evans; Dan Fisher; Carl Fisher; Danyel Gerard; Irene Higginbotham; Milton Jackson; Horace Parlan; Billy Strayhorn; Lester Young,Najponk: What's Next,Najponk; Hans Backenroth; Jiri Slavicek; Barney Kantor,1,CD,11.69,17.99,"An exquisite pianist and musician, Najponk is one of the pioneers of mainstream jazz on the Czech music scene. From the bottomless resources of mainstream jazz repertoire he has been picking gems for his own albums. But although his repertoire mainly consists of the so-called "standard" pieces, his recordings are informed by unusual inventiveness and his acute sense of style and rhythm. For each of the albums, Najponk usually invites different collaborators; "What's Next" has been recorded together with the famous Swedish double bassist Hans Backenroth and Czech drummer Jirí Slavícek. The selections chosen or this release include compositions by Milton Jackson, Count Basie, Danyel Gerard, and Najponk himself, among others.",,https://b2b.naxosusa.com/Album.aspx?product=ANI070-2&medium=phy,02 Jazz,Jazz,,Czech Republic,2018 Animal Music,2018 Animal Music,,,,,,,,,,,,,,,,,,,,
2019,Animal Music,ANI071-2,8594155991372,Zdenek Liska ,Liska: Marketa Lazarova,Katerina Knezikova; Josef Moravec; Jana Stepankova; Josef Somr; Anna Kratochvilova; Martinu Voices; Lukas Vasilek; Baborak Ensemble; Radek Baborak,2,CD,17.93,27.99,"Zdenek Liska's music for the feature film "Marketa Lazarová" represents the height of the legendary composer's legacy. In 2015, the first and so far the only concert performance of the work took place at the Fórum Karlín concert hall in Prague as part of the Strings of Autumn music festival. The work was performed as a 90-minute oratorio created by Petr Ostrouchov on the basis of the authorial manuscript, retaining the original orchestration. The performance featured vocal soloists Katerina Knezíková and Josef Moravec, actors Josef Somr and Jana Stepánková, and the ensembles Martinu Voices, conducted by Lukás Vasilek, and Baborák Ensemble, conducted by Radek Baborák. The production met with high critical acclaim and an enthusiastic response from the audience. Three years later, Animal Music and Strings of Autumn now issue a studio-mastered recording of that live performance which is also the first recording of Liska's composition since it was originally captured on the film soundtrack.",,https://b2b.naxosusa.com/Album.aspx?product=ANI071-2&medium=phy,01 Classical,Classical,,Czech Republic,2018 Animal Music,2018 Animal Music,,,,,,,,,,,,,,,,,,,,
2019,Animal Music,ANI072-2,8594155991389,Karel Ruzicka ,Karel Ruzicka Quartet: Grace & Gratitude,Karel Ruzicka Quartet; John Patitucci; Jon Cowherd; Nate Smith,1,CD,11.69,17.99,"Saxophonist Karel Ruzicka has lived in New York for more than twenty years where he has performed and recorded with many foremost musicians. Fourteen years after his first solo album came out, he now brings out his new recording, entitled "Grace & Gratitude". The lineup whom he has invited to work with him in the studio is exceptional: John Patitucci on the double bass, Jon Cowherd on the piano and Nate Smith on the drums form a veritable "all-stars" team to whom the happy Ruzicka has dedicated the first piece on the album, Brooklyn Brotherhood. The recording comprises exclusively Ruzicka's own compositions and brings us jazz of the highest quality in first-class performance and in beautiful",,https://b2b.naxosusa.com/Album.aspx?product=ANI072-2&medium=phy,02 Jazz,Jazz,,Czech Republic,2018 Animal Music,2018 Animal Music,,,,,,,,,,,,,,,,,,,,
2019,Animal Music,ANI073-2,8594155991365,K. K. Baczynski; Dorota Barova; Teresa Drozda; Beata Hlavenkova ,Dorota Barova: Iluzja,Dorota Barova; Miroslav Chyska; Jakub Vejnar ,1,CD,11.69,17.99,"Dorota Barova is a Czech singer and cello player well known to audiences as a member of numerous groups such as Tara Fuki and Vertigo. She has been playing, recording and collecting awards with both groups for more than 15 years now. She also performs with two popular Czech singers Aneta Langerová and Lenka Dusilová and in 2018 she unexpectedly entered into a new project of the members of the Slovak band Korben Dallas - Tugriki. Dorota Barová is now releasing her long-awaited first solo album ""Iluzja" (Illusion) consisting of her own new songs. The album was recorded in trio with the guitar player Miroslav Chyska (Illustratosphere, J.A.R., Sexy Dancers) and the bass player Jakub Vejnar (Muff) and with the pianist and singer Beata Hlavenková as a guest.",,https://b2b.naxosusa.com/Album.aspx?product=ANI073-2&medium=phy,02 Jazz,Jazz,,Czech Republic,2018 Animal Music,2018 Animal Music,,,,,,,,,,,,,,,,,,,,
2019,Animal Music,ANI074-2,8594155991396,Andy Schofield ,Schofield: Suite for JT,Andy Schofield; Jiri Slavik; Oskar Torok; Vojetch Prochazka; Marcel Barta,1,CD,11.69,17.99,"The British saxophonist Andy Schofield who is based in Prague and who has for many years performed with various formations, now releases his own album. "Suite for JT" is a forward-looking, original composition for nine players which Schofield created several years ago for Manchester International Festival and performed on its platform together with the illustrious pianist John Taylor to whom the piece is dedicated. For the first studio recording of this composition, the author has surrounded himself with musicians who belong to the elite of Czech jazz, including Jirí Slavík, Daniel Soltis, Oskar Török, Vojtech Procházka and Marcel Bárta.",,https://b2b.naxosusa.com/Album.aspx?product=ANI074-2&medium=phy,02 Jazz,Jazz,,Czech Republic,2018 Animal Music,2018 Animal Music,,,,,,,,,,,,,,,,,,,,
2019,Animal Music,ANI075-2,8590233024468,Stepanka Balcarova; Martin Brunner; Zdenek Havlicek; Jan Jirucha; Filip Nactmann; Adam Michna z Otradovic; Jan Skacel; Lubos Soukup; Frana Sramek; Tomas Sykora ,Concept Art Orchestra: Grown-Up Christmas,Concept Art Orchestra; Dan Barta; Marketa Foukalova; Milan Cimfe,1,CD,11.69,17.99,"The previous album of the leading Czech big band "Concept Art Orchestra" received the Andel Award in 2015 for the best jazz album of the year. The recording entitled "The Prague Six" featured the work of six Czech important young authors: the band's conductor and trumpeter Stepánka Balcarová, saxophonist Lubos Soukup, pianists Vít Kristan, Martin Brunner and Tomás Sýkora, and trombonist Jan Jirucha junior. The same six authors are behind this new album entitled "Grown-up Christmas". The programme has been performed several times in concert and comprises originally arranged Christmas carols and songs loosely inspired by Christmas (for example poems by Czech poets Jan Skácel and Frána Srámek). Concept Art Orchestra has invited singers Dan Bárta, Markéta Foukalová and Milan Cimfe to collaborate on the project. Although the binding theme for all the compositions is, indeed, Christmas, this is not a classical seasonal recording which only has a potential to enhance the Christmas atmosphere, but will bring joy throughout the year.",,https://b2b.naxosusa.com/Album.aspx?product=ANI075-2&medium=phy,02 Jazz,Jazz,,Czech Republic,2018 Animal Music,2018 Animal Music,,,,,,,,,,,,,,,,,,,,
