2019,Naxos,8573885,747313388578,Andre Jolivet,"Jolivet: Complete Works for Flute, Vol. 1",Helene Boulegue; Francois Dumont,1,CD,10.13,15.99,"Andre Jolivet wrote for the flute throughout his entire compositional career. His understanding of the instrument's character was unrivalled and his contribution to its repertoire stands among the greatest in the 20th century. In his absorption of influences, from jazz to Middle Eastern music, he established a new tone for the flute, the oriental infusions of which can be heard in Cinq Incantations. Chant de Linos, his most popular flute piece, offers a mythic panorama full of lamentation and dance, while the rhythmically complex Flute Sonata and the lyric elements in Asceses affirm his musical convictions. Born in 1990, Helene Boulegue was appointed second flute of the Orchestra PHilharmonie Luxembourg at age 19, just six months after having started at the Paris Conservatoire where she studied with Pierre-Yves Artaud and Florence Souchard-Delepine. She went on to study for a Masters degree at the Hochschule fur Musik Karlsruhe, Germany with Renate Greiss-Armin, and was awarded Second Prize at the Prague Spring Competition in 2015 and First Prize at the Kobe International Flute Competition in 2017.",,https://b2b.naxosusa.com/Album.aspx?product=8573885&medium=phy,01 Classical,Classical,,Germany,2019 Naxos Rights Europe,2019 Naxos Rights Europe,,,,,,,,,,,,,,,,,,,,
2019,Naxos,8573906,747313390670,Johannes Sebastian Bach ,Vojin Kocic: Heinsberg International Guitar Competition Winner 2017,Vojin Kocic,1,CD,10.13,15.99,"Vojin Kocic, winner of the 2017 Heinsberg International Guitar Competition, presents a recital that not only covers a wide historical range but also includes some of the most challenging works in the guitar repertoire, of which Ponce's La Folia variations is considered a veritable Everest to be conquered. Following a long and distinguished tradition, Kocic's own arrangement of Bach's Second Violin Partita is crowned by the greatest of Baroque instrumental masterpieces, the monumental Ciaccona, Regondi's prodigious talent is reflected in his scintillating Introduction et Caprice, while Pasieczny's Phosphenes was composed as a test piece for a guitar competition. Born in Serbia in 1990, Vojin Kocic began playing guitar at the age of eight, studying with Jovica Milsevic and Darko Karajic. He went on to study with Anders Miolin at the University of Arts in Zurich, Switzerland, and was awarded a Bachelor of Arts, Master of Specialized Music Performance and Master of Pedagogy Diploma.",,https://b2b.naxosusa.com/Album.aspx?product=8573906&medium=phy,01 Classical,Classical,,Germany,2019 Naxos Rights Europe,2019 Naxos Rights Europe,,,,,,,,,,,,,,,,,,,,
2019,Naxos,8573456,747313345670,Eduardo Sainz de la Maza,Sainz del la Manza: Guitar Music,Jose Antonio Escobar,1,CD,10.13,15.99,"The brothers Eduardo and Regino Sainz de la Maza made significant contributions to the great lineage of Spanish guitar music in the 20th century. This selection of Eduardo's music reflects his technical and expressive breadth, whether in the magical tremolo study Campanas del alba ('The Bells of Dawn') or in the series of romantic and virtuosic homages paid to Haydn, Toulouse- Lautrec and his own instrument, the guitar. Platero y yo (Platero and I), a sequence of eight pieces narrating the activities of the donkey Platero, celebrates the beauty of nature, irradiated by glorious color, and is one of his greatest masterpieces.",,https://b2b.naxosusa.com/Album.aspx?product=8573456&medium=phy,01 Classical,Classical,,Germany,2019 Naxos Rights US,2019 Naxos Rights US,,,,,,,,,,,,,,,,,,,,
2019,Naxos,8573275,747313327577,Gottlieb Muffat,"Muffat: Suites for Harpsichord, Vol. 2",Naoko Akutagawa,1,CD,10.13,15.99,"Gottlieb Muffat, youngest son of composer and Kapellmeister Georg Muffat, was a keyboard virtuoso whose career was based around the Viennese Imperial Court. Muffat, with his own elegantly ornamented style, absorbing influences from Germany, France and Italy, is remembered as a composer from whom Handel borrowed extensively- a common practice of the period. These premiere recordings represent the remarkable rediscovery of manuscripts sequestered and dispersed after the Second World War. Naoko Akutagawa's previous recordings from Muffat's Componimenti musicali were described by MusicWeb International as 'galvanically virtuosic.' Naoko Akutagawa was born in Hiroshima in 1974, and began playing piano at the age of three. At 16 she switched to the harpsichord, studying first at the Toho Gakuen School of Music, and then at the Hochschule fur Musik Wurzburg, Germany, as a student of Glen Wilson. Her recordings have been broadcast by the BBC and the Australian Broadcasting Corporation.",,https://b2b.naxosusa.com/Album.aspx?product=8573275&medium=phy,01 Classical,Classical,,Germany,2019 Naxos Rights US,2019 Naxos Rights US,,,,,,,,,,,,,,,,,,,,
2019,Naxos Historical,8111409,747313340927,Various ,"Fritz Kreisler: The Complete Solo Recordings, Vol. 8",Fritz Kreisler; Carl Lamson; Michael Raucheisen; Arpad Sandor,1,CD,8.44,12.99,"We are indeed fortunate that Fritz Kreisler was still at the peak of his powers when electrical recording arrived in 1925. He was as busy as ever in the year covered by these recordings, using Vuillaume and Guarneri del Gesu violins that he said 'breathe and pulsate with a million vibrations.' On one of his many successful charity concerts in 1927 The Times commented that Kresler's 'fine-drawn phrases have the delicacy of a spider's thread, the suppleness of elastic, and the strength of steel.' With wonderful examples of parlando bowing, many demonstrations of beautiful double-stopping, lovely staccato and a myriad of other subtleties such as delicate rhythmic changes, harmonics and variations in dynamics, these New York and Berlin sessions include classic versions of Kresler's best works and a rare unaccompanied movement by Bach.",,https://b2b.naxosusa.com/Album.aspx?product=8111409&medium=phy,01 Classical,Classical,,EU,2019 Naxos Rights US,2019 Naxos Rights US,,,,,,,,,,,,,,,,,,,,
2019,Naxos Idil Biret Archive,8506035,747313603534,Various,Best of Idil Biret,Idil Biret,6,CD,23.39,35.99,""The Turkish pianist Idil Biret celebrated her 75th birthday in November 2016. To approach and honor this milestone, her own label (IBA), distributed by the now-venerable Naxos, has been releasing a series of comprehensive sets traversing her entire career. The word "comprehensive" is not used lightly; in this set alone, the ninth in the series, we hear performances from her earliest radio broadcasts in 1949 to July of 2016, allowing Biret's changing approaches to these composers' works full documentation and exploration; it's quite a journey, and I have heard no other pianist that has made the complex but still intuitively simple interpretive decisions Biret has made. With these enduring compositions as multisided sculptures to be reexamined, the set constitutes a voyage through the developing art of a child prodigy. It goes a long way toward answering questions about where the preternaturally gifted interpreter goes when convention and career opportunity become subservient to artistic pursuit. May it be an example to those embarking on a similar journey." (Prof. Marc Medwin)",,https://b2b.naxosusa.com/Album.aspx?product=8506035&medium=phy,01 Classical,Classical,,Germany,2019 Idil Biret,2019 Idil Biret,,,,,,,,,,,,,,,,,,,,
2019,NAXOS BLU-RAY VIDEO,NBD0090V,730099009065,Adolphe Adam ,Adam: Le Corsaire,Maria Yakovleva; Robert Gabdullin; Alice Firenze; Davide Dato; Francois Roussillon; Kirill Kourlaev; Liudmila Konovalova; Manuel Legris; Mihail Sosnovschi; Orchester der Wiener Staatsoper; Valery Ovsianikov; Wiener Staatsballett ,1,Blu-ray,19.49,29.99,"Since its very first performance in 1856 at the Paris Opéra, Le Corsaire has been regarded as one of the most impressive narrative ballets of the 19th century. This performance from 2016 is choreographed and conceived by the exceptional dancer, choreographer and director, Manuel Legris. Legris, as a member of the Paris Opéra Ballet in 1986, was appointed Danseur Étoile by the then ballet director, Rudolf Nureyev, and has since received multiple awards and honours for his work. He has been the director of the Wiener Staatsballett and artistic director of the Ballett Akademie der Wiener Staatsoper since 2010. Adolphe Adam's scintillating score features additional music by Delibes, Drigo, Pugni and others, selected by Legris, arranged by Igor Zapravdin, and performed by the orchestra of the Wiener Staatsoper, conducted by Valery Ovsianikov. Stellar Russian dancers Robert Gabdullin and Maria Yakovleva take the principal roles of Conrad and Médora in this elegant and impressive production.",,https://b2b.naxosusa.com/Album.aspx?product=NBD0090V&medium=phy,DVD/Blu-ray,DVD/Blu-ray,,Germany,,2019 Naxos Rights Europe; Wiener Staatsoper - ARTE France - Francois Roussillon et Associes - NHK - 2016,78 Documentaries,7,Adolphe Adam (Composer); Alice Firenze; Davide Dato; François Roussillon; Kirill Kourlaev; Liudmila Konovalova; Manuel Legris; Maria Yakovleva; Mihail Sosnovschi; Orchester der Wiener Staatsoper; Robert Gabdullin; Valery Ovsianikov; Wiener Staatsballett (Ensemble),,1,,,DE,,NTSC,Other,BD-50,English,,PCM stereo and DTS-HD 5.0,Color,16:9,120,2016,
2019,NAXOS DVD,2110594,747313559459,Adolphe Adam ,Adam: Le Corsaire,Maria Yakovleva; Robert Gabdullin; Alice Firenze; Davide Dato; Francois Roussillon; Kirill Kourlaev; Liudmila Konovalova; Manuel Legris; Mihail Sosnovschi; Orchester der Wiener Staatsoper; Valery Ovsianikov; Wiener Staatsballett ,1,DVD,19.49,29.99,"With its narrative of buccaneering bravado, exotic opulence, romance and traitorous intrigue, Le Corsaire is one of the most impressive narrative ballets of the 19th century, and it remains one of Adolphe Adam's best-known works. Director of the Wiener Staatsballett, Manuel Legris, has choreographed a new version that draws on the rich performance traditions of Russia and France, and carefully combines spirited action, Adam's delightful music, choreography, scenery and costumes into an elegant and impressive production which brings to life the colourful events that surround the leading couple of Conrad and Médora.",,https://b2b.naxosusa.com/Album.aspx?product=2110594&medium=phy,DVD/Blu-ray,DVD/Blu-ray,,Austria,,2019 Naxos Rights Europe; Wiener Staatsoper - ARTE France - Francois Roussillon et Associes - NHK - 2016,78 Documentaries,7,Adolphe Adam (Composer); Alice Firenze; Davide Dato; François Roussillon; Kirill Kourlaev; Liudmila Konovalova; Manuel Legris; Maria Yakovleva; Mihail Sosnovschi; Orchester der Wiener Staatsoper; Robert Gabdullin; Valery Ovsianikov; Wiener Staatsballett (Ensemble),,1,,,AT,,NTSC,0,DVD-9,English,,PCM stereo and DTS 5.0,Color,16:9,120,2016,
2019,Nimbus Alliance,NI6375,0710357637520,Jean-Michel Damase; Jean Francaix; Jacques Ibert; Jean River ,Ransom Wilson: 20th Century French Flute Concertos,Ransom Wilson; BBC Concert Orchestra,1,CD,14.81,22.99,"The four works gathered here belong to what could be described as the secret garden of twentieth-century French music. They remind one that, next to the handful of composers of the post-Debussy-Fauré generation that have found a secure place in posterity, such as Maurice Ravel, Albert Roussel, Francis Poulenc, and Olivier Messiaen, there were many others whose names may be less familiar, but who have also made outstanding contributions to the music of their time. Written over fewer than fifty years, the four works also testify to the pioneering role played by twentieth-century French musicians in reviving and promoting the flute as a solo instrument. Ransom Wilson, flutist and conductor has performed in concert with major orchestras the world over. As a flutist, he has recently launched an ongoing series of solo recordings on the Nimbus label in Europe. Conductor Perry So most recently made his European operatic debut at the Royal Danish Opera in Mozart's Die Zauberflote. He is known for his wide-ranging programming, including numerous world premieres on four continents and works from the Renaissance and the Baoque.",,https://b2b.naxosusa.com/Album.aspx?product=NI6375&medium=phy,01 Classical,Classical,Classical|Orchestral,United Kingdom,2019 BBC & Nimbus Records,2019 BBC & Nimbus Records,,,,,,,,,,,,,,,,,,,,
2019,Nimbus Alliance,NI6379,0710357637926,Richard Blackford ,Blackford: Seven Hokusai Miniatures; Five Naidu Songs; Dragon Songs,Various ,1,CD,14.81,22.99,"Richard Blackford writes: "The seven prints I chose from Hokusai's immense output of Ukiyo-e, or "pictures from the floating world", represent landscapes, seascapes and scenes from Japanese town and country life around the iconic Mount Fuji. Whereas some movements are inspired by a single picture, others are composites of many scenes or visual variations on a theme. The poems of Sarojini Naidu (1879-1949) cover a wide range of human experience, from love, ecstasy, delight in the natural world, loneliness, acceptance and praise. These five poems form a cycle of one Indian woman's experience. Her poetry pulsates with her love of Indian landscapes, seasons and flowers, simple joys, devotion and the splendor of Indian festivals. I chose an accompaniment of string quartet and clarinet to extend and enhance the richness of Naidu's imagery and the passion she evokes. In 1980 I discovered in an old bookshop a book of Chinese children's' songs in English translation called Chinese Mother Goose Rhymes. Published in 1900 it includes, as well as the texts in Mandarin and English, I chose fourteen poems to make a cantata for children, accompanied by two pianos with optional percussion, recorder and harp. The cantata is framed by two marches as the children gather for a wedding. Recorded in 1981, the original tape sat on my shelf for years. Now digitally transfers by Nimbus and we were surprised and delighted at how fresh and dynamic the recording still sounds today."",,https://b2b.naxosusa.com/Album.aspx?product=NI6379&medium=phy,01 Classical,Classical,Classical|Chamber Music,United Kingdom,2019 Wyastone Estate,2019 Wyastone Estate,,,,,,,,,,,,,,,,,,,,
2019,Oehms Classics,OC 1891,4260330918918,Takatomi Nobunaga; Emmanuel Sejourne; Antonio Vivaldi ,Fumito Nunoya: Concertos on Marimba,Fumito Nunoya; Kurpfalzisches Kammerorchester Mannheim,1,CD,12.47,19.99,"Fumito Nunoya is considered the custodian of the marimba. In the preface to this album, the Japanese musician explains why the marimba is still not a main instrument in the classical music scene. But with an exciting programme ranging from the Baroque to Modernism, he impressively proves the opposite, at least for the inclined listener of this recording. Marimbist Fumito Nunoya is gaining international recognition as one of today's leading marimbists. Born in Odate, Japan, he currently lives in Kreis Herford, Germany. He has taught marimba at the Hochschule fur Musik Detmold in Germany since 2009. In addition to performances in Germany and around Europe, he regularly travels to perform in Japan and the United States.",,https://b2b.naxosusa.com/Album.aspx?product=OC%201891&medium=phy,01 Classical,Classical,Classical|Avant-Garde,Germany,2018 OehmsClassics Musikproduktion GmbH,2019 OehmsClassics Musikproduktion GmbH,,,,,,,,,,,,,,,,,,,,
2019,Oehms Classics,OC 1705,4260330917058,Johann Sebastian Bach; Felix Mendelssohn Bartholdy; Christian von Blohn; Alexander Pierre Francois Boely; Nicolas de Grigny; Joris Verdin ,Christian von Blohn: Splendid Silbermann,Christian von Blohn,1,CD,12.47,19.99,"With this recording, produced on a single day, Christian von Blohn would like to demonstrate above all the versatility of the instrument in Bouxwiller. He quite deliberately selects music from completely different periods, also performing his own works. The famous organ was built by Johann Andreas Silbermann in 1778 and, following several renovations, is under monumental protection today. Christian von Blohn, born in 1963, graduated from the State University of Music Saarbrucken with a degree in church music and music education. He continued his artistic education in Switzerland at the Conservatoire de Lausanne in the master class of Andre Luy, where he was honored in 1991 with the Premier Prix de Virtuosite. This was followed by further studies with Daniel Chorzempa at the Music Academy in Basel and the Mozarteum Salzburg, as well as with Peter Hurford and Julian Smith at the "Royal School of Church Music" in Great Britain.",,https://b2b.naxosusa.com/Album.aspx?product=OC%201705&medium=phy,01 Classical,Classical,Classical|Solo Instrumental,Germany,2018 OehmsClassics Musikproduktion GmbHEine Aufnahme des Saarländischen Rundfunks Saarbrücken (2019),2019 OehmsClassics Musikproduktion GmbH,,,,,,,,,,,,,,,,,,,,
2019,Ondine,ODE 1325-2,0761195132524,Bernd Alois Zimmermann ,Zimmermann: Violin Concerto; Photoptosis; Die Soldaten Vocal Symphony,Leila Josefowicz; Anu Komsi; Jeni Packalen; Hilary Summers; Peter Tantsits; Ville Rusanen; Juha Uusitalo; Finnish Radio Symphony Orchestra,1,CD,13.25,20.99,"This new release by the award-winning Finnish Radio Symphony Orchestra conducted by Hannu Lintu is dedicated to the music of Bernd Alois Zimmermann (1918-1970), a leading figure in the music of post-Second World War Germany. This album includes a rendering of the composer's magnificent violin concerto featuring star violinist Leila Josefowicz, orchestral score Photoptosis, as well as the first album recording of Die Soldaten Vocal Symphony based on an opera that is widely considered as one of the greatest German operas of the 20th century. Zimmermann wrote his Die Soldaten opera, one of his keyworks, during the 1950s and 60s. The premiere of the opera was cancelled, and upon hearing the claim that the opera would be 'impossible' to perform, the composer adapted parts of the opera into a 40-minute vocal symphony suitable for concert performance. This work, filled with power and drama, is much more than a description of the apocalypse of modern war, and deserves its rightful place alongside the operas of Alban Berg. Zimmerman's Violin Concerto is a relatively early work in the composer's oeuvre. It was premiered in 1950 but has suffered much neglect. The influence of Schoenberg, Hindemith, Bartók, Stravinsky and Prokofiev are visible in this work which we might consider to manifest echoes of war. Photoptosis (1968), 'Incidence of Light', is among Zimmermann's final orchestral pieces. Inspired by a painting created by Yves Klein for the Gelsenkirchen music theatre, this work includes quotations by Scriabin, Beethoven, Bach, and Wagner, among others. Yet, this "Prélude", as described by the composer, is not a collage, but a study in orchestral sonority and light. Recordings by the Finnish Radio Symphony Orchestra under Hannu Lintu on Ondine have gathered excellent reviews in the international press. Two of their recordings were nominated for Gramophone Awards in 2018.",,https://b2b.naxosusa.com/Album.aspx?product=ODE%201325-2&medium=phy,01 Classical,Classical,,Finland,"2019 Ondine Oy, Helsinki","2019 Ondine Oy, Helsinki",,,,,,,,,,,,,,,,,,,,
2019,Ondine,ODE 1314-2,0761195131428,Johannes Brahms; Hubert Parry; Arnold Schoenberg ,Brahms-Schoenberg: Piano Quartet in G minor; Parry: Elegy for Brahms,Gavle Symphony Orchestra,1,CD,13.25,20.99,"This new recording by Gävle Symphony Orchestra with conductor Jaime Martín is a tribute to the work of Johannes Brahms (1833-1897). The art of Brahms has inspired countless of artists and composers since the 19th century up to our times. Arnold Schoenberg was one of the composers who greatly admired Brahms' work. Schoenberg was particularly fond of Brahms' 1st Piano Quartet (Op. 25) and when Otto Klemperer suggested him to orchestrate it in 1937, Schoenberg took the task without hesitation. Schoenberg regarded his reworking of the Piano Quartet - often dubbed as 'Brahms' Fifth' - as an act of homage to Brahms, and he believed he had finally succeeded in addressing the composer's concerns about the original score. No wonder that Schoenberg's masterful arrangement has remained in the concert programs of symphony orchestras. English composer Sir Hubert Parry (1848-1918) wrote his orchestral work, Elegy for Johannes Brahms, in 1897 in memory of his recently deceased musical idol. This short symphonic movement, which makes some overt references to Brahms's music, was never performed in the composer's lifetime, and only received its premiere after Parry's own death in 1918. After that, it languished unplayed until it was again resurrected in 1977. After decades of neglect, this recording is a manifestation of the recent growing interest in Parry's music. Gävle Symphony Orchestra, founded in Sweden in 1912, has a long and exciting history. Since 2013, the orchestra has enjoyed a fruitful musical partnership with principal conductor Jaime Martín, but the orchestra has also collaborated regularly with renowned international conductors. This is the orchestra's fourth album to be released by Ondine. Jaime Martín became the Artistic Director and Principal Conductor of Gävle Symphony Orchestra in 2013. During recent years orchestral engagements have led the rising conductor to collaborate with several prominent orchestras around the world. Martín is also Chief Conductor of the Orquestra de Cadaqués and known for his active career as solo flautist.",,https://b2b.naxosusa.com/Album.aspx?product=ODE%201314-2&medium=phy,01 Classical,Classical,,Finland,"2019 Ondine Oy, Helsinki","2019 Ondine Oy, Helsinki",,,,,,,,,,,,,,,,,,,,
2019,ORFEO,ORF-C952182I,4011790952222,Joseph Haydn ,"Haydn: Il ritorno di Tobia (Salzburg Festival, 2013)",Sen Guo; Valentina Farcas; Ann Hallenberg; Mauro Peter; Ruben Drole; Arnold Schoenberg Choir; Orchestra La Scinitilla,2,CD,19.49,29.99,"This unique performance of Haydn's biblical oratorio Il ritorno di Tobia, which is so rarely heard, is thanks to an unusual gift: the orchestra La Scintila, which was founded as an "original sound" ensemble comprising musicians from the Zurich opera orchestra, had awarded Nikolaus Harnoncourt honorary membership. The honor included the opportunity for Harnoncourt to choose a piece of music which he could then perform with the orchestra in an ideal atmosphere. Harnoncourt surprised everyone by choosing Haydn's virtually unknown oratorio based on the apocryphal Bible story of Tobias, who goes on an adventurous journey with the angel Raphael in order to heal his blind father with the angel's help. In keeping with the spirit of the subject matter, the proceeds of the concert were given to a charity supporting war victims of Sarajevo. The work was performed under Harnoncourt's direction with an ideal lineup of soloists and the magnificent Arnold Schoenberg Choir at a 2013 Salzburg Festival concert in the Felsenreitschule. The release by Orfeo International of the live recording, which is almost devoid of background noise, is only the third-ever recording to have been made of this very seldom performed Haydn oratorio in the history of phonography. Yet again one is moved to ask why so many of Haydn's operas and oratorios are so rarely played. Viewed objectively, Il ritorno di Tobia is in no way inferior to Haydn's hit oratorios The Creation and The Seasons.",,https://b2b.naxosusa.com/Album.aspx?product=ORF-C952182I&medium=phy,01 Classical,Classical,,Austria,2018 ORFEO International Music GmbH,2018 ORFEO International Music GmbH,,,,,,,,,,,,,,,,,,,,
2019,ORFEO,ORF-C946191,4011790946122,Johannes Brahms; Gustav Mahler; Wolfgang Amadeus Mozart ,"Skride Piano Quartet plays Mozart, Brahms & Mahler",Baiba Skride; Lise Berthaud; Harriet Krijgh; Lauma Skride,1,CD,14.81,22.99,"The Skride Piano Quartet is made up of four likeminded musicians who have each achieved success as a soloist at the highest levels. The 2016-17 season included performances at the Schubertiade Schwarzenberg, Musikverein Wien, Laeiszhalle Hamburg, Malmo Chamber Music Festival, and BASF Ludwigshafen. Upcoming performances include the Concertgebouw, Philharmonie Essen, Great Guild Hall Riga, and the Louisiana Museum of Modern Art. Making their North American debut in the 2018-19 season, the Quartet offers programs featuring highlights from the piano quartet repertoire. The quartet is violinist Baiba Skride, violist Lise Berthaud, cellist Harriet Krijgh, and pianist Lauma Skride. This debut album includes the most famous Piano Quartets of Classical literature, by Mozart and Brahms as well then the unique Quartet movement by Gustav Mahler.",,https://b2b.naxosusa.com/Album.aspx?product=ORF-C946191&medium=phy,01 Classical,Classical,,Austria,2019 ORFEO International Music GmbH,2019 ORFEO International Music GmbH,,,,,,,,,,,,,,,,,,,,
