2019,Accent,ACC 24357,4015023243576,Heinrich Ignaz Franz von Biber ,Biber: Fidicinium Sacro-Profanum,Harmonie Universelle,1,CD,14.81,14.81,"The 17th-century Bohemian/Austrian composer Heinrich Ignaz Franz Biber is best known for his works for solo violin, especially the Mystery Sonatas. However, he also wrote a considerable amount of music for string ensemble, including a set of 12 chamber sonatas subtitled Fidicinium Sacro-Profanum which was first published in Nuremberg in 1683. The title refers to the fact that the music in the sonatas combine sacred and secular styles. In his collection, Biber set new standards in the field of string chamber music. In the first part he composes for a five-part string ensemble: 2 violins, 2 violas, violone and basso continuo, a combination that was established at his time as the standard ensemble in Austrian cultural circles. In a richly colored setting, Biber artfully weaves a polyphonic texture that allows the voices to alternate and come to the fore. In the second part of this collection he dispenses with the five-part arrangement hitherto predominant in Austria, and focuses on augmenting the flexibility of the four individual parts. The present recording of Biber’s twelve chamber sonatas Fidicinium Sacro-Profanum is performed by Harmonie Universelle under its director Florian Deuter.",,https://b2b.naxosusa.com/Album.aspx?product=ACC%2024357&medium=phy,01 Classical,Classical,,Netherlands,2019 Accent,2019 Accent,,,,,,,,,,,,,,,,,,,,
2019,Accent,ACC 26411,4015023264113,George Frideric Handel ,Handel: Brockes Passion,Festspielorchester Gottingen; NDR Chor,2,CD,23.39,23.39,"On occasion of the 300th anniversary of the first performance of Handel’s Brockes Passion in Hamburg (4 April 1719), Accent presents a 2017 live performance at the Göttingen Handel Festival with Laurence Cummings conducting the Festivalorchestra Göttingen, the NDR Chor, and an excellent cast of singers such as the Dutch soprano Johannette Zomer and the young German tenor Sebastian Kohlhepp (as Evangelist). Barthold Heinrich Brockes’ passion text is one of the most frequently set in the history of music, and was the only German text used by George Frideric Handel as the basis for a large-scale sacred composition. The original score was lost, but the surviving version, which was hand-copied by Johann Sebastian Bach, makes it possible for us to hear this 1719 oratorio today.",,https://b2b.naxosusa.com/Album.aspx?product=ACC%2026411&medium=phy,01 Classical,Classical,,Netherlands,2019 NDR Kultur,2019 note 1 music gmbh,,,,,,,,,,,,,,,,,,,,
2019,Affetto Records,AF1901,888295877770,Stuart Forster,Love So Amazing - The Hymn Arrangements of Stuart Forster,The Choirs of Christ Church Cambridge MA and Church of the Redeemer Chestnut Hill MA; Dr. Stuart Forster; Joseph Foley; Dana Oakes; Zebediah Upton; Hans Bohn; Gregory Spirodopoulos; Kenneth Amis; Robert Schulz ,1,CD,13.25,13.25,"Hymn singing is fundamental in protestant churches, but not normally the subject of an album released worldwide. The musicianship presented here is singular, sung by two volunteer choirs with power and emotion. The inspired arrangements heard on this recording have developed over decades of working with wonderful choirs and congregations, as well as by singing with, and listening to, many inspired colleagues. Some of the descants were conceived for particular services, while other arrangements grew further for special occasions. Several of the brass arrangements were composed for the ordination and consecration of the Rt. Rev. Alan Gates as Bishop of the Episcopal Diocese of Massachusetts in 2014. Australians Michael S. Murray and Stuart Forster have worked together for more than 20 years, including conducting and accompanying in one another’s Episcopal churches, Christ Church in Cambridge and Church of the Redeemer in Chestnut Hill, located on opposite sides of the river Charles in Boston, Massachusetts, and during choir tours throughout America and Europe. Waiting and planning for the right moment to share their combined parish traditions of engaged singing from the vast legacy of hymnody bestowed upon the Anglican tradition has been fulfilled in this album. The installation of the exquisite Schoenstein organ at Church of the Redeemer, the restoration of the acoustic in Henry Vaughan’s exquisite architecture, and the publication of some of Stuart Forster’s hymn arrangements made the timing just right. What you will hear on this album is a superlative combined choir of about eighty voices singing some of the best-known hymns accompanied by a newly designed organ as they’ve never been heard before.",,https://b2b.naxosusa.com/Album.aspx?product=AF1901&medium=phy,Christian & Gospel,Christian & Gospel|Classic Christian,Classical|Sacred,United States,2019 Affeto Records,2019 Affetto Records,,,,,,,,,,,,,,,,,,,,
2019,Alba,ABCD 427,6417513104271,Mikko Heinio; Yrjo Kilpinen ,Heinio; Kilpinen: Songs of Late Summer,Sami Luttinen; Tuula Hallstrom ,1,CD,14.81,14.81,"The compositions of Mikko Heiniö and Yrjö Kilpinen are presented by bass singer Sami Luttinen and pianist Tuula Hällsröm on this new release. This is the world première recording of Heiniö’s Syyskesän laulu (Song of Late Summer) and the world première recording as a cycle of Kilpinen’s Reflexer (Reflections). The lyrics by Lassi Nummi on Syyskesän laulu are in Finnish, and the ones by Pär Lagerkvist on Reflexer are in Swedish. The Finnish bass Sami Luttinen studied singing at the Sibelius Academy in Helsinki. In addition to his extensive operatic work, Luttinen appears as a concert soloist throughout Europe. He can frequently be heard in radio broadcasts and he has done several recordings. Luttinen also appears regularly in song recitals, his repertoire ranging from Romantic German Lieder to French mélodies and Russian and Scandinavian song repertoire. Tuula Hällström is one of the most sought after pianists of her generation, enjoying a successful career both in chamber music and lieder. She regularly collaborates with singers in concerts, master classes, operas, and song contests. In the spring of 2003 Hällström received her piano diploma from Sibelius Academy with honors.",,https://b2b.naxosusa.com/Album.aspx?product=ABCD%20427&medium=phy,01 Classical,Classical,,,,,,,,,,,,,,,,,,,,,,,,
2019,Albion,ALBCD036,5060158190362,Ralph Vaughan Williams ,Vaughan Williams: Viola Fantasia,Martin Outram; Julian Rolton; Mark Padmore ,1,CD,14.81,14.81,"On this new release Martin Outram (Viola) and Julian Rolton (piano) play all of the works of Ralph Vaughan Williams for viola and piano. Mark Padmore (tenor) joins them to record Four Hymns for Tenor, Viola and Piano. Ralph Vaughan Williams learned the piano and violin from an early age, but took to the viola while still at school and continued to play it all his life; this instrument is associated with his most romantic and impassioned music. His contemporary, the great viola virtuoso Lionel Tertis, was the inspiration for two of the works presented here. The Suite for Viola and Small Orchestra was premiered by Tertis in 1934, soon followed by a viola and piano edition. The eight movements of this lively work mainly represent dances. The short but lovely Romance is thought to have been written for Lionel Tertis at approximately the time of the First World War. It was apparently never performed and was found after the composer’s death. The Six Studies in English Folk Song, dedicated in 1926 to the cellist May Mukle, were produced in alternative versions for cello, viola, violin and clarinet, all with piano. Folk songs were important to Vaughan Williams, who collected many of them, and this work is based on six of them. This work in turn led on to a Fantasia on Sussex Folk Tunes for cello and orchestra, dedicated in 1929 to Pablo Casalls. John Lenehan published a piano reduction of the piano part and Martin Outram has adapted the cello solo part for the viola. The Fantasia on Greensleeves derives from VW’s 1928 opera, Sir John in Love. Based on a well-known tune, possibly of the Tudor period, at incorporates another folk song, Lovely Joan. The Four Hymns for Tenor, Viola and Piano date from just before the first works war. Based on texts dating from the 17th to the 20th century, they are weighty in mood and rise to feelings of religious ecstasy.",https://www.youtube.com/watch?v=mJ5HpdvQ6uw,https://b2b.naxosusa.com/Album.aspx?product=ALBCD036&medium=phy,01 Classical,Classical,Classical|Chamber Music,United Kingdom,2019 ALBION RECORDS,2019 ALBION RECORDS,,,,,,,,,,,,,,,,,,,,
2019,Alpha,ALPHA445,3760014194450,Various ,Sandrine Piau: Si j'ai aime,Sandrine Piau; Le Concert de la Loge,1,CD,14.81,14.81,"Sandrine Piau’s first recital for the ALPHA Label, with Susan Manoff, proved an enormous hit (Diapason d’Or of the year, Choc of the year, and Gramophone Editor’s Choice). Her new project is a recital with orchestra celebrating French songs from the period when they moved from the private salon to the concert hall. Planned in partnership with the Palazzetto Bru Zane, this programme evokes anticipation, desire, pleasure, memory, in short all the vagaries of love experienced by a romantic heroine. To verses of the poets Hugo, Lamartine, Gautier, and Verlaine, Sandrine Piau has selected song settings by Saint-Saëns (‘L’attente’, ‘Papillons’), Massenet (‘Extase’, ‘Aimons-nous’), and Vierne, as well as by the rarely-heard Dubois, Guilmant, and Bordes. Julien Chauvin and his period instrument ensemble combine these songs with orchestral pieces (the ‘Pavane de la belle au bois dormant’ from Ravel’s Mother Goose Suite, and Debussy’s ‘Danse profane’ for harp and orchestra). The album also presents excerpts from Nuits d’Été by Berlioz, and ends with the famous classic ‘Plaisir d’amour’ by Martini.",,https://b2b.naxosusa.com/Album.aspx?product=ALPHA445&medium=phy,01 Classical,Classical,,Austria,2019 Le Concert de la Loge & Palazzetto Bru Zane & Alpha Classics / Outhere Music France,2019 Alpha Classics / Outhere Music France,,,,,,,,,,,,,,,,,,,,
2019,Amadeus Arte,AA19001,9788895450490,Astor Piazzolla; Carlos Gardel; Roberto Herrera; Ennio Morricone; Richard Galliano,Linda Hedlund & Floraleda Sacchi: Tango Intimo,Linda Hedlund; Floraleda Sacchi; Roberto Herrera; Laura Legazcue,1,USB Key,11.69,11.69,"Recorded live in the wonderful Teatro Accademico Bibiena in Mantua, which was praised by Mozart as one of the best acoustics he experienced, TANGO INTIMO is performed by Finnish Violinist Linda Hedlund and Italian Harpist Floraleda Sacchi. Their emotionally intense playing and bravura is underlined by the enthusiastic answer of the Italian audience and by two special guest dancers: Roberto Herrera and Laura Legazcue. Music by Astor Piazzolla, Carlos Gardel, Richard Galliano, and Ennio Morricone arranged by Floraleda alternates lyrical and rhythmical passages. Roberto Herrera's solo with the Argentinian Boleadoras brings back the most lively folkloristic aspects of Tango. Floraleda won a Latin Grammy in 2018 for her project with Claudia Montero Magica y Misteriosa dedicated also to Argentinian music. Linda Hedlund is one of the most renowned Finnish Violinists of her generation.",https://youtu.be/IovChAyNvFo,https://b2b.naxosusa.com/Album.aspx?product=AA19001&medium=phy,DVD/Blu-ray,DVD/Blu-ray,,Italy,2019 Amadeus Arte,2019 Amadeus Arte,,7,Floraleda Sacchi; Giorgio Caproni; Laura Legazcue; Linda Hedlund; Roberto Herrera,Giorgio Caproni,1,2019 Amadeus Arte,2019 Amadeus Arte,IT,NR,NTSC,0,DVD-5,Italian,English,Dolby Surround,Color,16:9,60,2019,"Amazon VOD,iTunes,Naxos Video Library"
2019,Ambronay Editions,AMY052,3760135100521,Anonymous ,Canticum Novum: Laudario - Musique au temps de Saint Francois d'Assise,Canticum Novum; Emmanuel Bardon,1,CD,14.81,14.81,"Canticum Novum sheds new light on the wonderful medieval repertory of Tuscan laude. Taken from the Laudario di Cortona, these popular sacred songs of praise from the time of St Francis of Assisi, overflowing with poetry and sunshine, are transcended by Emmanuel Bardon and his ensemble. Appropriating another culture and playing it through the prism of one’s own culture, not to imitate it but to resonate with it: this I show the art project Canticum Novum has been defining its deep self for many years now. Working this way, the musicians forming the ensemble constantly question their own musical identity, the way they play their instruments. They often accept to leave their comfort zone and to relearn how to play, adapting to the repertory to be interpreted and their present colleagues. The idea is not to contort oneself in order to play another repertory but to move towards it.",,https://b2b.naxosusa.com/Album.aspx?product=AMY052&medium=phy,01 Classical,Classical,,,Ambronay Editions,Ambronay Editions,,,,,,,,,,,,,,,,,,,,
2019,Ansonica Records,AR0013,608410873551,Jeff Adler ,Hevreh Ensemble: A Path Of Light,Hevreh Ensemble; Jeff Adler; Judith Dansker; Laurie Friedman; Adam Morrisson; Shane Shanahan; George Rush; Naren Budhkar; Ralph Farris; Kip Jones; Dorothy Lawson; Corin Lee ,1,CD,11.69,11.69,"The quartet of musicians who comprise Hevreh Ensemble – Judith Dansker, Laurie Friedman, Adam Morrison, and Jeff Adler – are making their Ansonica debut with A PATH OF LIGHT. Hevreh Ensemble is internationally acclaimed for its live performances, which feature a wide array of instruments from Cherokee Native American flute, English horn, and shofar to world percussion including djembe, dumbek, balafon, rain stick, and tabla. The Ensemble is also joined on A PATH OF LIGHT by some extraordinary guests, including the genre-defying string quartet ETHEL, cross-cultural percussionist Shane Shanahan, George Rush on double bass, and Naren Budhkar on tabla. The essence of the music on the album, which includes ten compositions written by Adler, revolves around two tracks: A Path of Light and The Speed of Dark, each of which follows a distinctively diverse path. The title track, A Path of Light, features a quiet, meditative introduction which builds to a joyous and frenzied conclusion. That positive energy is balanced, according to Adler, by “the thickness and occasional dissonance of the writing in The Speed of Dark, which invokes feelings of fear and intolerance.” The piece that follows The Speed of Dark and which closes the album is the somber-toned Epilogue, which musically represents the consequences of following that second path. A PATH OF LIGHT surrounds these anchoring compositions with seven pieces that together weave a rich tapestry of textures and tones. From the adventurous Sima de los Huesos, to the jazz-centric Sweetgrass Cedar and Sage, to the propulsive Amor Caritas, Hevreh’s performances serve to emphasize both the exceptional contributions of each individual instrument as well as the melodic intricacy of their interplay.",https://www.youtube.com/watch?v=uy89VksrQIQ&feature=youtu.be,https://b2b.naxosusa.com/Album.aspx?product=AR0013&medium=phy,01 Classical,Classical,World|North America,,,2018 Ansonica Records,,,,,,,,,,,,,,,,,,,,
2019,ARC,EUCD2847,5019396284722,Various ,Mariachi Sol: Mariachi Mexico,Mariachi Sol,1,CD,10.13,10.13,"Mariachi is the name of a traditional Mexican street music with a style that has developed continuously throughout its history. While in earlier times only the vihuela and the gitarron were used, and sometimes also the harp, one finds today that many different instruments are involved. The trumpet, which gives Mariachi its characteristic sound, is a relatively new addition, coming along at the end of the 1950s. Mariachi music is lively, full of joy and can be very romantic. It is therefore very well suited to public festivals and weddings, and to the serenading of young women by potential suitors. This is a great introductory album to the genre, presented by the well-established Mariachi band, Mariachi Sol.",,https://b2b.naxosusa.com/Album.aspx?product=EUCD2847&medium=phy,30 World/Int'l.,World,World,Austria,,2019 ARC Music Productions Int. Ltd. ,,,,,,,,,,,,,,,,,,,,
2019,ARC,EUCD2848,5019396284821,Traditional ,Trio Pantango: Tango Argentino,Trio Pantango,1,CD,11.69,11.69,"The tango originated circa 1890 in the harbor area of Buenos Aires where musicians performed “a la parrilla” (improvised). Now the tango is a nostalgic, exciting music that has developed into a sound and dance passionately reminiscent of Argentina. Guillermo Destaillats was born in Buenos Aires, Argentina in 1970. At the age of sixteen he began to study music, starting off with piano at the Conservatorio Nacional. Although born in Buenos Aires, it was Germany that Guillermo heard tango for the first time in his life. It was the orchestra of Leopoldo Federico with Julio Sosa as a singer. He was eleven years old then, and it took eleven more years before he started learning the bandoneon, which he took up in 1992, studying with Enrique Fasuolo. In 1993, Guillermo formed Pantango together with Fernando Rubin Saglia. Saglia was born in Buenos Aires in 1968. He began studying music at the age of 20 at the Conservatorio Nacional and the Escuela de Musica Popular de Avellaneda. Michael Elvermann was born in Germany. He played clarinet in the local brass band, both self-taught and with some tuition. In 1983 he studied with Geza Komjathy at the music school in Dorsten. He joined Pantango in May 1993.",,https://b2b.naxosusa.com/Album.aspx?product=EUCD2848&medium=phy,30 World/Int'l.,World,World,Austria,,2019 ARC Music Productions Int. Ltd. ,,,,,,,,,,,,,,,,,,,,
2019,ARC,EUCD2849,5019396284920,Various ,Journey to Morocco,Various,1,CD,11.69,11.69,"This album takes the listener on a musical journey through Morocco. From the Berber traditions of the Rif and Atlas Mountains, to deeply spiritual Sufi music and the improvised street music of Marrakech, Morocco is a land of musical riches. The tracks on this release have been curated from ARC music’s vast catalog of world music, and include artists like Nour Eddine, Abdesselam Damoussi, Rachid Halihal, the Altaf Gnawa Group, and many others. Julia Beyer is responsible for compiling the works on this album, and Diz Heller, once again, presents stellar mastering.",,https://b2b.naxosusa.com/Album.aspx?product=EUCD2849&medium=phy,30 World/Int'l.,World,World,Austria,,2019 ARC Music Productions Int. Ltd. ,,,,,,,,,,,,,,,,,,,,
2019,ARC,EUCD2850,5019396285026,Various ,The Optina Pustyn Male Choir: Orthodox Chants from Russia,The Optina Pustyn Male Choir,1,CD,11.69,11.69,"The male choir of the Optina Pustyn Monastery Department in St. Petersburg was established in 1996 by the blessing of its Father Superior, Hieromonach Rostislav. The choir consists of professional singers who graduated from the St. Petersburg Conservatoire. The main goal in forming the choir was the cultivation of the heritage of the old Russian Church singing, its sources and different styles, the study of the different types of early Russian polyphony and the introduction of them into modern Church practices. In order to achieve authenticity in transcribing the various types of ancient Russian scriptures the choir members are in contact with scientists researching medieval patterns of Russian singing. The repertoire of the choir, however, reaches beyond the purely ancient repertoire and represents the great riches and variety of the Russian clerical as well as secular choral art. Apart from recording they maintain a busy schedule of concerts in Russia and abroad.",,https://b2b.naxosusa.com/Album.aspx?product=EUCD2850&medium=phy,30 World/Int'l.,World,World,Austria,,2019 ARC Music Productions Int. Ltd. ,,,,,,,,,,,,,,,,,,,,
2019,Arcana,A115,3760195731154,Domenico Scarlatti ,Scarlatti: Mandolin Sonatas,Pizzicar Galante; Anna Schivazappa; Fabio Antonio Falcone; Daniel de Morais; Ronald Martin Alonso,1,CD,8.57,8.57,"Scarlatti and the mandolin: this album provides a fascinating and unusual encounter between one of the most important composers of the baroque period and an instrument that originated in Naples and enjoyed great popularity throughout Europe, especially in Paris and in other European capitals during the 18th century. The Pizzicar Galante ensemble, founded in Paris in 2012 by mandolinist Anna Schivazappa and harpsichordist Fabio Antonio Falcone, reveals hidden aspects of these musical gems from the Italian Baroque. Drawing inspiration from a mysterious 18th-century French manuscript containing the first movement of Scarlatti’s Sonata K 89, preceded by the indication ‘Sonatina per mandolino e cimbalo’, the musicians deliver a fresh and original interpretation of these works. The music is full of contrasts, rich in virtuoso passages, surprises and effects but also full of sweetness and humor, combined with a certain meditative melancholy. Specialized in the Italian repertoire for mandolin and basso continuo, Pizzicar Galante gives voice to different instrumental timbres. Among these, the charming, crystal-clear sound of an original 18th-century Neapolitan mandolin: an absolute rarity that makes this recording truly unique.",,https://b2b.naxosusa.com/Album.aspx?product=A115&medium=phy,01 Classical,Classical,,Netherlands,"2019 Pizzicar Galante, under exclusive licence to Outhere Music France",2019 Outhere Music France,,,,,,,,,,,,,,,,,,,,
2019,Arcana,A462,3760195734629,Francesco Landini ,Landini: L'Occhio del Cor,La Reverdie; Christophe Deslignes,1,CD,14.81,14.81,"Francesco Landini was the most famous Florentine Trecento composer, known for being a multi-instrumentalist, most notably a virtuoso on the organ. As known, he lost his sight at the age of 7 but, despite his disability, he excelled in the study of music and all liberal arts. Might the condition of blindness have affected the poetic production of Landini? LaReverdie together with Christophe Deslignes, investigates this hypothesis, with a new project that presents both well known masterpieces and pieces never recorded before, searching signs that might be eventually impressed in the verses and the music of Magister Coecus by the loss of his sight. The reference to the eyes from literary topos becomes in many Landini’s texts a melancholic poetic expedient to express the distance, the absence or the loss of the beloved woman, that only “the heart’s eye” (L’Occhio del Cor) is able to imagine. A project which fills the recent recording void on a fundamental author at the sunset of the Middle Ages, reread through a perspective never explored until now. A passionate work on the strict bond between poetry and music, well explained by Davide Daolmi, is associated to a necessary musicological research about sources.",,https://b2b.naxosusa.com/Album.aspx?product=A462&medium=phy,01 Classical,Classical,,Netherlands,"2019 LaReverdie, under exclusive licence to Outhere Music France",2019 Outhere Music France,,,,,,,,,,,,,,,,,,,,
2019,ArcoDiva,UP0194,8594029811942,Ludwig van Beethoven; Leos Janacek; Sergei Rachmaninoff; Adam Skoumal; Bedrich Smetana ,Johanna Hanikova Piano,Johanna Hanikova,1,CD,13.25,13.25,"Twice a laureate of the International Smetana Piano Competition and a winner of the Bedrich Smetana Prize, Johanna Hanikova studied piano playing at the Janacek Conservatoire in Ostrava with Professor Monika Tugendliebova. During her conservatoire studies she already made her name at national as well as international competitions- 1st prize at Prague Junior Note, 1st prize at Pro Bohemia, and laureate title at the Prague Conservatoire Young Pianists Competition. She is developing her concert activities as a soloist regularly with renowned Czech symphonic orchestras. For this release, she has chosen a programme of well-known composers Ludwig van Beethoven and Sergei Rachmaninoff, Czech composers Bedrich Smetana and Leos Janacek, and contemporary composer and pianist Adam Skoumal.",,https://b2b.naxosusa.com/Album.aspx?product=UP0194&medium=phy,01 Classical,Classical,,Czech Republic,2019 ArcoDiva ,2019 ArcoDiva ,,,,,,,,,,,,,,,,,,,,
2019,Ars Produktion,ARS38163,4260052381632,Heinrich Anton Hoffmann ,Hoffmann: String Quartets,Alte Musik Koln,1,Hybrid SACD,15.59,15.59,"The violin virtuoso Heinrich Anton Hoffmann (1770-1842) was a member of the Kurmainzer Hofkapelle until 1799. Later he moved to Frankfurt, where he became concertmaster of the theatre orchestra and vice music director. His string quartets Op.3 (1795) astound with their modernity, which despite their proximity to the models of the Viennese Classical period already show the style of later decades. They are characterized by formal variability and harmonic flexibility with a special preference for chromaticism. The Ensemble Alte Musik Köln, playing on historical instruments, lets us discover this amazing Beethoven contemporary.",,https://b2b.naxosusa.com/Album.aspx?product=ARS38163&medium=phy,01 Classical,Classical,,Germany,2019 Ars Produktion,,,,,,,,,,,,,,,,,,,,,
2019,Ars Produktion,ARS38267,4260052382677,Cesar Franck; Franz Schubert; Robert Schumann ,Sofia de Salis: Shades of Love - Works for Flute & Piano,Sofia de Salis; Iryna Krasnovska,1,Hybrid SACD,15.59,15.59,"Not that a flutist would actually need to poach in foreign territories due to a lack of attractive repertoire, but the arrangements presented here, based on well-known chamber music works and songs, nevertheless make sense: they underline not only the versatility of the instrument, but also the interpreter's abilities. When the Russian-Swiss flutist Sofia de Salis, together with her piano accompanist Iryna Krasnovska, performs such well-known chamber music works as Franz Schubert's Arpeggione Sonata or César Franck's Violin Sonata on the flute, she astonishes us not only once.",,https://b2b.naxosusa.com/Album.aspx?product=ARS38267&medium=phy,01 Classical,Classical,,Germany,2019 Ars Produktion,,,,,,,,,,,,,,,,,,,,,
