2019,Fra Bernardo,FB1803913,4260307433918,Wolfgang Amadeus Mozart ,Patrick Ayrton & Wolfgang Gluxam: Four Hands on Mozart,Patrick Ayrton; Wolfgang Gluxam,1,CD,14.81,14.81,"Mozart's works for piano for four hands were written mostly to use for private playing with his sister Nannerl or gifted students. They focus on the fun and joy of playing, which is expressed, for example, in witty musical jokes. Patrick Ayrton and Wolfgang Glüxam ensure that the irrepressible joy of making music is also present on this recording. The English harpsichordist, Patrick Ayrton, has always had a passion for keyboard instruments, first the piano, then the organ and the harpsichord. He started his musical studies in Switzerland with Francois Demierre. He then studied the organ and church music with Alfred Mitterhofer at the Academy of Music and Figurative Arts in Vienna where he graduated ""cum laude"". The Austrian harpsichordist, Wolfgang Glüxam, studied organ playing with Alfred Mitterhofer at the Hochschule für Musik in Vienna, as well as harpsichord with Ton Koopman at the Sweelinck Conservatory in Amsterdam. 1979 and 1980 he was winner at the international competitions in Brugge/Belgium and Nijmegen/Holland.",,https://b2b.naxosusa.com/Album.aspx?product=FB1803913&medium=phy,01 Classical,Classical,,Austria,2019 fra bernardo,2019 fra bernardo,,,,,,,,,,,,,,,,,,,,
2019,Fuga Libera,FUG753,5400439007536,John Downland; Sokratis Sinopoulos ,L'Acheron: Lachrimae Lyrae (Tears of Exile),Sokratis Sinopoulos; L'Acheron; Francois Joubert-Caillet,1,CD,14.81,14.81,"This collaboration between a consort of viols and the Greek lyra takes John Dowland’s Lachrimæ or Seaven Teares as its point of departure; together they paint a transverse and stateless picture of melancholy, although this is set against the joyful hope of a shining future that appears in these improvisations and timeless Anglo-Byzantine dances. Greek musician Sokratis Sinopoulos is a contemporary master of the lyra, a bowed instrument that dates back to the Byzantine era. His playing is delicate and nuanced yet highly expressive, and his proficiency on the instrument has been widely acclaimed. Sinopoulos has collaborated with numerous musicians throughout the world. He’s equally comfortable crossing genre boundaries into jazz and classical, as he is to staying true to folk traditions of Greece and Eastern Mediterranean.",,https://b2b.naxosusa.com/Album.aspx?product=FUG753&medium=phy,01 Classical,Classical,,Netherlands,2019 L’Achéron,2019 Outhere,,,,,,,,,,,,,,,,,,,,
2019,Glossa,GCD923412,8424562234123,Various ,"Fabio Biondi: The 1690 ""Tuscan"" Stradivari - Violin Sonatas in 18th-century Italy",Fabio Biondi; Antonio Fantinuoli; Giangiacomo Pinardi; Paola Poncet,1,CD,14.81,14.81,"In the course of his illustrious career, Fabio Biondi has nurtured a remarkable empathy with Italian music from across many centuries, but strikingly so with the early Baroque violin sonata repertory, the development of which was dramatically propelled into the future by Arcangelo Corelli with his Op 5 collection. It is this empathy possessed by Biondi which has inspired the Accademia Nazionale di Santa Cecilia in Rome (from its bowed instrument collection) to make him a loan of the precious 1690 “Tuscan” violin made by Antonio Stradivari, for this Glossa recording. Another skill possessed by Biondi is his deft assemblage of programmes, whether for concert or for record, and this new release of early eighteenth-century violin works touches on the impact that Corelli’s music had on music-making in Dresden, Venice, Padua, London and Amsterdam, to name just a few of the destinations affected as the fame of “Arcangelo Bolognese” fanned out from Rome across Europe. With a continuo team from his Europa Galante ensemble, Biondi plays sonatas by Vivaldi, Corelli, Geminiani, Tartini and Locatelli, and a Ciaccona by Veracini. Recorded in Rome, on an instrument which was originally made for the Florentine court of Ferdinando de’ Medici (and which, over time, has survived all manner of vicissitudes on its journey to Rome!), Fabio Biondi expertly captures the flavor of the eighteenth-century violin sonata.",,https://b2b.naxosusa.com/Album.aspx?product=GCD923412&medium=phy,01 Classical,Classical,,Austria,2019 note 1 music gmbh,2019 note 1 music gmbh,,,,,,,,,,,,,,,,,,,,
2019,Glossa,GCD923519,8424562235199,Francesco Cavalli ,Cavalli: Gli amori di Apollo e Dafne,Ensemble Elyma; Anders Dahlin; Rosa Dominguez,2,CD,23.39,23.39,"Gli amori d’Apollo e di Dafne, premiered at the Teatro Tron di San Cassiano in Venice in 1640, marked the first collaboration between two geniuses, the poet Giovan Francesco Busenello and the composer Francesco Cavalli. The value of this first libretto, magnified by the superb music of Cavalli, lies above all in the beauty and rich poetry of its literary style. Musically, the work is still, in certain respects, dependent on the Florentine tradition of recitar cantando: until fairly late in the Seicento, recitative remained the most important and prestigious musical and stylistic tool in opera. Nonetheless, closed forms are fairly widespread, and the opera abounds in ensembles. The rhythmic and metrical richness of the text allows Cavalli to give free rein to his creative genius: arias, lamenti, duets, even trios, choruses – the variety of strophic forms is as great as the expressiveness of the recitative… Glossa now reissues a fine recording of this opera, performed by the Argentinian Gabriel Garrido and his Ensemble Elyma, with a splendid vocal cast including Anders Dahlin, Rosa Domínguez, Emanuela Galli, Paola Quagliata and Salvo Vitale.",,https://b2b.naxosusa.com/Album.aspx?product=GCD923519&medium=phy,01 Classical,Classical,,Netherlands,2008 K617,2019 note 1 music gmbh,,,,,,,,,,,,,,,,,,,,
2019,Gothic,G-49309,000334930929,Johann Sebastian Bach; James D'Angelo; Joseph Jongen; Vincent Persichetti; Richard Wagner; Healey Willan ,Scott Dettra: The Anglo-American Classic Organ,Scott Dettra; Edwin Lemare,1,CD,14.81,14.81,"On this release, Scott Dettra plays a varied program on the Anglo-American Classic organ of Church of the Incarnation (Dallas). Hailed as a “brilliant organist” (Dallas Morning News) and an “outstanding musician” (The Diapason), Scott Dettra is acclaimed as one of America’s leading concert organists. Mr. Dettra’s playing is praised for its clarity, rhythmic intensity, and musical elegance, and has been described by The American Organist as “music making of absolute authority and sophisticated expression.” He combines an active performance schedule with his post as Director of Music and Organist at the Church of the Incarnation in Dallas, where he leads a vibrant music ministry in one of the country’s largest Episcopal parishes. He is also a member of the organ faculty at Southern Methodist University. Prior to his appointment in Dallas, he was for five years Organist of Washington National Cathedral.",,https://b2b.naxosusa.com/Album.aspx?product=G-49309&medium=phy,01 Classical,Classical,Instrumental,United States,"2019 Loft Recordings, LLC","2019 Loft Recordings, LLC",,,,,,,,,,,,,,,,,,,,
2019,Gramola Records,GRAM99186,9003643991866,Elias Parish Alvars; Ludwig van Beethoven; Charles Nicholas Bochsa; Franz Lachner; Ignaz Pleyel; Gioacchino Rossini; Louis Spohr ,Elisabeth Plank: 1825 - Echoes of Vienna on Historical Harp,Elisabeth Plank,1,CD,14.81,14.81,"“1825” – the title of the upcoming album of the young Austrian harpist Elisabeth Plank takes reference to the instrument of this recording, the historical double-action harp which was created in that year by the Paris firm of the Érard Brothers. The selection of works makes the emergence of an original harp style audible, which foremost consisted of a stylistic distinction between harp and piano, which was first made possible by the further technical development of both instruments during that time. The album presents compositions by Louis Spohr, Ludwig van Beethoven and Ignaz Pleyel, which were still written for the single-action harp, next to works for the double-action harp by Elias Parish Alvars, without any doubt the most popular harp player of his time, by Franz Lachner, Charles Nicholas Bochsa and Gioacchino Rossini. “For me this album represents the start of an intensive examination of the historical double harp and of the history of the harp in Vienna. This release is therefore intended as an invitation to people to immerse themselves in a world of sound unknown today and in an unfamiliar aspect of Vienna” (Elisabeth Plank).",,https://b2b.naxosusa.com/Album.aspx?product=GRAM99186&medium=phy,01 Classical,Classical,Classical|Solo Instrumental,Austria,2019 Gramola,2019 Gramola,,,,,,,,,,,,,,,,,,,,
2019,Gramola Records,GRAM99192,9003643991927,Franz Liszt ,Liszt: Two Concert Etudes; Grandes etudes de Paganini; Sonata for Piano in B Minor,Martin Ivanov,1,CD,14.81,14.81,"Following his two acclaimed recordings featuring works by Chopin and Schumann, Bulgarian-born Pianist Martin Ivanov now takes a chance in producing an album dedicated to Franz Liszt, presenting his presumably most prominent work for piano solo, the Sonata in B minor S 178. This monumental work, which formally consists of only one movement, ever since has provided some space for speculations on whether it carries any programmatic content; many find in those three different musical thematic strains a representation of the figures of the Faust legend Faust, Gretchen and Mephisto. As a matter of fact, Liszt did in this case not append or utter any such programmatic intent. Furthermore, this release features as a brilliant opener the Two Concert Etudes S 145 (Waldesrauschen and Gnomenreigen) and as a vigorous finish the Grandes études de Paganini, S 141.",,https://b2b.naxosusa.com/Album.aspx?product=GRAM99192&medium=phy,01 Classical,Classical,Classical|Piano,Austria,2019 Gramola,2019 Gramola,,,,,,,,,,,,,,,,,,,,
2019,Grappa,GRCD4603,7033662046034,Manuel de Falla; Edvard Grieg; Edouard Lalo; Pietro Mascagni; Franz Schubert; Francesco Paolo Tosti; Giuseppe Verdi; Richard Wagner ,Hakon Kornstad Trio: Im Treibhaus,Hakon Kornstad Trio; Hakon Kornstad; Frode Haltli; Mats Eilertsen,1,CD,14.81,14.81,"In the greenhouse of musical influences. Welcome to a neo-Victorian nachspiel with three of Norway’s finest improvisers, presenting the music history in a new way. Without boundaries, and with a lot of surprises, the album is a true expression of Håkon Kornstad’s rare accumulation of musical influences. Håkon Kornstad is an award winning Norwegian jazz saxophonist, recognised by jazz critics around the world. In 2009 he discovered his singing voice, and he finished a master’s degree at the Norwegian Opera Academy in 2014. He is now dividing his time between two almost contrasting musical genres — combining them in unprecedented ways. “The Norwegian saxophonist and singer turned what could have been a circus act into a musical tour de force” (The Guardian (UK)",,https://b2b.naxosusa.com/Album.aspx?product=GRCD4603&medium=phy,01 Classical,Classical|Classical Crossover,Classical|Art Song,Norway,Grappa Musikkforlag,Grappa Musikkforlag,,,,,,,,,,,,,,,,,,,,
2019,Grappa,GRCD4630,7033662046300,Gregorio Allegri; Ketil Bjornstad; Johannes Brahms; Harold Edwind Darke; Halfdan Kjerulf; Deng Yu-Hsian ,Ketil Bjornstad: Rainbow Sessions,Ketil Bjornstad,4,CD,38.99,38.99,"Ketil Bjørnstad celebrates 50 years as a musician and artist in 2019. Bjørnstad’s 50th anniversary as an artist kicks off with a reissue of “Rainbow Sessions”, earlier released as a limited edition in 2006. This is Ketil Bjørnstad’s homage to the world known Rainbow Studios and the Steinway grand piano. When studio owner and sound guru Jan Erik Kongshaug in 2004 was moving the studio to a new location, the idea to make the last to record in the old studio and the first to play in the new, was born. Two solo piano albums were planned, at the time it turned into three, and for this release evolves into four. This celebratory edition consists of five different Rainbow sessions recorded in the period 2013-2017, which Bjørnstad has put together into a fourth bonus album. Everything is presented in a new, wonderful design, accompanied by newly written liner notes by Bjørnstad.",,https://b2b.naxosusa.com/Album.aspx?product=GRCD4630&medium=phy,02 Jazz,Jazz,Classical|Solo Instrumental,Norway,Grappa Musikkforlag,Grappa Musikkforlag,,,,,,,,,,,,,,,,,,,,
2019,Haenssler Classic,HC18090,881488180909,Johann Sebastian Bach ,Bach: Fantasias & Duets,Ann-Helena Schluter ,1,CD,14.81,14.81,"“My own music is influenced by the music of Bach. Having studied in the “Bach city” of Leipzig, fallen in love with his fugues as a child and won with his Preludes in the Jugend musiziert competition, achieved my first Bach cycle with the Goldberg Variations (in the USA for my Master in music and my first album recording) – then I was moved more and more deeply by the Credo, the inner conviction, in Bach’s music. My imaginative powers, my musical energy (timbres, sounds, creativity, poetry) must be imbued with this richness. New music looks quite different from what it was in Bach’s day (some even say it is all philosophy now, no melodies, notes or harmonies required). If modern music is still to be music, even today, and if it is still to enrich people’s lives, a thing of value that they can and will remember, then Bach’s store of wealth can always come to the aid of us composers. And so it is that J.S. Bach, who never left Germany and spent so long in Leipzig for want of a better position, today more than ever embraces the whole world with a web of his music, in all the places he never travelled to, whether Spain, Franconia, Hesse, Sweden, or far beyond Europe.” (Ann-Helena Schlüter)",,https://b2b.naxosusa.com/Album.aspx?product=HC18090&medium=phy,01 Classical,Classical,,Germany,2019 Profil Medien GmbH,2019 Profil Medien GmbH,,,,,,,,,,,,,,,,,,,,
2019,Haenssler Classic,HC19026,881488190267,Samuel Barber; Leonard Bernstein; Wiliam Bolcom; John Corigliano; Richard Hageman; Aaron Jay Kernis; John C. Sacco; Kurt Weill ,Duo Rosa: American Soul from Broadway to Paris,Duo Rosa; Stephany Ortega; Lena Kollmeier ,1,CD,14.81,14.81,"“AMERICAN SOUL: from Broadway to Paris” is the title of Duo Rosa’s second opus, featuring art songs, Broadway melodies and cabaret tunes. In this new project, the two musicians maintain a concept that was one of the keys to the previous album’s success: a blend of classical and popular music in a varied, accessible programme that pleases audiences of all ages, regardless of whether they are classical music lovers or not. Concertgoers were mesmerized by the energy exuded by Duo Rosa on their first tour — Return World Tour — and by the theatrical effects with which they infused classical melodies and Latin American popular songs. Thus it is only natural that they would now turn to North American repertoire, in all its flamboyance, to present a recital brimming with emotions: happiness, nostalgia, humour, sadness…and many other surprises! To grasp the audience’s attention and hold them spellbound, the duo has selected a series of highly popular songs combined with less well-known classical melodies. They perform famous Broadway tunes such as I feel pretty and Somewhere by Bernstein from West Side Story, or Gershwin songs including The man I love and I got rhythm from An American in Paris. The cabaret genre is likewise present, with numbers by Kurt Weill (Buddy on the nightshift and Je ne t’aime pas) and William Bolcom’s humorous Amor. Léna Kollmeier also displays her skill as a solo pianist in two attractive, demanding pieces filled with imagery.",,https://b2b.naxosusa.com/Album.aspx?product=HC19026&medium=phy,01 Classical,Classical,Pop,Germany,2019 Profil Medien GmbH,2019 Profil Medien GmbH,,,,,,,,,,,,,,,,,,,,
2019,Hungaroton,HCD14364,5991811436421,NA,Salten: Bambi,Adel Kovats; Laszlo Fenyo,1,CD,14.81,14.81,"Bambi, a Life in the Woods, originally published in Austria as Bambi: Eine Lebensgeschichte aus dem Walde is a 1923 Austrian novel written by Felix Salten and published by Ullstein Verlag. The novel traces the life of Bambi, a male roe deer, from his birth through childhood, the loss of his mother, the finding of a mate, the lessons he learns from his father and experience about the dangers posed by human hunters in the forest. An English translation by Whittaker Chambers was published in North America by Simon & Schuster in 1928,[1] and the novel has since been translated and published in over 30 languages around the world. Salten published a sequel, Bambis Kinder, eine Familie im Walde (Bambi's Children), in 1939. The work is read here in Hungarian by Adel Kovats.",,https://b2b.naxosusa.com/Album.aspx?product=HCD%2014364&medium=phy,15 Spoken Word,Spoken Word,,Hungary,2018 Fotexnet Kft.,2018 Fotexnet Kft.,,,,,,,,,,,,,,,,,,,,
2019,IBS Classical,IBS-12019,8436556421242,Luis De Pablo ,Pablo: Anatomias,Zahir Ensemble; Julio Moguer; Dieter Nel; Marie Teresa Pfiz ,1,CD,12.47,12.47,"The present release is the result of a determined and independent search for sound. It represents a commitment shared between the composer, performer and producer to popularize a little known musical repertoire; one which has been largely ignored in recent contemporary Spanish compositional history, but one that is nevertheless deserving of recognition. In the search for this sound, we began with the composer Luis de Pablo (b. Bilbao, 1930), that indefatigable seeker with the wide intellectual profile. With his sterling reputation as an artist, a study of Luis de Pablo is an essential ingredient to any understanding of contemporary Spanish music. Above all, we observed the behaviour of this leading composer; assuming, in his case, it stemmed from a deep personal conviction; one which led him to manage, promote, and disseminate contemporary creativity in all of its many expressions.",,https://b2b.naxosusa.com/Album.aspx?product=IBS-12019&medium=phy,01 Classical,Classical,,Spain,2019 IBS Artist,2019 IBS Artist,,,,,,,,,,,,,,,,,,,,
2019,IBS Classical,IBS-22019,8436556421235,Leonard Bernstein; Morton Gould; Nikolai Kapustin; Oscar Navarro ,Joan Enric Lluna: Jazz Impact - Hommage to Bernstein,Joan Enric Lluna; Juan Carlos Garvayo; Salvador Bolon; Toni Garcia; Ignasi Domenech ,1,CD,12.47,12.47,"Joan Enric Lluna writes of this release: “Leonard Bernstein has always loomed large among the musicians who have most fascinated me. Not only did he demonstrate huge vitality and charisma as a conductor, and compose the wonderful music that is his legacy, but he worked tirelessly as a communicator and “pedagogue”. His explanations of wide-ranging aspects of music to the viewers of his television programme for children, his lectures at Harvard University and his books have all been an enormous source of information. In recognition of the centenary of his birth, we dedicate to him this recording of his works for clarinet. At the same time, we pay homage to another musician whom I greatly admire - Benny Goodman - and include two other works directly linked to the theme of this album - the impact of jazz on Bernstein’s output. In “Lenny” (Bernstein’s nickname among his friends and collaborators), Oscar Navarro perfectly captures the spirit of the great master’s music. After playing in the première of his work for chamber group, I was so impressed that I asked Oscar for a version for clarinet. I am most grateful to Oscar for his efforts. The Kapustin Trio, originally for flute, elaborates on the impact of jazz on classical composition from a more contemporary perspective. In the years between Bernstein and Kapustin, rock, pop and other trends all made their mark, and their influence can likewise be heard in this trio. I was urged to make this version by my friends and collaborators Juan Carlos Garvayo and Paco Moya, and I hope listeners will appreciate how well it works with clarinet. I have changed various octaves, enhancing the music’s intensity, and translating the flute part to the specific “language” of the clarinet.”",,https://b2b.naxosusa.com/Album.aspx?product=IBS-22019&medium=phy,01 Classical,Classical,,Spain,2019 IBS Artist,2019 IBS Artist,,,,,,,,,,,,,,,,,,,,
2019,IBS Classical,IBS-32019,8436556420948,Antonin Dvorak ,Dvorak: Cello Works,Adolfo G. Arenas; Magdeburg Philharmonic Orchestra; Juan Carlos Garvayo ,1,CD,12.47,12.47,"It is the part the cello must interpret by assuming or acquiring a human nature. Dvorák transforms it into a warm lyrical baritone. He repopulates it with harmonics and nuances. And he shows us that the best way to overcome cello “limitations” is none other than to transcend it. Dvorák turns the cello into a meta-cello. Just as in a Mephistophelian pact, he achieves the feat of “animating” it. And the soul is in the score. You have to know how to find it. No one better to do it than Adolfo Gutiérrez Arenas, from his sensitivity, spontaneity and affinity to an instrument he would never have wanted to explore if Bach and Dvorák had not persuaded him otherwise.",,https://b2b.naxosusa.com/Album.aspx?product=IBS-32019&medium=phy,01 Classical,Classical,,Spain,2019 IBS Artist,2019 IBS Artist,,,,,,,,,,,,,,,,,,,,
2019,ICA Classics,ICA5157,5060244551572,Wolfgang Amadeus Mozart ,Mozart: Le nozze di Figaro,Carlo Maria Giulini,2,CD,19.49,19.49,"This release has been sourced from the Richard Itter archive of ‘live’ BBC recordings. The collection is very important for collectors because it has never been on the market before. Following the archive’s launch in October 2017 with successive releases featuring Beecham, Bohm, Cantelli, Casadesus, Karajan, Menuhin, Monteux, du Pre, Klemperer, Rostropovich and Walter, it has received universal praise from both the classical media and record collectors for the excellent sound and performances. Carlo Maria Giulini’s celebrated studio recording of Le nozze di Figaro was recorded in September 1959 following a live performance at the Royal Festival Hall a few days earlier. Nearly 18 months later there was another performance but with a substantially different cast. Harold Rosenthal in Opera magazine wrote of the concert performance: “Giulini’s reading of this miraculous score has deepened since the studio recording… the spark that was suddenly kindled between conductor and Teresa Berganza in ‘Voi che sapete’ was a moment to treasure. Indeed all Miss Berganza’s singing was outstanding.”",,https://b2b.naxosusa.com/Album.aspx?product=ICAC5157&medium=phy,01 Classical,Classical,,Germany,"2019 BBC, under licence to International Classical Artists Ltd.Licensed by BBC Worldwide.",2019 International Classical Artists Ltd,,,,,,,,,,,,,,,,,,,,
2019,ICA Classics,ICA5158,5060244551589,Various ,"Sir Thomas Beecham, Vol. 2",Various,3,CD,19.49,19.49,"Rob Cowan wrote in Gramophone about the first volume featuring Sir Thomas Beecham: ‘numerous live Beecham releases have appeared over the last few years, some more successful than others (in both recording and performance terms), but this collection is certainly one of the best.’ This second volume continues with rare performances which as far as is known have never been made available before covering a period from 1952 to 1959. French music was a favorite of Beecham and this set is made up of music by Chabrier, Franck, Gretry, Lalo, Mehul and Saint-Saens, all of which he recorded in the studio but when Beecham was caught ‘live,’ it often showed the mercurial side of his character and no performance was ever the same. As David Patmore said in an essay: ‘What Beecham sought at all times was freshness and his unpredictability was one way of achieving this.’ The Franck is played for all its worth while the Mehul, rather than being performed as a period performance, is treated as a romantic composer in a big-boned approach. The Lalo Symphony with the RPO has a greater intensity than the French studio recording which came a few months later.",,https://b2b.naxosusa.com/Album.aspx?product=ICAC5158&medium=phy,01 Classical,Classical,,Germany,"2019 BBC, under licence to International Classical Artists Ltd.Licensed by BBC Worldwide.",2019 International Classical Artists Ltd,,,,,,,,,,,,,,,,,,,,
