2019,First Hand Records,FHR84,5060216349084,John Dowland ,Michael Butten Plays Dowland,Michael Butten,1,CD,15.59,23.99,"John Dowland (1563–1626) is recognized as the greatest English composer of lute music and songs. Michael Butten presents a collection of the composer’s most popular and beautiful songs arranged for the classical guitar. A whole album of Dowland performed on classical guitar is rare, usually heard on the lute, so FHR are pleased to be able to present this release. In this recording, Butten plays with a very beautiful sound, incredible colors, lovely melodic phrasing and immaculate control of tone, which draws you right in. This is a spellbinding album, wonderfully recorded. Born in Berkshire, Michael Butten studied at Junior Academy, where he twice won the Lower Strings Prize, before being awarded a scholarship at the Academy to continue his studies with Michael Lewin. In his first year he won the Julian Bream Prize, adjudicated by Julian Bream, and, shortly afterwards, gained the Nervi/Bodrato Prize as the youngest semi-finalist at the Michele Pittaluga Guitar Competition in Alessandria. On completing his BMus degree with first class honours, he received from the Academy one of the Regency Awards for Notable Achievement and in June 2014, as a postgraduate with a scholarship from Help Musicians UK, he became the first guitarist ever to win the R.A.M. Club Prize. He was the 1st prize winner at the 2016 Ivor Mairants Guitar Award, and is a Yeoman of the Worshipful Company of Musicians. Upon leaving the Academy in 2016 he also won the David Russell Prize.",https://youtu.be/vcKDh_62LYU,https://b2b.naxosusa.com/Album.aspx?product=FHR84&medium=phy#,01 Classical,Classical,Classical|Guitar,United Kingdom,2019 First Hand Records,2019 First Hand Records,,,,,,,,,,,,,,,,,,,,
2019,Footprint Records,SEWRR1900106,7320470240885,Maria Lithell Flyg ,Flyg: Collected Chamber Music,Various,1,CD,13.25,20.99,"This album is a collection of recently recorded Chamber music by the Swedish composer Maria Lithell Flyg. There's a saxophone quartet, a duo with piano and cello, an oboe quartet, a duo with soprano saxophone and percussion, a duo for two violins and finally a piece for barython, piano, violin and a vocal ensemble. Maria Lithell Flyg has always been driven by curiosity, a hunger for learning, and a desire to express herself. The path to becoming a composer had its twists and turns, even though she began crafting lyrics and tunes at a very tender age. Though Maria had her formal training relatively late in life, she has already composed a significant number of pieces for some of Sweden’s finest musicians, such as the Stockholm Saxophone Quartet, Cecilia Zillacus, Olle Persson, Musica Vitae, and others.",,https://b2b.naxosusa.com/Album.aspx?product=SEWRR1900106&medium=phy#,01 Classical,Classical,Classical|Contemporary Era,Sweden,Little by Lithell Music Production,,,,,,,,,,,,,,,,,,,,,
2019,Frémeaux et Associés,FA5560,3561302556024,Pascal Brioist ,Francois Ier - Une Biographie Expliquee,Pascal Brioist,4,CD,23.39,35.99,"Presses Universitaires de France and Fremeaux & Associates offer this biography of Francis I, analyzed and explained by Pascal Brioist, professor of the universities, specialist of the intellectual and scientific history of the Renaissance. The evocation of Francis I awakens in us the school memories of portraits of Clouet or Titian, the Battle of Marignan or the stay of Leonardo da Vinci Clos Lucé. But beyond the agreed images, who exactly was this patron king? What were his political enterprises? Pascal Brioist details the biography of the great man, his education, his training, his practices of power and his inclination for the arts. A destiny that takes shape against a backdrop of national construction (the linguistic unification of France), European events (the wars of Italy, the beginnings of the Reformation, the rivalry with the Habsburgs) and world history (the New World race).",,https://b2b.naxosusa.com/Album.aspx?product=FA5560&medium=phy#,15 Spoken Word,Spoken Word,,France,2019 Frémeaux & Associés / PUF,2019 Groupe Frémeaux Colombini,,,,,,,,,,,,,,,,,,,,
2019,Frémeaux et Associés,FA5684,3561302568423,Various ,Buck & Jo: The Complete Panassie Sessions 1971-1974,Milt Buckner; Jo Jones,4,CD,23.39,35.99,"“In the entire history of jazz there has never been a team to compare with Milt Buckner and Jo Jones. Never has music so rich and so complex been produced by just two musicians.” (Hugues PANASSIÉ, 1971) This set contains every “Buck & Jo” record session produced by Louis and Hugues Panassié from 1971 to 1974, in other words, music by a fantastic drummer, Jo Jones, together with organist Milt Buckner, also a jazz legend, and the man who played a special role in making the Hammond organ so popular, beginning in the early Fifties. Listen to the entente between the two musicians right from the very first note: this 4-album set, compiled and restored by Laurent Verdeaux, delivers some of the finest and most intense moments in Swing.",,https://b2b.naxosusa.com/Album.aspx?product=FA5684&medium=phy#,02 Jazz,Jazz,Jazz|Trad Jazz,France,1971-1974-2001 JAZZ ODYSSEY RECORDS - FRÉMEAUX & ASSOCIÉS CESSIONNAIRE 2016,2019 Groupe Frémeaux Colombini,,,,,,,,,,,,,,,,,,,,
2019,Frémeaux et Associés,FA5705,3561302570525,Michel Onfray ,"Decadence, Vol. 1 - Naissance du Christianisme",Michel Onfray,14,CD,54.59,83.99,"“Civilizations are born, live, and die, and ours is no exception.” If the pagan gods that inspired the construction of Stonehenge, Cheops, and the Parthenon are today relegated to pure mythology, is it reasonable to think that Christianity will be immortal? Studying these ruins makes it possible to think about civilizations and to face with discernment the dynamic of decadence that is imposed after 2,000 years of Judeo-Christianity. Michel Onfray presents here the historical origins of these belief systems. The philosopher details the birth of this common base of values forged by the fathers of the Church, more so than by Jesus, during the first centuries of our era, and who continue to define, in spite of themselves, the identity of our civilization.",,https://b2b.naxosusa.com/Album.aspx?product=FA5705&medium=phy#,15 Spoken Word,Spoken Word,,France,2018-2019 Radio France - Frémeaux & Associés - UP de Caen,2019 Michel Onfray - Groupe Frémeaux Colombini,,,,,,,,,,,,,,,,,,,,
2019,Frémeaux et Associés,FA8561,3448960856126,Various; Traditionnal; Gheorghe Zamfir ,Zamfir: Repertoire for Piano & Panpipe Duo,Gheorghe Zamfir; Christiane Gugger,1,CD,14.81,22.99,"Gheorghe Zamfir is the great international exponent of the pan flute. A virtuoso of the nai or Romanian pan flute, his sound is so particular, so recognizable, that everyone has heard him play, either on one of the million records he has sold worldwide, or else on the cult soundtracks he has recorded for film-composers like Vladimir Cosma and Ennio Morricone, and directors like Quentin Tarantino. On this recording, far from the great symphony orchestras, Zamfir appears in duo with pianist Christiane Gugger performing his own repertoire. Here you can discover a more intimate vision of his music that reveals all its powers of meditation and serene strength. Recorded by Jean-Claude Gaberel, a goldsmith in sound with an international reputation, this album translates all the force of Zamfir’s music, which lies at the crossroads between genres: classical, folk, international pop, new age and crossover.",,https://b2b.naxosusa.com/Album.aspx?product=FA8561&medium=phy#,01 Classical,Classical,Classical|Classical Crossover,France,2018 Christiane Gugger - Frémeaux & Associés,2019 Groupe Frémeaux Colombini,,,,,,,,,,,,,,,,,,,,
2019,Frémeaux et Associés,FA8564,3448960856423,Various ,La Section Rythmique +2,La Section Rythmique; Harry Allen; Luigi Grasso,1,CD,14.81,22.99,"At last, they’re back! La Section Rythmique, the fabulous group whose stars were always behind the scenes, namely David Blenkhorn, Guillaume Nouaux and Sebastien Girardot. Catapulted to the front of the stage with the release of their first album — it was Record of the Year for Jazz Magazine in 2015 — the group has played countless concerts and done many recordings since then with the likes of Cecile McLorin Salvant, Evan Christopher, Scott Hamilton, Lillian Boutté or Jason Marsalis among others. La Section Rythmique has moved away from the New Orleans material of their first recording and taken swing and bop directions. And since only musicians of this band’s calibre could allow themselves guests like these, they’ve gone into the studio with two giants of the saxophone: American star Harry Allen and young Italian player Luigi Grasso. Only La Section Rythmique could provide such an amazing setting and rival the playing of their two guest soloists. Don’t miss this album!",,https://b2b.naxosusa.com/Album.aspx?product=FA8564&medium=phy#,02 Jazz,Jazz,Jazz|Bebop,France,2018 la Section Rythmique - Frémeaux & Associés,2019 Groupe Frémeaux Colombini,,,,,,,,,,,,,,,,,,,,
2019,Frémeaux et Associés,FA8565,3448960856522,Various ,Karl Zero: Songs for Cabriolets & Otros Tipos de Veiculos,Karl Zero,1,CD,14.81,22.99,"Initially released in the year 2000, Karl Zéro’s first album, a little pop gem, reached cult status. Inside this tribute to extreme cocktail music, space age pop and late Fifties’ exotica, audiences discovered thirteen deliciously ‘vintage’ acid drops, cha cha chas and other ritmos locos… Produced by Karl Zéro and Alexandre Desplat, the album, recorded in Karl’s own inimitable, singer/talk-show presenter style, contains a mischievous mix of poetry and humour that takes Henri Salvador, Daisy d’Errata and Eric Laugérias for a ride in the wake of Marino Marini, Xavier Cugat or Mikis Theodorakis. A kind of musical U.F.O., this record adorned one of the most remarkable X-Files episodes and met with international success.",,https://b2b.naxosusa.com/Album.aspx?product=FA8565&medium=phy#,11 Latin,Latin,World|France,France,KARL ZÉRO – LA SOCIÉTÉ SECRÈTE,2019 Groupe Frémeaux Colombini sous licence La Société Secrète,,,,,,,,,,,,,,,,,,,,
2019,Frémeaux Heritage,FA5736,3561302573625,Various; Traditional ,Hugues Aufray: Integrale Chonologique 1958-1962,Hugues Aufray,2,CD,23.39,35.99,"Whether the music is skiffle, folk or from Brazil’s Nordeste, Hugues Aufray knows how to make the sounds rhyme with travel, and his songs belong to everyone’s songbook. This set looks back on Aufray’s early years: from his ascent from cabaret and little Left Bank clubs prior to his decisive meeting with Eddie Barclay, all the way to his immense, eternal hit “Santiano”. Produced by Olivier Julien and Hugues Aufray himself, the set includes the artist’s own account of his career, which made him an icon from the beginning of the Sixties. He first began writing songs for French singers. After finishing second in a singing competition, he signed a record deal in 1959 with Eddie Barclay. From there, he went on to co-write and arrange many songs, drawing influence from folk, blues and rock. While supporting Peter, Paul and Mary in New York in 1962, he struck up a friendship with Bob Dylan, who would then visit him in Paris in 1964. Aufray translated many of Dylan's songs into French: their appearance on his 1965 album Aufray chante Dylan helped form the tastes of the new French generation.",,https://b2b.naxosusa.com/Album.aspx?product=FA5736&medium=phy#,24 Pop,French Pop,,France,2019 Frémeaux & Associés / Public Domain,2019 Groupe Frémeaux Colombini,,,,,,,,,,,,,,,,,,,,
2019,Gega New Limited,GD390,3800121303908,Johannes Brahms; Clara Schumann; Pauline Garcia Viardot ,Rumen Cvetkov & Ludmil Angelov: Brahms Alliance,Rumen Cvetkov; Ludmil Angelov,1,CD,13.25,20.99,"During the last 7 years of his life Johannes Brahms dedicated himself to chamber music and many people would agree that in this period he produced the most profound music in his entire writing career. While at Bad Ischl, his constant encounters with J. Strauss, but also with the great clarinetist Richar Mühlfeld, inspired Brahms to produce such fine examples of the chamber music repertoire known today. The 2 clarinet sonatas, which he also transcribed for the viola, are quite melancholic in comparison with the other clarinet opuses which he wrote just before. Brahms was also deeply saddened by the sudden loss of his great friend and muse Clara Schumann. As they shared wonderful long term artistic and personal relationship, quite possibly they influenced each other in their composing as well. The project “Brahms Alliance” is inspired by the friendship and legacy of those 2 much celebrated composers with the addition of the remarkable singer and composer Pauline Viardot who is represented in the project by her lovely 6 pieces for violin and piano (version for viola). The trio Schumann, Brahms, Viardot is to represent the mutual inspiration those composers felt at the time of their lives for the remarkable and unforgettable music they left behind for generations.",,https://b2b.naxosusa.com/Album.aspx?product=GD390&medium=phy#,01 Classical,Classical,Classical|Chamber Music,Bulgaria,2019Gega New Ltd.,2019 Gega New,,,,,,,,,,,,,,,,,,,,
2019,Genuin,GEN 19555,4260036255553,Frederic Chopin; Franz Liszt ,Shize Shen: Fire - Works by Frederic Chopin & Franz Liszt,Shize Shen ,1,CD,14.81,22.99,"A concert hall in China has already been named after her: despite her young age, Shizhe Shen is now one of the most well-known pianists in her home country. Now the Steinway Artist is releasing her debut album with GENUIN and showing why she is so appreciated, even adored by critics and audiences around the world. Passionate and technically masterful, she interprets the great benchmarks of the piano repertoire by Liszt and Chopin. The Nocturnes whisper, the Scherzi sparkle, and the hellish flames of the Mephisto Waltz crackle – simply stunning!",,https://b2b.naxosusa.com/Album.aspx?product=GEN%2019555&medium=phy,01 Classical,Classical,Classical|Piano,Germany,GENUIN classics,GENUIN classics,,,,,,,,,,,,,,,,,,,,
2019,Genuin,GEN 19655,4260036256550,Wolfgang Amadeus Mozart ,Annette Unger & Robert Umansky: Lost in Thought: Sonatas & Variations for Violin & Piano by Wolfgang Amadeus Mozart,Annette Unger; Robert Umansky,1,CD,14.81,22.99,"Cheerfulness and depth, youthful urgency and ageless serenity: all this is found not only in Mozart’s most famous works. We also encounter these astonishing contrasts at every turn in the enchanting duos presented by renowned violinist Annette Unger and her piano partner Robert Umansky on their new GENUIN release. The program features sonatas and variation cycles from “middle-period” Mozart to the years of maturity. The interpretation offered by the two Dresden musicians impresses with its vividness and transparency together with a great love for the details of these musical gems.",,https://b2b.naxosusa.com/Album.aspx?product=GEN%2019655&medium=phy,01 Classical,Classical,Classical|Chamber Music,Germany,GENUIN classics,GENUIN classics,,,,,,,,,,,,,,,,,,,,
2019,Genuin,GEN 19657,4260036256574,Karsten Gundermann; Heinrich von Meissen ,Gundermann: Kreuzleich by Heinrich von Meissen,Octavians; Akademische Orchestervereinigung Jena,1,CD,14.81,22.99,"The work featured in the Octavians’ GENUIN release is 700 years old: the Kreuzleich by Heinrich “Frauenlob” von Meissen. The multi-award-winning a cappella ensemble with three countertenors takes on this fascinating work in a new guise, as a new composition by Karsten Gundermann for soloists, chamber choir, and orchestra. The result is sensational: a lively mixture of age-old and new, of archaic sounds and orchestral colors, sung and performed at the highest level. In terms of repertoire and entertainment value, highest ratings for this total work of art that inspires at every moment!",,https://b2b.naxosusa.com/Album.aspx?product=GEN%2019657&medium=phy,01 Classical,Classical,Classical|Chant,Germany,GENUIN classics,GENUIN classics,,,,,,,,,,,,,,,,,,,,
2019,Genuin,GEN 19659,4260036256598,Astor Piazzolla; Sergei Rachmaninow; Mikis Theodorakis ,"Tatjana & Arkadi Zenziper: Schicksalsklange - Werke fur zwei Klaviere von Rachmaninoff, Theodorakis & Piazzolla",Tatjana Zenziper; Arkadi Zenziper ,1,CD,14.81,22.99,"The music of this new GENUIN release flows longingly from the loudspeakers: music for two pianos performed by the fabulous piano duo Tatjana and Arkadi Zenzipér. The two pianists interpret music of the twentieth century that tells of the loss of home, of love and freedom. It includes three arrangements that reveal the structure, the soul of the works in concentrated form: Rachmaninoff’s Paganini Variations and Symphonic Dances along with Astor Piazzolla’s fiery Libertango. These are joined by Mikis Theodorakis’ archaic Passacailles. The piano duo merge with one another musically and combine the precision of two-handed playing with the sound volume and wealth of nuances offered by two pianos – absolutely recommended!",,https://b2b.naxosusa.com/Album.aspx?product=GEN%2019659&medium=phy,01 Classical,Classical,Classical|Piano,Germany,GENUIN classics,GENUIN classics,,,,,,,,,,,,,,,,,,,,
2019,GIA ChoralWorks,GIACD-1048,785147004820,Ola Gjeilo; Hildegard von Bingen; Anonymous; Maurice Durufle; Felix Mendelssohn; Damijan Mocnik,Gjeilo: Sunrise Mass,Westminster Williamson Voices,1,CD,13.25,20.99,"Sunrise Mass is a magical recording that includes compelling music by Ola Gjeilo along with several complementary selections by Durufle, Mendelssohn, and Mocnik. The title was chosen to hopefully represent the journey of each listener to hear new worlds ot colors in each of the selections. At the heart of this recording is Gjeilo’s Sunrise Mass, a spiritual, extended work in four movements that will bring you on a metaphysical journey from the heavens to earth. This recording is expertly sung by the Westminster Williamson Voices and conducted by James Jordan. It is simply exquisite. Jordan writes: “This has been our experience living with this music and, for me, allowing this choir to resonate these sounds in the most honest way we could. Gjeilo’s music allows us to connect to a vast wordless world that speaks directly to each of us in deeply personal and meaningful ways. His music was a gift to us, and hopefully will be a gift to you. All of the music on this recording connected itself to us and tethered each piece, one to the other, inside us. And for that reason, and all the reasons above, we are excited to share the magic we felt through sounding all of these incredible scores.”",https://www.giamusic.com/store/resource/joyful-angels-song-recording-cd1048,https://b2b.naxosusa.com/Album.aspx?product=GIACD-1048&medium=phy#,Christian & Gospel,Christian & Gospel,Inspirational,United States,"2019 GIA Publications, Inc.","2019 GIA Publications, Inc.",,,,,,,,,,,,,,,,,,,,
2019,GIA Publications,GIACD-1062,785147006220,Jeanne Cotter ,Cotter: All Is Holy,Jeanne Cotter ,1,CD,13.25,20.99,"All Is Holy is a compilation recording packed with all the best songs from liturgical composer and author Jeanne Cotter's impressive catalog. This recording also includes “Thirsting for Justice,” the exciting new theme song written for the 2019 Los Angeles Religious Educator’s Congress. With beloved songs like “Psalm 103: The Lord Is Kind and Merciful,” “Lord, Send Out Your Spirit,” and “Psalm 33: Blessed Are We” along with several of her most beloved piano solos, All Is Holy will bring you moments of exquisite joy, quiet contemplation, and blissful peace. Jeanne Cotter writes: “Whether sharing something really joyous with my father, or talking through a touch challenge in my life, Dad would always end our conversation by saying “It’s all a gift, Squeeze. It’s all a gift!”… As I experience the changing seasons of my life, my father’s voice and wisdom echo in my heart. I am reminded to trust in the unfolding of life and to receive and cherish each and every moment as a gift!”",https://www.giamusic.com/store/resource/all-is-holy-recording-cd1062,https://b2b.naxosusa.com/Album.aspx?product=GIACD-1062&medium=phy#,Christian & Gospel,Christian & Gospel,Inspirational,United States,"2019 GIA Publications, Inc.","2019 GIA Publications, Inc.",,,,,,,,,,,,,,,,,,,,
2019,Glossa,GCD923517,8424562235175,Nicolas-Charles Bochsa; Sophia Dussek; Joseph Elouis; Franz Joseph Haydn; Leopold Kozeluch; Anne-Marie Krumpholtz; Jean-Baptiste Krumpholtz; Exupere de La Maniere; Louis-Charles Rague ,Chiara Granata: Haydn & the Harp,Chiara Granata; Raffaele Pe; Anais Chen; Marco Ceccato,1,CD,14.81,22.99,"For her first solo outing on Glossa, entitled Haydn and the harp, Chiara Granata presents a gorgeous demonstration, full of elegance and refinement, of the importance of the harp in the Classical era – and of Franz Joseph Haydn’s significant contribution to its development. Granata’s selection demonstrates how composers strove to get the most out of the harp by pushing for experimental technical demands without forcing its sound or calling for unnatural tempi; this was often with Haydn being involved in providing advice to composers and performers alike. As further witnesses of Haydn’s penchant for the harp Chiara Granata includes in her programme a selection of folk melodies from the British Isles arranged by the composer, then (in Stendhal’s words) “full of glory and year”. Here she is joined by countertenor Raffaele Pe, violinist Anaïs Chen and cellist Marco Ceccato. Other composers utilized Haydn’s compositions as inspiration for their own, as can be heard in Nicolas-Charles Bochsa’s Petite Mosaique sur La Creation d’Haydn or even made arrangements of his symphonies, such as was the case with Louis-Charles Ragué. Chiara Granata (a pupil of that treasured Glossa artist, Mara Galassi) plays two instruments built at the time of the compositions making up this delightful programme: a Holtzman harpe à crochet and a single-action harp by Naderman, the latter employed for the solo tour de force that is Boscha’s Petite Mosaique.",,https://b2b.naxosusa.com/Album.aspx?product=GCD923517&medium=phy#,01 Classical,Classical,,Austria,2019 note 1 music gmbh,2019 note 1 music gmbh,,,,,,,,,,,,,,,,,,,,
2019,Glossa,GCD923518,8424562235182,Marco dall’Aquila; Lukas Henning ,Lukas Henning: Bella Incognita - The Imagination of Marco dall'Aquila,Lukas Henning,1,CD,14.81,22.99,"With lutenist Lukas Henning, Glossa unveils a striking new talent as he presents Bella incognita, a recital devoted to the enigmatic 16th-century Venetian composer Marco dall’Aquila, a musician frequently referred to in the sources but one who is difficult to characterize. With the increased use of the six-course instrument, writing for the lute became more polyphonic, with a greater level of complexity and frequently making use of existing musical works such as the chanson Il est bel et bon by Pierre Passereau; the system – called tablature – of graphically representing this complexity was introduced as the 16th century commenced. Curiously, Marco made an early petition to hold the rights to the printing of tablature in Venice. Yet apparently, no imprints from him appeared and very little of his own music was printed for some three decades. The story of how some of Marco’s music has survived to this day and the relationship that his kind of compositions – often Ricercari but also an early example of a Fantasia – had with the paintings of Giorgione is engagingly told by Lukas Henning in the booklet essay to this new recording. Henning, whose credentials as a performer and as an investigator are backed by his having studied at the prestigious Schola Cantorum Basiliensis – and with no less a star in the lutenist firmament than Hopkinson Smith –, intersperses this new selection of works by Marco dall’Aquila with some of his own sympathetic and informed compositions – including a delightful piece which explores the nightmare of breaking a string!",,https://b2b.naxosusa.com/Album.aspx?product=GCD923518&medium=phy#,01 Classical,Classical,,Austria,2019 note 1 music gmbh,2019 note 1 music gmbh,,,,,,,,,,,,,,,,,,,,
2019,Grand Piano,GP756,747313975624,Vincent d' Indy ,"d'Indy: Piano Sonata in E, Op. 63; Tableaux de Voyage (excerpts)",Jean-Pierre Armengaud,1,CD,13.25,20.99,"A student of Franck, Vincent d’Indy founded the Schola Cantorum de Paris where he taught for many years. He was also a conductor, with a busy schedule of international touring. His compositions were permeated by the influence of Wagner- he attended the premiere of the Ring cycle- but in time he also absorbed the influence of French folk music, especially from the Vivarais, his ancestral home. Vincent d’Indy’s large-scale Piano Sonata is one of a small but masterful sequence of non-programmatic instrumental works that he wrote in the first decade of the 20th century. Notable for a novel application of variation form in its opening movement it fuses experimentation with expressive power. Poetic atmospheres and landscapes are evoked in the Tableaux de voyage, postcards of his walks in Germany. The sonata was recorded in the castle Les Faugs in Ardèche, where d’Indy lived – the same place where the work was composed in 1907. Jean-Pierre Armengaud is today acknowledged as one of the great interpreters of French music, and has recorded critically acclaimed releases of Debussy, Roussel, Poulenc and Aubert for Naxos.",,https://b2b.naxosusa.com/Album.aspx?product=GP756&medium=phy#,01 Classical,Classical,,Germany,2019 HNH Int. Ltd. ,2019 HNH Int. Ltd. ,,,,,,,,,,,,,,,,,,,,
