2019,Neue Meister,0301211NM,885470012117,Federico Albanese ,Albanese: The Twelve,Federico Albanese,1,CD,14.81,22.99,"""The Twelve"" is a soundtrack, but it also is an album very much in its own right, with tracks that stand on their own, ""It tells the story of [..] twelve people even without you seeing the film"" explains Federico Albanese. The pieces invoke feelings of meditation and anticipation that convey a wonderful sense of storytelling, and hearing about Albanese's inspiration for these only strengthens their narrative. Take ""The Stars We Follow"", a piece as gentle and contemplative as it is powerful. The track was inspired by Japanese master Aoki Hiroyuki and the special practice he developed in order to connect to nature, ""It's something between a martial art and a dance. At some point Lucy sent me a short clip where they do a session of this on a beach, and I thought somehow the movements were like chasing stars,"" explains Albanese, ""as well as the general idea of all these elders travelling, and following their own ideas and stars and trying to communicate them with the world."" The wonderfully comforting piece ""North Variation"" was inspired by Master Lyudmila Khomovna, one of the last people of Uilta decent living in a remote island in Siberia, ""She is a very particular person, and profoundly elder, a very wise person. I was having this idea in mind of something set in a very cold place but with a deep warmth within,"" says Albanese. ""The Twelve"" cemented Federico Albanese’s abilities to work outside his comfort zone. Being simultaneously able to adapt to the collaborative efforts of filmmaking while following his own internal creative process, his album demonstrates the added value of organic partnerships between artists, ""I would say cinema is my second love besides music. I'm probably not the kind of person who is willing to write music for anything, I am happy to pledge to a project when I can see there is something I can give to it.""",https://vimeo.com/228518787,https://b2b.naxosusa.com/Album.aspx?product=0301211NM&medium=phy,01 Classical,Classical,Soundtrack,Germany,2019 Edel Germany GmbH,2019 Edel Germany GmbH,,,,,,,,,,,,,,,,,,,,
2019,NEW FOCUS RECORDINGS,FCR226,655646189864,Rose Bolton; Scott Godin; Michael Oesterle ,"Bolton, Godin, & Oesterle: Music in the Barns",Music in the Barns ,1,CD,13.25,20.99,"In the mid-1990s a community of composers and performers came together at Montreal’s McGill University, loosely centered around composer Michael Oesterle and pianist Marc Couroux (who together went on to form the influential Ensemble KORE). This group included many of today’s leading Canadian composers such as Rose Bolton, Paul Frehner, Nicole Lizee, Scott Godin, and Brian Current, and dedicated performers from McGill’s Contemporary Music Ensemble (led by Bruce Mather and, later, Denys Bouliane), the members of the Bozzini Quartet and violist Pemi Paull. It was a transitional generation: the composers were moving away from avant-gardism and re-embracing popular forms, looking away from academia and creating their own groups while still dependent on the local institutions for support and recognition. It was a unique time of intense creation and collaboration that has had a lasting effect on the Canadian new music scene, as the composers’ lives and careers spread them to communities coast to coast, introducing their work to new audiences and a new generation of students. The three works presented here were selected to represent this Canadian voice in new chamber music. The works were championed by Music in the Barns from 2011-2015 as part of their vision to advance this voice within the international musical community.",,https://b2b.naxosusa.com/Album.aspx?product=FCR226&medium=phy#,01 Classical,Classical,Classical|Contemporary Era,Canada,Music in the Barns,Music in the Barns,,,,,,,,,,,,,,,,,,,,
2019,Nimbus,NI5976,0710357597626,George Benjamin ,Benjamin: Lessons in Love & Violence,Stephane Degout; Barbara Hannigan; Gyula Orendt; Peter Hoare; Samuel Boden; Jennifer France; Krisztina Szabo; Andri Bjorn Robertsson; Netherlands Radio Philharmonic Orchestra; Martin Crimp,2,CD,14.81,22.99,"Lessons in Love and Violence is an opera with music by George Benjamin and text by Martin Crimp. The opera, which is based on the story of King Edward II and Piers Gaveston and covers the events set out in Christopher Marlowe's play Edward II, which combines the story of Edward and Gaveston with the deposition of Edward II by Mortimer and the overthrow of Mortimer and Edward's queen Isabella of France by Edward III. The opera is in two parts, of four and three scenes respectively, and is performed without a break. The opera was co-commissioned by the Royal Opera Covent Garden London, the Dutch National Opera Amsterdam, Staatsoper Hamburg, Opera de Lyon, Lyric Opera of Chicago, Gran Teatre del Liceu, Barcelona and Teatro Real Madrid. This production was recorded by the Dutch National Opera in June and July of 2018.",,https://b2b.naxosusa.com/Album.aspx?product=NI5976&medium=phy#,01 Classical,Classical,Classical|Opera,United Kingdom,2019 Wyastone Estate Limited issued under licence from Dutch National Opera,2019 Wyastone Estate Limited issued under licence from Dutch National Opera,,,,,,,,,,,,,,,,,,,,
2019,Nimbus Alliance,NI6384,0710357638428,Franz Schubert ,"Schubert: Piano Sonatas, Vol. 5",Vladimir Feltsman ,2,CD,23.39,35.99,"Pianist and conductor Vladimir Feltsman is one of the most versatile and constantly interesting musicians of our time. His vast repertoire encompasses music from the Baroque to 21st-century composers. He has appeared with all the major American orchestras and on the most prestigious musical stages and festivals worldwide. Born in Moscow in 1952, Mr. Feltsman debuted with the Moscow Philharmonic at age 11. In 1969, he entered the Moscow Tchaikovsky State Conservatory of Music to study piano under the guidance of Professor Jacob Flier. He also studied conducting at both the Moscow and Leningrad (now St. Petersburg) Conservatories. In 1971, Mr. Feltsman won the Grand Prix at the Marguerite Long International Piano Competition in Paris; extensive touring throughout the former Soviet Union, Europe and Japan followed this. A dedicated educator of young musicians, Mr. Feltsman holds the Distinguished Chair of Professor of Piano at the State University of New York, New Paltz, and is a member of the piano faculty at the Mannes College of Music in New York City. This is his 5th volume of Schubert’s Piano Sonatas.",,https://b2b.naxosusa.com/Album.aspx?product=NI6384&medium=phy#,01 Classical,Classical,Classical|Piano,United Kingdom,2019 Wyastone Estate Limited,2019 Wyastone Estate Limited,,,,,,,,,,,,,,,,,,,,
2019,Ocora Radio France,C 560283,3415820000210,Traditional ,"Morocco - Mlouk, Gnawa & World Music Festival",Asma Hamzaoui,1,CD,14.81,22.99,"Since the end of the 19th century, the search to identify the origin of the Gnawa community and its ritual practices relied on a loose phonetic premise found in research devoted to the cult of North African saints and the slave trade in Islamic regions. Maurice Delafosse (1870-1926) had speculated that the Berber expression akal-n-iguinaouen (“land of the Blacks”) could have given rise to the words “Guinea” and “Gnawa” by phonetic similarity and that “Gnawa” could therefore mean a “black” person, or someone “from the land of the Blacks”. In the absence of conclusive historical data, this phonetic relationship gave rise to the hypothetical Sub-Saharan origin of the Gnawa and their rituals. Contemporary researchers now admit that identifying the origin of this people from a word is unreasonable today, especially since the Gnawa of Morocco are not all black, Arab or Muslim. They also co-exist in Berber and Jewish communities. According to new evidence, the Gnawa have been Moroccan for generations and are not all descendants of slaves. The Gnawa of Morocco have a very rich ritual and symbolic tradition which is performed notably in lila. This album is devoted to the third phase of these ritual nights –the Mlouk (“the possessors”)– and offers a sample of an ecstatic moment of the lila when, moving through the seven colours, the maâlem and the community around him occupy the sanctified space.",,https://b2b.naxosusa.com/Album.aspx?product=C%20560283&medium=phy#,30 World/Int'l.,World,,Austria,2019 RADIO FRANCE,2019 RADIO FRANCE,,,,,,,,,,,,,,,,,,,,
2019,Oehms Classics,OC 032,4260034860322,Ludwig van Beethoven; Georges Bizet; Johannes Brahms; Claude Debussy; Antonin Dvorak; Gabriel Faure; Gustav Mahler; Maurice Ravel; Albert Roussel; Franz Schubert; Richard Strauss; Josef Suk ,Bertrand de Billy & ORF Radio-Symphonieorchester Wien,ORF Vienna Radio Symphony Orchestra,9,CD,21.05,32.99,"This new release features the complete symphonic recordings of OehmsClassics with Bertrand de Billy and the ORF Vienna Radio Symphony Orchestra from 2003-2010 when Bertrand de Billy was Chief Conductor in Vienna. Bertrand de Billy was born in Paris where he studied music. Starting as a member of an orchestra, he soon took on conducting. 1993-95 he was first Kapellmeister and Deputy Music Director at the Anhaltisches Theatre in Dessau, 1996-98 he held the same position at the Vienna Volksoper. 1999-2004 he was Music Director at the Gran Teatre del Liceu in Barcelona and 2002-2010 he was Music Director of the Radio Symphony Orchestra in Vienna. Bertrand de Billy is principal guest of the Orchestre de Chambre de Lausanne (2013-2016). Since 2014/2015 he is also principal guest conductor of the Dresdner Philharmonie.",,https://b2b.naxosusa.com/Album.aspx?product=OC%20032&medium=phy#,01 Classical,Classical,Classical|Orchestral,Germany,2003 | 2004 | 2006–2010 OehmsClassics Musikproduktion GmbH in Co-Production with ORF,2019 OehmsClassics Musikproduktion GmbH,,,,,,,,,,,,,,,,,,,,
2019,Oehms Classics,OC 1707,4260330917072,Ludwig van Beethoven; Anton Diabelli; Johann Nepomuk Hummel; Friedrich Wilhelm Kalkbrenner; Franz Liszt; Ignaz Moscheles; Franz Xaver Wolfgang Mozart; Franz Schubert; Robert Schumann; Michael Umlauf; Clara Wieck-Schumann ,Elena Gaponenko: Hommage a Vienne,Elena Gaponenko,1,CD,11.69,17.99,"That Vienna is one of the capitals (if not THE capital) of music is undisputed. With this recording, Elena Gaponenko has dedicated an entire album to the city on the Danube and the composers who have worked there. Really interesting is the time frame that these works originate from, they span exactly 25 years, from 1815–1840. In her introduction to this release Elena Gaponenko writes: “This recording should honour this enchantingly beautiful city as a great guardian of culture, as it has brought so many musical icons together and allowed them to develop creatively.” Pianist and Cellist Elena Gaponenko has been an instructor at music academies in Vienna, Berlin, Frankfurt am Main, Duseldorf and Bremen since 2008.",,https://b2b.naxosusa.com/Album.aspx?product=OC%201707&medium=phy#,01 Classical,Classical,Classical|Piano,Germany,2018 OehmsClassics Musikproduktion GmbH,2019 OehmsClassics Musikproduktion GmbH,,,,,,,,,,,,,,,,,,,,
2019,Oehms Classics,OC 976,4260034869769,Heinrich Marschner ,Marschner: Hans Heiling,Essener Philharmoniker; Rebecca Teem; Heiko Trinsinger; Jessica Muirhead; Bettina Ranch; Jeffrey Dowd; Karel Martin Ludvik; Hans-Gunter Papirnik; Opernchor des Aalto-Theaters; Bergwerksorchester Consolidation,2,CD,22.61,34.99,"The link between Weber and Wagner, Marschner’s Hans Heiling, was staged in the Aalto Music Theatre in February 2018. The production by Andreas Baesler received a mixed reaction, but the music was unanimously lauded by critics, above all the performance of Essen Philharmonic under the baton of Frank Beermann. The German Romantic opera in 3 acts is the composer’s most successful opera, and brought the composer a considerable reputation. The story is based on a folk legend, and the opera’s libretto was written by Eduard Devrient, who also sang the title role at the premiere at what is now the Berlin State Opera. In this production, Heiko Trinsinger performs the title role.",https://www.youtube.com/watch?v=-GHgklncwoU,https://b2b.naxosusa.com/Album.aspx?product=OC%20976&medium=phy#,01 Classical,Classical,Classical|Opera,Germany,2018 Deutschlandradio/WDR Köln/OehmsClassics Musikproduktion GmbH,2019 Deutschlandradio/WDR Köln/OehmsClassics Musikproduktion GmbH,,,,,,,,,,,,,,,,,,,,
2019,Oehms Classics,OC 983,4260034869837,Franz Lehar ,Lehar: Die lustige Witwe,Frankfurter Opern- und Museumsorchester; Chor der Oper Frankfurt; Iurii Samoilov; Marlis Petersen; Barnaby Rea; Kateryna Kasper; Martin Mitterrutzner; Theo Lebow; Michael Porter; Klaus Haderer; Joana Mallwitz,2,CD,22.61,34.99,"In May 2018 the premier of Franz Lehar’s The Merry Widow was a thundering success. It was not only Claus Guth’s sophisticated and insightful production that earned critical acclaim, the musical performance also received several accolades in its own right. The energetic conducting by Joana Mallwitz, Marlis Petersen in the title role, with Iurii Samoilov as Danilo by her side and Kateryna Kasper and Martin Mitterrutzner as Valencienne and Camille de Rosillon, the perfect couple, had audiences spellbound. The present release is a live recording of the phenomenal premier at Oper Frankfurt.",https://www.youtube.com/watch?v=i5y_yHgJBOY&t=199s,https://b2b.naxosusa.com/Album.aspx?product=OC%20983&medium=phy#,01 Classical,Classical,Classical|Opera,Germany,2019 OehmsClassics Musikproduktion GmbH,2019 OehmsClassics Musikproduktion GmbH,,,,,,,,,,,,,,,,,,,,
2019,Ondine,ODE 1336-2,761195133620,Piotr Ilyich Tchaikovsky,Tchaikovsky: Liturgy of St. John Chrysostom; Nine Sacred Choruses,Latvian Radio Choir,1,CD,13.25,20.99,"In 1877, Tchaikovsky wrote in a letter to Nadezhda von Meck: “I often go to the public worship; in my opinion, the liturgy of St. John Chrysostom is one of the greatest works of art… Oh, I love all that terribly, it is one of my greatest pleasures.” Tchaikovsky enjoyed attending worship services, visited them regularly and was always interested in sacred music, especially in the music of the Orthodox Church. At a relatively early point in his career, in 1875, he issued “A short textbook of harmony, adapted to the reading of spiritual and musical compositions in Russia”, which in 1881 was approved as a textbook of church singing in theological seminaries and colleges. The same year, Tchaikovsky even started editing the works of Dmitry Bortnyansky, a pioneer of sacred Orthodox music. However, he encountered problems with various institutions – the Imperial Chapel, the censorship authorities, as well as some conservative church officials who were more comfortable with smaller-calibre composers, since they could be manipulated if necessary. Tchaikovsky wished to reform sacred Orthodox music but at the same to draw inspiration from the traditions of past centuries. Prime example of this is Tchaikovsky’s monumental work in sacred Orthodox music, the Liturgy of St. John Chrysostom, Op. 41. The Nine Sacred Choruses, which date to 1884–1885, is not a cycle in the basic meaning of the word, but rather a collection, and another affirmation of Tchaikovsky’s skills as one of the greatest composers of Orthodox sacred music. In this album these works are being performed by the award-winning Latvian Radio Choir under the direction of Sigvards Klava.",,https://b2b.naxosusa.com/Album.aspx?product=ODE%201336-2&medium=phy#,01 Classical,Classical,,Finland,"2019 SLLC Latvijas Koncerti, Riga","2019 Ondine Oy, Helsinki",,,,,,,,,,,,,,,,,,,,
2019,Orchid Classics,ORC100100,5060189561001,George Gershwin; Stewart Goodyear,Gershwin & Goodyear,Stewart Goodyear; Chineke! Orchestra,1,CD,13.25,20.99,"Orchid Classics marks its 100th release with a particularly special album starring some of the most exciting artists of our time: pianist-composer Stewart Goodyear, the Chineke! Orchestra and Wayne Marshall. The release includes world-premiere recordings of Goodyear’s Carnival-inspired Suite for piano and orchestra, named Callaloo in honour of his Trinidadian roots, and his Piano Sonata, an exuberant reflection of Goodyear’s youth. These are heard alongside Gershwin’s magnificent Rhapsody in Blue. Stewart Goodyear has been described as “a phenomenon” by the Los Angeles Times and “one of the best pianists of his generation” by the Philadelphia Inquirer. He is joined by the pioneering Chineke! Orchestra, a vital, vibrant ensemble made up of Europe’s finest Black and Minority Ethnic performers, conducted here by the brilliant conductor, organist and pianist, Wayne Marshall.",,https://b2b.naxosusa.com/Album.aspx?product=ORC100100,01 Classical,Classical,,United Kingdom,,,,,,,,,,,,,,,,,,,,,,
2019,ORFEO,ORF-MP1901,4011790190136,Louis Spohr ,Spohr: The Clarinet Concertos,Karl Leister; Radio-Sinfonieorchester Stuttgart,2,CD,11.69,17.99,"In the 1830s, Spohr was commonly considered undisputedly the greatest living composer. He was inspired to write his four clarinet concertos, which have always ranked among Spohr’s most popular works, by his acquaintance with the Thuringian clarinettist Johann Simon Hermstedt. Up to today, the decidedly virtuoso clarinet concertos have been a challenge for any clarinet soloist, as they mirror Spohr’s view of the form of the solo concerto as a projection surface to flaunt technical skill in an ideal symbiosis with the poetic and lyrical contents of the music. On this release, the works are performed by Karl Leister.Karl Leister began his solo career as a clarinetist with the Berlin Philharmonic Orchestra under Herbert von Karajan in 1959. At the same time his international career as a soloist and chamber musician began. He is one of the founders of the ensembles Blaser der Berliner Philharmoniker, Berliner Solisten as well as the Ensemble Wien-Berlin. Since the foundation of the Herbert von Karajan Academy of the Berlin Philharmonic Orchestra, Karl Leister has been teaching the young generation.",,https://b2b.naxosusa.com/Album.aspx?product=ORF-MP1901&medium=phy#,01 Classical,Classical,,EU,2019 ORFEO International Music GmbH,2019 ORFEO International Music GmbH,,,,,,,,,,,,,,,,,,,,
2019,Pavane Records,ADW7589,5410939758920,Mikhail Glinka; Anton Rubinstein; Piotr Ilyich Tchaikovsky ,"Tchaikovsky, Rubinstein, & Glinka: Russian Seasons",Roberte Mamou ,1,CD,10.91,16.99,"This new album comes to us from the colorful multi-faceted pianist Roberte Mamou, nicknamed Poetess of Sound when she was awarded the Diapason d’Or for her recording dedicated to Cimarosa. It is about poetry with Slavic soul as a connecting the thread. This release is an inner journey that goes from melancholy to uncontrolled exaltation. Glinka, Rubinstein and Tchaikovsky tell us here about nostalgia, sadness, and tenderness. Roberte Mamou’s multi-faceted and colorful musical personality emerges magically from the instrument when she plays, in a breathtaking alchemy which owes something to the flavors and scents of Tunisia where she spent her childhood. The experience of ten years as vocal coach at the La Monnaie Royal Opera in Brussels is also discernible, but perhaps what comes across most is the love and passion which she has always felt for music in all its forms. As a soloist Roberte Mamou has appeared with some of the greatest orchestras and ensembles. To name but a few, the Berlin Symphonic, the Dresden Philharmonic, the Moscow Soloists, the Collegium Instrumentale in Bruges, and the Orchestre Philharmonique de Lille.",,https://b2b.naxosusa.com/Album.aspx?product=ADW7589&medium=phy#,01 Classical,Classical,Classical|Piano,Belgium,"2019 Pavane Records, a division of La Boite à Musique s.a.","2019 Pavane Records, a division of La Boite à Musique s.a.",,,,,,,,,,,,,,,,,,,,
2019,PENTATONE,PTC5186638,827949063862,Francis Poulenc; Camille Saint-Saens; Charles-Marie Widor ,"Orchestre de la Suisse Romande: Saint-Saens, Poulenc, & Widor",Christopher Jacobson; Orchestre de la Suisse Romande,1,Hybrid SACD,15.59,23.99,"The monumental and colorful sounds of the organ and symphony orchestra blend together perfectly on this splendid recording of Saint-Saëns’s “Organ” Symphony, Poulenc’s Concerto for Organ, Strings and Timpani and the Toccata from Charles-Marie Widor’s Organ Symphony No. 5. The majestic organ chords at the start of the final movement of Saint-Saëns’s symphony equal the sublime effect of Beethoven’s choral conclusion of his Ninth, and have made it an audience’s favourite straight from the moment of its 1886 premiere. Poulenc’s organ concerto shows the composer’s retrospective side, while simultaneously offering flashes of his stylistic playfulness. After Poulenc’s serene concerto, Widor’s Toccata offers a vibrant conclusion to this programme. The Geneva Victoria Hall organ is played by Christopher Jacobson, who has already released a solo album with performances on the Aeolian Organ at Duke University Chapel, as well as a recording of Tyberg Masses with the South Dakota Chorale on PENTATONE. On this album, he works with the Orchestre de la Suisse Romande and conductor Kazuki Yamada, who have a vast PENTATONE discography.",,https://b2b.naxosusa.com/Album.aspx?product=PTC5186638&medium=phy#,01 Classical,Classical,Classical|Orchestral,Germany,2019 PENTATONE Music B.V.,2019 PENTATONE Music B.V.,,,,,,,,,,,,,,,,,,,,
2019,PENTATONE,PTC5186800,827949080067,Various ,Holland Baroque: Silk Baroque,Holland Baroque; Wu Wei,1,Hybrid SACD,15.59,23.99,"Silk Baroque presents a musical encounter between Wu Wei and Holland Baroque, performing a programme that ranges from Baroque greats such as Bach, Vivaldi, Telemann and Rameau to Chinese traditional tunes, all tied together by the musicians’ openness to improvisation, experimentation and cultural exchange. Wu Wei plays the sheng, an extraordinary ancient Chinese mouth organ, which looks like a bundle of bamboo reeds cased in a metal bowl. It is a miracle of harmony, melody and rhythmic possibilities, and Wu Wei’s abilities fully bring out the sheng’s beauty: whispering, charming, and compelling. Age-old traditions come together in performances that sound fresh and contemporary. Silk Baroque carries listeners into a lively, enticing and fascinating sound world. Holland Baroque is an original and innovative baroque orchestra that approaches baroque repertoire through a fresh and contemporary approach, with a focus on improvisation and collaborations with outstanding artists from different traditions. On their first PENTATONE release, they work together with Wu Wei, who dazzles audiences worldwide with his virtuosic sheng playing.",,https://b2b.naxosusa.com/Album.aspx?product=PTC5186800&medium=phy,01 Classical,Classical,Classical|Classical Crossover,Germany,2019 PENTATONE Music B.V.,2019 PENTATONE Music B.V.,,,,,,,,,,,,,,,,,,,,
2019,Piano Classics,PCL10166,5029365101660,Sergei Rachmaninoff ,Rachmaninoff: Chopin Variations; Song Transcriptions,Georgijs Osokins ,1,CD,14.81,22.99,"After his participation in the 2015 Chopin Competition in Warsaw, Sergei Babayan noted of Georgijs Osokins that ‘he has a very rare gift of a true Chopinist… This young musician is exceptionally talented.’ This talent was on show for all to hear in his debut album of late Chopin for Piano Classics. Now Osokins moves between the contrasting worlds of Chopin and Rachmaninov with the same unruffled authority as his seamless legato. As his first lengthy composition for piano, Rachmaninov’s set of Chopin Variations Op. 22 is a rare bird both in recital and on record, and rarer still in its complete form, as presented here. Osokins also takes the rare option, authorized by the composer, of playing the full theme both at the beginning and end of the Variations, lending to it a shape and coherence missing from several other, more storied versions. Indeed Osokins places himself in the distinguished tradition of Earl Wild and his forebears stretching back to Liszt, both in terms of his dazzling technical assurance and his repertoire, which encompasses original transcriptions as much as Romantic-era masterpieces. To follow the Variations he plays Wild’s version of ‘In the Silence of the Secret Night’ Op. 4 No. 3- a brooding, melancholy nocturne of a song- and a sensual take on ‘How Fair This Spot’ by Arcadi Volodos. Then there is Rachmaninov’s own, early Barcarolle, a rarely heard collection of Fragments (from 1917, the year of his exile to the US) and a version of the famous Vocalise which is the work of many hands, including Ososkins, who rounds off the album in the grand style with his own transcription of the ‘Nunc Dimittis’ from the Vespers.",,https://b2b.naxosusa.com/Album.aspx?product=PCL10166&medium=phy,01 Classical,Classical,,Germany,2019 Piano Classics,2019 Piano Classics,,,,,,,,,,,,,,,,,,,,
