2019,Brilliant Classics,BRI95766,5028421957661,Sergei Taneyev ,Taneyev: Chamber Music with Piano,Alessandro Deljavan; Daniela Cammarano; Paolo Castellitto; Andrea Agostinelli; Daniele Orlando ,3,CD,11.69,17.99,"Often known as ‘the Russian Brahms,’ Sergei Taneyev has inspired devoted advocacy in musicians from Igor Oistrakh to Mikhail Pletnev and Steven Isserlis. Yet his music remains under-recorded and under-appreciated, which is all the more curious in the case of his output for chamber music where he most nearly lives up to that unfair nickname. Aside from the late Violin Sonata, elliptical and no less Brahmsian in its way than its companions, all these works are conceived on a grand scale, abundant in soaring melody and impassioned lyricism, playing always to the strengths of their instrumentation and demanding the utmost in energy and commitment from their performers. Composed first, the Piano Quartet is dark and densely textured like its companions, but it also makes the warmest and most loving embrace of the listener, from the piano’s opening outburst of passion onwards. In the right hands this is music it’s impossible not to love- and hard to forget, too, in the case of the Adagio’s yearning main theme. The Piano Trio emulates not only Taneyev’s friend Tchaikovsky but older German models, Beethoven in particular, with its independence of parts where the piano stands as first among equals. By turns impetuous and imperial, the Trio gives the lie to the old idea of Taneyev as presenting a sternly unyielding countenance. Perhaps the most fully formed of this magnificent quartet is the Piano Quintet, where a Mendelssohnian lightness of touch in the Scherzo and finale counterbalances Taneyev at his most intense and contrapuntally driven in the huge opening Allegro. Joined here by three experienced Italian colleagues, Daniela Cammarano and Alessandro Deljavan have previously won critical praise for their Brilliant Classics albums of chamber music by Johann Nepomuk Hummel and Anton Rubinstein.",,https://b2b.naxosusa.com/Album.aspx?product=BRI95766&medium=phy,01 Classical,Classical,,Germany,2019 Brilliant Classics,2019 Brilliant Classics,,,,,,,,,,,,,,,,,,,,
2019,Brilliant Classics,BRI95784,5028421957845,Fritz Brun ,Brun: Complete Orchestral Works,Moscow Symphony Orchestra; Bratislava Symphony Orchestra,11,CD,38.99,59.99,"In this release, the prominent conductor Adriano with help from the world renowned Bratislava and Moscow Symphony Orchestras, among others, draws together the first complete series of orchestral works by Swiss composer Fritz Brun. This set sheds light on the little-known composer’s repertoire, from the rhapsodies, the concertos, to ten sweeping symphonies. Brun grew up in Lucerne and his time active as a composer coincided with a period of high creative output of Swiss music. Brun’s repertoire sits alongside other native composers such as Honegger, Schoeck, and Bloch. The crowded market, combined with the struggle to find a publisher, offers one indication as to why Brun’s works failed to reach the mainstream public. While not a household name, Brun is often touted as the Swiss answer to Vaughan Williams and Edward Elgar. Brun’s works have a nostalgic touch; they draw on the Romantic and Classical eras in their emotional sincerity and defined forms, but always with a modern flavor. After graduating from the Cologne conservatoire, Brun worked in Berlin, London and Dortmund where he took up various music posts. His music reflects his European travels and unites diverse inspirations from different countries and eras as equals on his musical plane. Modernist influences are skillfully interwoven into his compositions, the scherzo movements for example, draw on Stravinsky in their timbre and rhythms and Symphony No. 5 liberally experiments with tonality. However, similar to his English counterparts, his music remains rooted in his homeland. Symphony No. 3 is inspired by the Alps and it is his best known work, made particularly famous for its use of Italian-Swiss folk melodies. In his later life, Brun returned to Switzerland, where he served as director of the Berne Music Society until his retirement in 1941. The final portion of this release features historical recordings, in particular, the celebrated Paul Sacher brings his interpretation of Variations for string orchestra and piano, and Brun conducts his own Symphony No. 8.",,https://b2b.naxosusa.com/Album.aspx?product=BRI95784&medium=phy,01 Classical,Classical,,Germany,2019 Brilliant Classics,2019 Brilliant Classics,,,,,,,,,,,,,,,,,,,,
2019,Brilliant Classics,BRI95817,5028421958170,Domenico Scarlatti ,D. Scarlatti: Sonatas,Nicola Reniero ,1,CD,7.79,11.99,"Played by the right hands, the astonishing freshness of invention of Scarlatti’s sonatas emerges with no less brilliance on the piano than his intended harpsichord. So why not the organ, too? In fact, Scarlatti probably intended only three of his 555 surviving keyboard sonatas specifically for an organ. Yet even on the instruments of his own time, in churches and chapels across Europe and especially his native Italy and adopted home of Spain, the palette of colors offered by a well-appointed organ brings these vibrantly colored works to life without any fear of them being obscured by clouds of bass pedal or resonance. Organist Nicola Reniero explains that his selection of 19 sonatas concentrates on particularly intricate or individual examples of polyphony and fugue where the organ’s diversity of register and color may be thought to excel. He does so, however, without neglecting the principle that in Scarlatti’s music almost everything is vocal and theatrical: the introduction is like the curtain that rises; the themes are the characters, and the various sections of the piece are like scenes of a wordless drama. Reniero has chosen to avoid the kind of echo effects which would be a conventional way to introduce contrast between phrases: “I have tried instead to emphasize the originality of the harmonies or the characters of famous themes.” The album closes with the most spectacular of all Scarlatti’s fugues, K417 in D minor. It is a stunning piece not only on account of the frenzied finale and the unexpected change of scene that comes about halfway through the piece, but above all for the boundless energy that pervades it throughout. For this new recording, Reniero plays the organ of the Duomo di Desenzano in the town of Garda, a two-manual instrument first reconstructed by the Serassi Brothers and then restored and partially rebuilt by Marco Fratti in 2014.",,https://b2b.naxosusa.com/Album.aspx?product=BRI95817&medium=phy,01 Classical,Classical,,Germany,2019 Brilliant Classics,2019 Brilliant Classics,,,,,,,,,,,,,,,,,,,,
2019,Brilliant Classics,BRI95822,5028421958224,Carlo Pedini; Paolo Ugoletti ,KLK String Orchestra: La Follia - Music for Strings by Pedini & Ugoletti,KLK String Orchestra,1,CD,10.13,15.99,"No one knows who first used the term ‘Folia’ to describe a kind of Portuguese dance, or even when it became associated with a particular theme immortalised by Arcangelo Corelli in the last of his Op.5 violin sonatas. However, as La Folia or La Follia, the theme has been improvised on and updated ever since then, all drawing on the noble dignity of the original and its simple, effective power. Born in 1956, Carlo Pedini produced a half-hour set of variations on ‘La Follia’ in 2007, and scored them for string orchestra: this is the first internationally available recording, made by an ensemble drawn from the string section of the KLK Symphony Orchestra in Ukraine. They are conducted here by a contemporary and countryman of Pedini’s Ferdinando Nazzaro, who founded the new-music ensemble attached to the KLK orchestra. Complementing La Follia here is another neo-Baroque work of Pedini’s, a set of three substantial pieces for string orchestra with a central adagio and a finale dedicated to the art of the neoclassical painter Antonio Canova. The album concludes with a second set of ‘La Follia’ variations by Paolo Ugoletti, also born in 1956 and a fellow student of Franco Donatoni. These take the theme into the territory of pop, with variations marked ‘Boogie-Woogie’ and ‘Funky’ using innovative string techniques. Dedicated to the conductor of this recording, Ugoletti’s rhapsody ‘Il sentiero dei castagni’ (The Chestnut-Tree Path) completes this album which is a must-hear for fans of attractive tonal music by contemporary composers off the beaten track.",,https://b2b.naxosusa.com/Album.aspx?product=BRI95822&medium=phy,01 Classical,Classical,,Germany,2019 Brilliant Classics,2019 Brilliant Classics,,,,,,,,,,,,,,,,,,,,
2019,Brilliant Classics,BRI95835,5028421958354,Antonio Vivaldi ,Vivaldi: Complete Concertos & Sinfonias for Strings & Basso Continuo,L'Archicembalo ,4,CD,15.59,23.99,"Founded in 2000, L’Archicembalo is a period ensemble of top-notch Italian musicians who have played with all the major native exponents of Baroque music such as Giovanni Antonini and Giuliano Carmignola. According to La Stampa, the ensemble ranks among the most inspiring and authoritative Vivaldi interpreters of our time. Part of this collection was released separately in 2015, and attracted glowing reviews: ‘The tempi are well chosen, without exaggerations, but also without being too slow… Italian ensembles have shown that [these Sinfonias] are more than nice fillers in a programme of solo concertos. In this recording the polyphonic, theatrical and expressive qualities of these pieces are brought to light´ What sets apart these concertos and sinfonias from the multitude of other such works composed by Vivaldi is the lack of a solo instrument. Yet with his usual, inexhaustible fertility of invention, Vivaldi turned this apparent lack into an opportunity to explore the possibilities of development and counterpoint more extensively than was possible in the oppositional and accompanimental language of the solo concertos. After a dashing opening movement there is generally a central Adagio, in the form of a tripartite song or a simple sequence of chords. This is followed by a lively, dance-like movement in two parts with two refrains. On occasion this finale is replaced by a technically superlative Fugue that displays Vivaldi’s mastery of counterpoint. Sometimes the Fugue is placed at the beginning of the Concerto, perhaps implying the original context of the work as the instrumental introduction to a solemn Mass. In complement to the concertos, the Sinfonias generally feature bolder and more brilliant string writing, evidently for use as the curtain-raiser to a theatrical event, though they now stand perfectly well on their own.",,https://b2b.naxosusa.com/Album.aspx?product=BRI95835&medium=phy,01 Classical,Classical,,Germany,2019 Brilliant Classics,2019 Brilliant Classics,,,,,,,,,,,,,,,,,,,,
2019,Brilliant Classics,BRI95909,5028421959092,Philip Glass; Michael Nyman; Steve Reich; Michael Torke ,"Freem Saxophone Quartet: A Minimal Sax - Works by Glass, Nyman, Reich, & Torke",Freem Saxophone Quartet ,1,CD,10.13,15.99,"‘A Minimal Sax’ takes a journey through the last 30 years of minimalist music, one of the most influential artistic movements of the last century. An accomplished young Italian ensemble takes us from the purism of ‘New York Counterpoint’ by Steve Reich through the soulful strains of the Saxophone Quartet by Philip Glass, to the funky rhythms of Michael Torke’s ‘July’ and the catchy offbeats of Michael Nyman’s Second String Quartet, in a version for saxophones which here receives its world premiere recording. Back in 1968 it was Nyman who coined the term Minimalism, in an article for ‘The Spectator’, to describe music by composers such as Cornelius Cardew that could be relied upon for its effect in clearing a listener’s mind. ‘Simple idea, straightforward structure, intellectual control, theatrical presence and intensity in presentation’: these were the other criteria he applied to music or at any rate musical events masterminded by Nam June Paik and the ‘Naked Cellist’, Charlotte Moorman. By that point, Reich and Glass had already been writing influential pieces such as It’s gonna rain which shared the qualities listed by Nyman. Their works for saxophone date from later in their careers, once Minimalism had been established as an unstoppable cultural force that had brought millions of young listeners into concert halls. They were attracted by the hypnotic repetitions that are a trademark of these pieces, particularly suited to the medium of saxophone quartet, but even more to the rhythmic rigor and fresh yet recognisable harmonies shared by all four works here. Founded in 2017, the Freem Saxophone Quartet comprises four recent graduates from distinguished Italian conservatoires who have already played in festivals and concert halls the world over. As an ensemble they perform the established repertoire for saxophone quartet and commission a great deal of new music. This is their debut album.",,https://b2b.naxosusa.com/Album.aspx?product=BRI95909&medium=phy,01 Classical,Classical,,Germany,2019 Brilliant Classics,2019 Brilliant Classics,,,,,,,,,,,,,,,,,,,,
2019,Brilliant Classics,BRI95911,5028421959115,Angelo Gilardino ,Gilardino: Music for Guitar Quartet,Quartetto Santorsola ,1,CD,10.13,15.99,"Born in 1941, Angelo Gilardino enjoys an extensive discography on Brilliant Classics, which has won international acclaim both for the beauty of the music and the authority and sensitivity of the performances. In 2008 Gilardino arranged a set of his solo studies based on the music of Mauro Giuliani and dedicated them to the ensemble on this album, the Quartetto Santorsola. They comprise seven brief pieces, with a dashing tarantella at their heart. The year previously, he had written a three-movement Sinfonietta expressly for guitar quartet, in which each movement pays tribute to an inspirational figure in the history of the instrument from the early part of the last century: Ferenc Farkas, Alexander Tansman and finally Teresa de Rogastis, evoking their musical personalities and playing styles within a fast-slow-fast design that makes for a substantial work in its own right. Gilardino’s own work is complemented here by his transcription of ‘Andalucia,’ a piano cycle by the Cuban composer Ernesto Lecuona, as Gilardino himself observes in a booklet essay, the cycle belongs to the Spanish heritage of Albeniz and Granados: “It seemed appropriate to make this version for four guitars that, while not competing with the dynamic range of the piano original, nonetheless lives up to the color and brilliance of Lecuona’s inspiration.”",,https://b2b.naxosusa.com/Album.aspx?product=BRI95911&medium=phy,01 Classical,Classical,,Germany,2019 Brilliant Classics,2019 Brilliant Classics,,,,,,,,,,,,,,,,,,,,
2019,Bru Zane,BZ1036,9788409083169,Jacques Offenbach ,Offenbach: La Perichole,Les Musiciens du Louvre; Choeur de l'Opera National de Bordeaux,2,CD,28.85,44.99,"Offenbach’s La Périchole (1868) will never cease to delight music lovers of all persuasions. Marc Minkowski – long one of the composer’s prophets – was keen to pay tribute to him with this world premiere recording on period instruments, in the company of the young school of French singers, including the bewitching Aude Extrémo, the dashing Stanislas de Barbeyrac and the hilarious Alexandre Duhamel. Combining fashionable rhythms with the most unexpected touches of folklore, the score is a veritable flood of hit numbers. How can one not be swept away by the insolence of the Seguidilla, the frenzy of the Bolero or the furious rhythm of the Prison Trio? Never before, perhaps, had Offenbach gone so far in caricaturing political leaders – nor used drunkenness to resolve the imbroglio of inextricable sentimental relationships. And indeed, the ‘Tipsy Arietta’ is one of the composer's best-known numbers. Cheers!",,https://b2b.naxosusa.com/Album.aspx?product=BZ1036&medium=phy,01 Classical,Classical,,Spain,2019 Palazzetto Bru Zane - Centre de musique romantique française,2019 Palazzetto Bru Zane,,,,,,,,,,,,,,,,,,,,
2019,Cameo Classics,CC9110,5020926911025,Hector Berlioz ,"Berlioz: Romeo et Juliette; Lelio, ou Le retour a la vie",Raymond Nemorin; Michel Senechal; Bernard Lefort; London Symphony Orchestra; BBC Chorus; Nancy Evans; Rene Soames; David Ward; BBC Symphony Orchestra; BBC Chorus,2,CD,14.81,22.99,"Le retour à la vie - this extraordinary work, half-literary, half-musical reflected much of the thoughts and ideas also found in his letters of the time, using music that was largely written earlier in Paris. The genesis of the work was yet another love-affair gone wrong. The six musical numbers of Lélio are wholly diverse in subject and treatment, yet a sense of order is imposed by the literary format. It is a unique assemblage, there is nothing else quite like it in all musical history. Roméo et Juliette is counted third among Berlioz’s 4 symphonies. Another uniquely constructed work, it moves away from the purely symphonic towards the realm of opera. But Berlioz keeps the formal structure of a symphony firmly in his mind: the three principal instrumental sections – Fete chez Capulet, Scene d’amour, and La reine Mab – making a first movement, slow movement and scherzo encircled by elaborate vocal sections to begin and end.",,https://b2b.naxosusa.com/Album.aspx?product=CC9110&medium=phy#,01 Classical,Classical,Classical|Orchestral,United Kingdom,2019 Lyrita Recorded Edition,2019 Lyrita Recorded Edition,,,,,,,,,,,,,,,,,,,,
2019,Cantaloupe Music,CA21148,713746314828,John Luther Adams,Adams: Become Desert,Seattle Symphony,2,CD;DVD,15.59,23.99,"John Luther Adams' ‘Become Desert’ is a remarkable expansion on the ideas he developed for his Pulitzer-winning (and Grammy-winning) work, ‘Become Ocean.’ While not necessarily a ""sequel"" in the literal sense, the recording certainly shares multiple elements with its predecessor — including, most significantly, the renewal of Adam's creative partnership with conductor Ludovic Morlot and the Seattle Symphony. In his 2018 essay for the New York Times, Adams prepares us for listening to Become Desert with a map, of sorts, to help us find the state of ""swimming in light"" that the music is meant to convey. Along the way, ""You begin to feel that this music you had thought was suspended in time is slowly leading you somewhere, pulling you somewhere. It continues upward, rising with inevitable force, like the wind or the light."" Also included in this release is a video which includes a 5.1 surround mix of the recording, as well as a slideshow of desert images (all still photography by John Luther Adams) that loops during playback.",,https://b2b.naxosusa.com/Album.aspx?product=CA21148&medium=phy#,01 Classical,Classical,Classical|Orchestral,,"2019 Cantaloupe Music, LLC. ","2019 Cantaloupe Music, LLC. ",Short Films,,Seattle Symphony; Ludovic Morlot; John Luther Adams,,1,"2019 Cantaloupe Music, LLC. ","2019 Cantaloupe Music, LLC. ",US,NR,NTSC,0,DVD-5,English,N/A,"5.1 Dolby Surround Sound, with stereo mix",Color,16:9,40,2019,
2019,Carus,CV83310,4009350833104,George Frideric Handel,Handel: Utrecht Te Deum & Jubilate,Christina Landshamer; Anja Scherg; Reginald Mobley; Benedikt Kristjansson; Andreas Wolf; Gaechinger Cantorey,1,CD,14.81,22.99,"Handel's Utrecht Te Deum HWV 278 was already enthusiastically received at its first performance in 1713 in St. Paul's in London. To celebrate peace after twelve years of The Spanish War of Succession, Handel composed a captivating Te Deum and Jubilate. A British national composer was born! The Gaechinger Cantorey, conducted by Hans-Christoph Rademann, performed the Te Deum at the brilliant closing concert of the Musikfest Stuttgart 2019. Christina Landshamer, Reginald Mobley, Benedikt Kristjánsson and Andreas Wolf delighted the audience as soloists. The recording begins with an orchestral suite from Handel's opera Il pastor fido, which premiered in November 1712. The Ode for the Birthday of Queen Anne from February 1713, also known as ""Ode of peace"", points to the impending peace of Utrecht with the demand ""United nations shall combine"" in its final chorus.",,https://b2b.naxosusa.com/Album.aspx?product=CV83310&medium=phy#,01 Classical,Classical,Classical|Baroque Era,Germany,2019 SWR2 & Carus,2019 SWR2 & Carus,,,,,,,,,,,,,,,,,,,,
2019,Cedille,CDR 188,735131918824,Viktor Kalabis; Walter Leigh; Michael Nyman; Ned Rorem ,Jory Vinikour: 20th Century Harpsichord Concertos,Jory Vinikour; Chicago Philharmonic,1,CD,13.25,20.99,"Acclaimed, multiple Grammy-nominated harpsichordist Jory Vinikour partners with renowned conductor Scott Speck and the award-winning Chicago Philharmonic for an exciting program of modern harpsichord concertos. Featuring the premiere recording of American composer Ned Rorem’s neoclassical 1946 Concertino da Camera, the album also includes English composer Walter Leigh’s charming, brief Concertino for Harpsichord and Strings, Czech composer Viktor Kalabis’s substantial, tour de force Harpsichord Concerto, and contemporary composer Michael Nyman’s wild Concerto for Amplified Harpsichord and Strings — a real sonic blockbuster. Recognized as one of the outstanding harpsichordists of his generation, Jory Vinikour has cultivated a highly-diversified career that takes him to the world’s most important festivals, concert halls, and opera houses as recitalist and concerto soloist, partner to many of today’s finest instrumental and vocal artists, coach, and conductor.",,https://b2b.naxosusa.com/Album.aspx?product=CDR%20188&medium=phy#,01 Classical,Classical,,United States,2019 Cedille Records,2019 Cedille Records,,,,,,,,,,,,,,,,,,,,
2019,Cello Classics,CC1033,5023581103323,Saint-Saens; Henri Vieuxtemps ,Vieuxtemps & Saint-Saens: Cello Concertos,Peter Martens; Cape Town Philharmonic Orchestra,1,CD,10.13,15.99,"Henri Vieuxtemps’ fiendishly difficult but beautifully melodious Cello Concerto no. 1 in A minor is the central work on this album, which also includes Saint-Saens’ Cello Concerto no. 1, as well as his Allegro Appassionato, which is seldom heard in its orchestral guise. All these works are French/Belgian in origin and pioneered by the leading Belgian cellists of the day. South African cellist Peter Martens, who himself enjoys Belgian ancestry, is partnered with Bernhard Gueller, showcasing the Cape Town Philharmonic Orchestra at its very best. “Martens’ cello is one of the most beautiful sounds – a deep rich harmonic wooden stringed singing being. His playing is superb, compassionate elegant phrasing, and flawless technique. His bow knows the exact line between the tender softness and the hard edge, and this extra dimension is masterfully applied to his dynamics. He expresses a full range of emotion, from angst and agitation to acceptance and wisdom.” (Andy Wilding- FOM Soiree)",,https://b2b.naxosusa.com/Album.aspx?product=CC1033&medium=phy#,01 Classical,Classical,Classical|Orchestral,United Kingdom,Cello Classics,Cello Classics,,,,,,,,,,,,,,,,,,,,
2019,Centaur Records,CRC3664,044747366425,Richard Rodney Bennett; Arthur Bliss; Gerald Finzi; William Hurlstone; John Ireland; Edwin Roxburgh; Charles Villiers Stanford ,Jonathan Holden: Notes from Home - Music of the British Isles,Jonathan Holden; Eun-Hee Park ,1,CD,13.25,20.99,"This is an album of great clarinet works of the 20th Century, both works for clarinet and piano and works for clarinet solo. Clarinetist Jonathan Holden and pianist Eun-Hee Park perform these works with great aplomb. Jonathan Holden is Assistant Professor of Clarinet at Florida State University, Principal Clarinetist of the West Michigan Symphony and a member of the Tallahassee Symphony Orchestra. A frequent guest of numerous orchestras, he has performed with ensembles such as the Grand Rapids, Kalamazoo, Baton Rouge and Lansing symphony orchestras, the Fort Wayne Philharmonic, the Mobile Symphony and the Sarasota Orchestra. He is a founding member of the Vireo Ensemble and the Argot Trio. Praised by The New York Concert Review for “a solid foundation of fluent pianism” after her debut at Carnegie Hall’s Weill Recital Hall, Korean pianist Eun-Hee Park enjoys a diverse career as soloist, chamber musician, and educator. She has given numerous concerts throughout the United States, South Korea, Japan, Italy, Brazil, and Costa Rica.",,https://b2b.naxosusa.com/Album.aspx?product=CRC3664&medium=phy#,01 Classical,Classical,,,"2018 Centaur Records, Inc. ","2018 Centaur Records, Inc. ",,,,,,,,,,,,,,,,,,,,
