Guild Historical,GHCD2248-49,795754224924,"Beethoven, Ludwig van",Missa Solemnis,NBC Symphony Orchestra; Bjoerling; Milanov; Castagna; Kipnis; Westminster Choir; Heifetz,2,CD,2003,Historical,UK,11.69,$17.99 ,CN18,,,,,,,,,,
Guild Historical,GHCD2250-51-52-53,795754225327,Tchaikovsky; Mussorgsky,Georgi Vinogradov,Georgi Vinogradov,4,CD,2003,Historical,UK,21.83,$33.99 ,CN34,,,,,,,,,,
Guild Historical,GHCD2254-55,795754225525,"Rossini, Gioachino",Petite Messe Solenelle,Westminster Choir; New York Philharmonic Symphony,2,CD,2003,Historical,UK,11.69,$17.99 ,CN18,,,,,,,,,,
Guild Historical,GHCD2256-57,795754225723,Loeffler; Creston; Gould,All American Concert,NBC Symphony Orchestra; Goodman; Wild; Levant; Toscanini,2,CD,2003,Historical,UK,11.69,$17.99 ,CN18,,,,,,,,,,
Guild Historical,GHCD2258-59,795754225921,"Gounod, Charles",Faust 1944,Metropolitan Opera; Jobin; Pinza; Albanese; Beecham,2,CD,2003,Historical,UK,11.69,$17.99 ,CN18,,,,,,,,,,
Guild Historical,GHCD2260-61-62,795754226225,Bach; J.S.,Mass In B Minor,Vienna Singverein; Vienna Symphony; Ferrier; Schwarzkopf,3,CD,2003,Historical,UK,15.58,$23.99 ,CN29,,,,,,,,,,
Guild Historical,GHCD2263,795754226324,"Verdi, Giuseppe","Berlin, 1945",NBC Symphony Orchestra; Moscona; Westminster Choir; Toscanini,1,CD,2003,Historical,UK,7.01,$10.99 ,CN11,,,,,,,,,,
Guild Historical,GHCD2264-65,795754226522,"Gounod, Charles",Romeo & Juliet,Kozlovsky; Shumskaya; Mikhailov; Burlak; Sokolov,2,CD,2003,Historical,UK,11.69,$17.99 ,CN18,,,,,,,,,,
Guild Historical,GHCD2266-67-68,795754226829,"Wagner, Richard",Tristan & Isolde 1940-41,Chorus & Orchestra of the Metropolitan Opera; Melchior; Flagstad; Thorborg; Huehn; Kipnis; Toscanini,3,CD,2003,Historical,UK,15.58,$23.99 ,CN29,,,,,,,,,,
Guild Historical,GHCD2269-70,795754227024,"Beethoven, Ludwig van",Fidelio 1941,"Metropolitan Opera, Chorus & Orchestra; Flagstad; Maison; Kipnis; Huehn; Laufkoetter; Farell; Janssen",2,CD,2004,Historical,UK,11.69,$17.99 ,CN18,,,,,,,,,,
Guild Historical,GHCD2271-72,795754227222,"Debussy, Claude",All Debussy,NBC Symphony Orchestra; Toscanini,2,CD,2004,Historical,UK,11.69,$17.99 ,CN18,,,,,,,,,,
Guild Historical,GHCD2273-74,795754227420,"Saint-Saens, Camille",Samson Et Delila 1936,"Metropolitan Opera, Chorus & Orchestra; Abravanel; Maison; Wettergren; Pinza; List",2,CD,2004,Historical,UK,11.69,$17.99 ,CN18,,,,,,,,,,
Guild Historical,GHCD2275-76-77,795754227727,"Verdi, Giuseppe",Otello,NBC Symphony Orchestra; Vinay; Nelli; Valdengo,3,CD,2004,Historical,UK,15.58,$23.99 ,CN29,,,,,,,,,,
Guild Historical,GHCD2278-79-80,795754228021,"Wagner, Richard",Lohengrin 1940,Chorus & Orchestra of the Metropolitan Opera; Melchior; Rethberg; Thorborg; Huehn; List; Warren,3,CD,2004,Historical,UK,15.58,$23.99 ,CN29,,,,,,,,,,
Guild Historical,GHCD2281-82-83-84,795754228427,Various,Russian Legacy,Zara Dolukhanova,4,CD,2004,Historical,UK,21.83,$33.99 ,CN34,,,,,,,,,,
Guild Historical,GHCD2285-86,795754228526,"Strauss, Richard",Elektra 1952,"Metropolitan Opera, Chorus & Orchestra; Reiner; Varnay; Hogen; Wegner; Schoffler; Svanholm",2,CD,2004,Historical,UK,11.69,$17.99 ,CN18,,,,,,,,,,
Guild Historical,GHCD2287-88-89,795754228922,Halevy; Wagner; Giordano,V2: San Francisco Gems,Martinelli; Rethberg; Flagstad; Schorr; Gigli; Jobin; Albanese; Valentino; Harrell; Stevens; Kullman; Steber; Lehmann; Conner; Alvary,3,CD,2004,Historical,UK,15.58,$23.99 ,CN29,,,,,,,,,,
Guild Historical,GHCD2290,795754229028,"Brahms, Johannes",Requiem,Westminster Choir; NBC Symphony Orchestra; Janssen; Chiesa; Toscanini,1,CD,2004,Historical,UK,7.01,$10.99 ,CN11,,,,,,,,,,
Guild Historical,GHCD2291-92,795754229226,Handel; Giordano; Verdi; Puccini,Pagliacci/Quartararo,"Metropolitan Opera, Chorus & Orchestra; Vinay; Quartararo; Warren; Thompson",2,CD,2004,Historical,UK,11.69,$17.99 ,CN18,,,,,,,,,,
Guild Historical,GHCD2293-94-95,795754229523,"Strauss, Richard",Der Rosenkavalier,Vienna Philharmonic Orchestra; Reining; Casa; Gueden; Boehme; Ursuleac; Lemnitz; Berger; Hann; Berlin State Opera Orchestra,3,CD,2004,Historical,UK,15.58,$23.99 ,CN29,,,,,,,,,,
Guild Historical,GHCD2296-97,795754229721,"Rossini, Gioachino",Barber Of Seville 1941,"Metropolitan Opera, Chorus & Orchestra; Papi; Thomas; Landi; Tuminia; Pinza; Baccaloni; Landi",2,CD,2004,Historical,UK,11.69,$17.99 ,CN18,,,,,,,,,,
Guild Historical,GHCD2298-99,795754229929,"Grieg, Edvard",Music for Freedom,NBC Symphony Orchestra; Toscanini,2,CD,2004,Historical,UK,11.69,$17.99 ,CN18,,,,,,,,,,
Guild Historical,GHCD2300-01-02,795754230222,"Wagner, Richard",Great Conductors at Met Opera,Berlin Staatsoper Orchestra; Royal Opera Stockholm; Royal Philharmonic; Chorus & Orchestra of the Metropolitan Opera,3,CD,2004,Historical,UK,15.58,$23.99 ,CN29,,,,,,,,,,
Guild Historical,GHCD2303-04,795754230420,"Mozart, W.A.",Cosi Fan Tutte,Chorus & Orchestra of the Glyndebourne Festival; Jurinac; Lewis; Bruscantini; Howland; Quensel; Rothmuller,2,CD,2004,Historical,UK,11.69,$17.99 ,CN18,,,,,,,,,,
Guild Historical,GHCD2305-06,795754230628,"Verdi, Giuseppe",La Traviata,Chorus & Symphony of the USSR State; Shumskaya; Kozlovsky; Lisitsian,2,CD,2004,Historical,UK,11.69,$17.99 ,CN18,,,,,,,,,,
Guild Historical,GHCD2307-08,795754230826,Boito; Verdi; Beethoven,Boito Memorial,"La Scala Chorus & Orchestra, Siepi; Nelli; Prandelli; Guarrera; Simionato; Nessi; Ticozzi; Toscanini",2,CD,2004,Historical,UK,11.69,$17.99 ,CN18,,,,,,,,,,
Guild Historical,GHCD2309-10,795754231021,"Verdi, Giuseppe",Falstaff 1949,Chorus & Orchestra of the Metropolitan Opera; Warren; Valdengo; di Stefano; Resnik; Albanese; Elmo; Lipton,2,CD,2005,Historical,UK,11.69,$17.99 ,CN18,,,,,,,,,,
Guild Historical,GHCD2311-12,795754231229,"Wagner, Richard",Gotterdammerung: Act 2 Complete,Chorus & Orchestra of the Royal Opera Covent Garden; Leider; Melchior; Janssen; Thorborg; Weber; List; Habich; Nezadal; Leider,2,CD,2005,Historical,UK,11.69,$17.99 ,CN18,,,,,,,,,,
Guild Historical,GHCD2313-14,795754231427,"Gershwin, George",Porgy & Bess,RIAS-Unterhaltungsorchester; Warfield; Price; Calloway; McCurry; James; Colbert; Roberts; Thigpen; Scott; Lamar; Weasey; Riemann; Dowdy; Yates; Eva Jessye Choir ,2,CD,2008,Historical,UK,11.69,$17.99 ,CN18,,,,,,,,,,
Guild Historical,GHCD2315-16,795754231625,"Offenbach, Jacques",Tales of Hoffmann,Chorus & Orchestra of the Metropolitan Opera; Maison; Bovy; Tibbett; Bada; Petina; Cordon; D'Angelo; Kaskas,2,CD,2004,Historical,UK,11.69,$17.99 ,CN18,,,,,,,,,,
Guild Historical,GHCD2317-18,795754231823,"Gluck, Christoph Willibald",Orfeo ed Euridice 1940,Chorus & Orchestra of the Metropolitan Opera; Thorborg; Novotna; Farell; Dickey,2,CD,2005,Historical,UK,11.69,$17.99 ,CN18,,,,,,,,,,
Guild Historical,GHCD2319,795754231922,Brahms; Schubert,Paul Kletzki 1946,Schweizerisches Festspielorchester Luzern; Philharmonia Orchestra; Kletzki,1,CD,2007,Historical,UK,7.01,$10.99 ,CN11,,,,,,,,,,
Guild Historical,GHCD2320,795754232028,Haydn; Brahms,Barbirolli at the Proms 1954,Halle Orchestra; David Galliver; Barbirolli,1,CD,2007,Historical,UK,7.01,$10.99 ,CN11,,,,,,,,,,
Guild Historical,GHCD2321,795754232127,Strauss; Bartok; Stravinsky,"V1:Koussevitzky Conducts Bartok, Stravinsky",Boston Symphony Orchestra; Koussevitzky,1,CD,2007,Historical,UK,7.01,$10.99 ,CN11,,,,,,,,,,
Guild Historical,GHCD2322,795754232226,"Shostakovich, Dmitri",Symphony No. 8,Philharmonic Symphony Orchestra of New York,1,CD,2007,Historical,UK,7.01,$10.99 ,CN11,,,,,,,,,,
Guild Historical,GHCD2323,795754232325,Chopin; Rachmaninoff,Witold Malcuzynski 1946-49,Malcuzynski; Philharmonia Orchestra,1,CD,2007,Historical,UK,7.01,$10.99 ,CN11,,,,,,,,,,
Guild Historical,GHCD2324,795754232424,Vaughan Williams; Mussorgsky,Koussevitzky Boston Symphony,Boston Symphony Orchestra; Koussevitzky,1,CD,2007,Historical,UK,7.01,$10.99 ,CN11,,,,,,,,,,
Guild Historical,GHCD2325,795754232523,Rimsky-Korsakov; Liadov,Russian Favorites,Halle Orchestra; Barbirolli,1,CD,2007,Historical,UK,7.01,$10.99 ,CN11,,,,,,,,,,
Guild Historical,GHCD2326,795754232622,Delius; Rachmaninoff,Benno Moiseiwitsch,"Moiseiwitsch -, BBC Symphony Orchestra & Philharmonia Orchestra, Hugo Rignold",1,CD,2007,Historical,UK,7.01,$10.99 ,CN11,,,,,,,,,,
Guild Historical,GHCD2327,795754232721,Debussy; Ravel; Roussel,Charles Munch Conducts NBC Orchestra,NBC Symphony Orchestra; Munch,1,CD,2007,Historical,UK,7.01,$10.99 ,CN11,,,,,,,,,,
Guild Historical,GHCD2328,795754232820,"Moussorgsky, Modest",G. Cantelli NY Philharmonic,New York Philharmonic Orchestra; NBC Symphony Orchestra; Guilet; Bolognini; Cantelli,1,CD,2007,Historical,UK,7.01,$10.99 ,CN11,,,,,,,,,,
Guild Historical,GHCD2329,795754232929,Tchaikovsky; Mussorgsky,Stokowski Conducts…,Radio-Sinfonieorchester Stuttgart; Radiosymphonieorchester Frankfurt; Stokowski,1,CD,2007,Historical,UK,7.01,$10.99 ,CN11,,,,,,,,,,
Guild Historical,GHCD2330-31,795754233124,Franck; Debussy; Brahms,Barbirolli Conducts,New York Philharmonic Symphony Orchestra; Spalding; Cassado; Barbirolli,2,CD,2007,Historical,UK,11.69,$17.99 ,CN18,,,,,,,,,,
Guild Historical,GHCD2332,795754233223,"Schaeuble, Hans",P. Burkhard sings Schaeuble,Radio-Orchester Beromunster; Tonhalle-Orchester Zurich; Seemann,1,CD,2008,Historical,UK,7.01,$10.99 ,CN11,,,,,,,,,,
Guild Historical,GHCD2333,795754233322,Mozart; Prokofiev; Shostakovich,F. Reiner Conducts,NBC Symphony Orchestra; Melchior; Chicago Symphony Orchestra; New York Philharmonic Orchestra; Reiner,1,CD,2008,Historical,UK,7.01,$10.99 ,CN11,,,,,,,,,,
Guild Historical,GHCD2334,795754233421,"Tchaikovsky, Pyotr Ilyich",All Tchaikovsky 1942-43,NBC Symphony Orchestra; Stokowski,1,CD,2008,Historical,UK,7.01,$10.99 ,CN11,,,,,,,,,,
Guild Historical,GHCD2335,795754233520,Prokofiev; MacDowell; Brahms,Stokowski Conducts…,NBC Symphony Orchestra; Nash; Stokowski,1,CD,2008,Historical,UK,7.01,$10.99 ,CN11,,,,,,,,,,
Guild Historical,GHCD2337-38,795754233827,"Brahms, Johannes",Toscanini Conducts Brahms,New York Philharmonic Orchestra; Casadesus; New York Ladies’ Choir; Toscanini,2,CD,2008,Historical,UK,11.69,$17.99 ,CN18,,,,,,,,,,
Guild Historical,GHCD2339,795754233926,Haydn; Mozart,Haydn & Mozart,Danish Radio Symphony Orchestra; Busch,1,CD,2008,Historical,UK,7.01,$10.99 ,CN11,,,,,,,,,,
Guild Historical,GHCD2340,795754234022,"Nielsen, Carl",Danish State SO 1950 & 1955,Helsinki City Symphony Orchestra,1,CD,2008,Historical,UK,7.01,$10.99 ,CN11,,,,,,,,,,
Guild Historical,GHCD2341,795754234121,"Sibelius, Jean",Stokowski Conducts…,San Francisco Symphony Orchestera; Boston Symphony Orchestra; Stokowski,1,CD,2008,Historical,UK,7.01,$10.99 ,CN11,,,,,,,,,,
Guild Historical,GHCD2342,795754234220,Rimsky-Korsakov; Borodin,Monteaux Conducts,San Francisco Symphony Orchestera; Boston Symphony Orchestra,1,CD,2008,Historical,UK,7.01,$10.99 ,CN11,,,,,,,,,,
Guild Historical,GHCD2343,795754234329,"Beethoven, Ludwig van",Symphony No. 9,Lindberg-Torlind; Jena; Sjoberg; Byrding; Danish Radio Chorus; Danish Radio Symphony Orchestra; Busch,1,CD,2008,Historical,UK,7.01,$10.99 ,CN11,,,,,,,,,,
Guild Historical,GHCD2344,795754234428,"Beethoven, Ludwig van",Symphony No. 9,Hellwig; Kindermann; Maison; Kipnis; Teatro Colon Orchestra & Choir; Terragnuolo; Philharmonic-Symphony Orchestra of New York; Toscanini,1,CD,2008,Historical,UK,7.01,$10.99 ,CN11,,,,,,,,,,
Guild Historical,GHCD2345-46,795754234626,"Beethoven, Ludwig van",Symphony No. 9,Briem; Hoengen; Anders; Watzke; Bruno Kittel Choir; Berlin Philharmonic Orchestra; Stockholm Philharmonic Orchestra; Concertgebouw Orchestra; Teatro Colon Orchestra; Furtwangler,2,CD,2008,Historical,UK,11.69,$17.99 ,CN18,,,,,,,,,,
Guild Historical,GHCD2347,795754234725,Hovhaness; Milhaud; Copland,L. Stokowski 1942-57,NBC Symphony Orchestra; Houston Symphony Orchestra; Stokowski,1,CD,2009,Historical,UK,7.01,$10.99 ,CN11,,,,,,,,,,
Guild Historical,GHCD2348,795754234824,Atterberg; Barber; Ravel,Toscanini Conducts…,NBC Symphony Orchestra; Toscanini,1,CD,2009,Historical,UK,7.01,$10.99 ,CN11,,,,,,,,,,
Guild Historical,GHCD2349,795754234923,Beethoven; Weber; Rachmaninoff,V1: Great Pianists,Backhouse; New York Philharmonic Orchestra; Kraus; Concertgebouw Orchestra; Rubinstein; New York Philharmonic Orchestra,1,CD,2009,Historical,UK,7.01,$10.99 ,CN11,,,,,,,,,,
Guild Historical,GHCD2350,795754235029,"Orr, Robin",Centenary Tribute,Rostal; Osborn; Durrant; Glover; Friedman; Johnson; Borrett; Paling; McDonald; Jones; Dart,1,CD,2009,Historical,UK,7.01,$10.99 ,CN11,,,,,,,,,,
Guild Historical,GHCD2351,795754235128,"Brun, Fritz",Fritz Brun conducts Brun,Studio-Orchester Beromunster; Aeschbacher; Collegium Musicum Zurich,1,CD,2009,Historical,UK,7.01,$10.99 ,CN11,,,,,,,,,,
Guild Historical,GHCD2352,795754235227,Mozart; Schubert,"Music of Busch, Mozart, Schubert & Rybar",Rybar; Sinfonie-Orchester Winterthur,1,CD,2010,Historical,UK,7.01,$10.99 ,CN11,,,,,,,,,,
Guild Historical,GHCD2353,795754235326,Brahms; Mozart,Solomon Plays 1956,SOLOMON; Rai Turin Orchestra,1,CD,2009,Historical,UK,7.01,$10.99 ,CN11,,,,,,,,,,
Guild Historical,GHCD2354,795754235425,Beethoven; Chopin; Brahms,F. Busch 1950,Danish Radio Symphony Orchestra; New York Philharmonic Symphony Orchestra; Anderson; Arrau; Male Chorus of the Schola Cantorum; Ross; Busch,1,CD,2009,Historical,UK,7.01,$10.99 ,CN11,,,,,,,,,,
Guild Historical,GHCD2355,795754235524,Borodin; Saint-Saens; Franck,Rubinstein & Mitropoulos 1953,Rubinstein; New York Philharmonic Orchestra ,1,CD,2009,Historical,UK,7.01,$10.99 ,CN11,,,,,,,,,,
Guild Historical,GHCD2356,795754235623,Strauss; Mozart,Struass & Mozart 1934-36,BBC Symphony Orchestra; London Philharmonic Orchestra; Glyndebourne Festival Orchestra; Busch,1,CD,2009,Historical,UK,7.01,$10.99 ,CN11,,,,,,,,,,
Guild Historical,GHCD2357,795754235722,Burkhard; Schaeuble,Music by Burkhard & Schaeuble,Hurlimann; Preis; Suter; Burkhard; Kaufmann;s Schaeuble,1,CD,2010,Historical,UK,7.01,$10.99 ,CN11,,,,,,,,,,
Guild Historical,GHCD2358-59,795754235920,"Mendelssohn, Felix",Mendelssohn 200th Anniversary Tribute,NBC Symphony Orchestra; Heifetz; Philips; Toscanini,2,CD,2010,Historical,UK,11.69,$17.99 ,CN18,,,,,,,,,,
Guild Historical,GHCD2360,795754236026,Bach; J.S.,"Los Angeles, Budapest",Strings of the Los Angeles Philharmonic Orchestra; Los Angeles Philharmonic Orchestra; Bathy; Sandor; Tiszay; Somogyvari; Littasy; Nagy; Margittay; Budapest Chorus; Forrai; Budapest Radio Symphony Orchestra; Ney; Szebenyi; Fischer; Kemperer,1,CD,2011,Historical,UK,7.01,$10.99 ,CN11,,,,,,,,,,
Guild Historical,GHCD2361,795754236125,Cooley; Lavalle; Guarnieri,"NBC Pops, 1942-44",NBC Symphony Orchestra; Stokowski,1,CD,2010,Historical,UK,7.01,$10.99 ,CN11,,,,,,,,,,
Guild Historical,GHCD2362,795754236224,"Schumann, Robert",Symphonies 1940 & 1946,NBC Symphony Orchestra; Toscanini,1,CD,2010,Historical,UK,7.01,$10.99 ,CN11,,,,,,,,,,
Guild Historical,GHCD2363,795754236323,"Reger, Max",Music by Max Reger,Berlin Philharmonic Orchestra; Bohm; van Kempen,1,CD,2010,Historical,UK,7.01,$10.99 ,CN11,,,,,,,,,,
Guild Historical,GHCD2364-65,795754236521,Bach; Vivaldi; Rossini,In Memory of Arturo Toscanini,Baker; Wummer; Bloom; Misschakoff; NBC Symphony Orchestra,2,CD,2011,Historical,UK,11.69,$17.99 ,CN18,,,,,,,,,,
Guild Historical,GHCD2366,795754236620,Mendelssohn; Schubert; Wagner,F. Busch Conducts,Konserthus Stiftelsens Orkester Malmo; Philharmonic Orchestra of Los Angeles; Sinfonie-Orchester Winterthur; Busch,1,CD,2011,Historical,UK,7.01,$10.99 ,CN11,,,,,,,,,,
Guild Historical,GHCD2367,795754236729,Mozart; Liszt; Strauss,V2: Great Pianists,Brailowsky; Boston Symphony Orchestra; Cherkassky; Serkin; Philharmonic-Symphony Orchestra of New York,1,CD,2011,Historical,UK,7.01,$10.99 ,CN11,,,,,,,,,,
Guild Historical,GHCD2368,795754236828,Haydn; Respighi; Sibelius,Gala Concert 1945,Philharmonic Symphony Orchestra Of New York; Toscanini,1,CD,2010,Historical,UK,7.01,$10.99 ,CN11,,,,,,,,,,
Guild Historical,GHCD2369-70,795754237023,Vivaldi; Mozart; Brahms,Christmas Day & Farewell 1937 & 1954,NBC Symphony Orchestra; Toscanini,2,CD,2011,Historical,UK,11.69,$17.99 ,CN18,,,,,,,,,,
Guild Historical,GHCD2371,795754237122,Brahms; Mozart; Reger,"F. Busch, 1919, 1931, 1948-51",Sachsische Staatskapelle Dresden; Orchester des Wurttembergischen Landes-Theaters; Dansk Radiosymfoniorkestret; Busch,1,CD,2011,Historical,UK,7.01,$10.99 ,CN11,,,,,,,,,,
Guild Historical,GHCD2372,795754237221,Mozart; Hindemith; Berg,Stockholm 1938-49,Konsertforenings orkester Stockholm; Krasner; Kungliga Teatern orkester Stockholm; Busch,1,CD,2012,Historical,UK,7.01,$10.99 ,CN11,,,,,,,,,,
Guild Historical,GHCD2373-74-75,795754237528,"Mozart, W.A.",Le Nozze die Figaro 1956,Pilss; Wiener Staatsopernchor; Wiener Symphoniker; Schoffler; Jurinac; Streich; Ludwig; Malaniuk; Makjut; Dickie; Czerwenka; Donch; Schwaiger; Holweg; Kmentt; Berry,3,CD,2011,Historical,UK,15.58,$23.99 ,CN29,,,,,,,,,,
Guild Historical,GHCD2376,795754237627,Rimsky-Korsakov; Mussorgsky,Goossens,London Symphony Orchestra; Royal Philharmonic Orchestra,1,CD,2010,Historical,UK,7.01,$10.99 ,CN11,,,,,,,,,,
Guild Historical,GHCD2377,795754237726,Chopin; Jensen; Mendelssohn,R. Ganz as Pianist & Conductor,Metropolitan Symphony Orchestra; Ganz,1,CD,2011,Historical,UK,7.01,$10.99 ,CN11,,,,,,,,,,
Guild Historical,GHCD2379-80,795754238020,Stravinsky; Hindemith; Harris,"Stokowski - Stravinsky, Hanson",NBC Symphony Orchestra; WDR Sinfonieorchester Koln; Symphony of the Air; Saint Louis Symphony Orchestra; Stokowski,2,CD,2011,Historical,UK,11.69,$17.99 ,CN18,,,,,,,,,,
Guild Historical,GHCD2381,795754238129,Liszt; Ludwig; Fodes; Leitner,1951-53,Berliner Philharmoniker; Bamberger Symphoniker; Föoldes,1,CD,2011,Historical,UK,7.01,$10.99 ,CN11,,,,,,,,,,
Guild Historical,GHCD2382-83,795754238327,"Bizet, Georges",Pearl Fishers 1953,Alarie; Simoneau; Bianco; Depraz; Orchestre des Concerts Lamoureux; Choeurs Elisabeth Brasseur,2,CD,2011,Historical,UK,11.69,$17.99 ,CN18,,,,,,,,,,
Guild Historical,GHCD2384-85,795754238525,Schubert; Elgar; Mozart; Rossini,Toscanini Conducts Orchestras,Philadelphia Orchestra; BBC Symphony Orchestra; Philharmonic-Symphony Orchestra of New York; La Scala Orchestra; Vienna Philharmonic Orchestra; Philharmonia Orchestra; Milstein; Toscanini,2,CD,2011,Historical,UK,11.69,$17.99 ,CN18,,,,,,,,,,
Guild Historical,GHCD2386,795754238624,Nicolai; Tchaikovsky; Strauss,Knappertsbusch,Vienna Philharmonic Orchestra; Barbec; Knappertsbusch,1,CD,2012,Historical,UK,7.01,$10.99 ,CN11,,,,,,,,,,
Guild Historical,GHCD2388-89,795754238921,Schoenberg; Arnold,Gurrelieder 1961,McCracken; Brouwenstijn; Rankin; Robinson; Lanigan; Lidell; Edinburgh Royal Choral Union; Bunney; London Symphony Orchestra; Maguire; Stokowski & his Symphony Orchestra,2,CD,2012,Historical,UK,11.69,$17.99 ,CN18,,,,,,,,,,
Guild Historical,GHCD2390,795754239027,Bach; Pergolesi; Mozart; Brahms,Early Recordings,Daniel Barenboim,1,CD,2012,Historical,UK,7.01,$10.99 ,CN11,,,,,,,,,,
Guild Historical,GHCD2391,795754239126,Rimsky-Korsakov; Glinka,Russian Concert Favourites,Royal Philharmonic Orchestra; Philharmonia Orchestra; Fistoulari,1,CD,2012,Historical,UK,7.01,$10.99 ,CN11,,,,,,,,,,
Guild Historical,GHCD2392,795754239225,Borodin; Paganini; Rachmaninoff,Blue Danube Waltz,Leopold Stokowski & his Symphony Orchestra,1,CD,2012,Historical,UK,7.01,$10.99 ,CN11,,,,,,,,,,
Guild Historical,GHCD2393,795754239324,Sullivan; Tchaikovsky; Dvorak,Evening at the Proms,BBC Symphony Orchestra; Hammond; Cherkassky; Sargent,1,CD,2012,Historical,UK,7.01,$10.99 ,CN11,,,,,,,,,,
Guild Historical,GHCD2394,795754239423,Brahms; Khachaturian,Leonid Kogan Plays,Kogan; Philharmonia Orchestra; Boston Symphony Orchestra,1,CD,2012,Historical,UK,7.01,$10.99 ,CN11,,,,,,,,,,
Guild Historical,GHCD2395,795754239522,"Beethoven, Ludwig van",A. Busch plays Beethoven 1942 & 49,Busch; Statsradiofoniens Symfoniorkester; Wor Radio Orchestra,1,CD,2013,Historical,UK,7.01,$10.99 ,CN11,,,,,,,,,,
Guild Historical,GHCD2396,795754239621,"Tchaikovsky, Pyotr Ilyich",Mitropoulos 1954 & 1957,Philharmonic-Symphony Orchestra of New York; Mitropoulos,1,CD,2013,Historical,UK,7.01,$10.99 ,CN11,,,,,,,,,,
Guild Historical,GHCD2397,795754239720,Mahler; Dukas,Karl Rankl 1954,Vienna Symphony Orchestra; Jurinac; Rankl,1,CD,2013,Historical,UK,7.01,$10.99 ,CN11,,,,,,,,,,
Guild Historical,GHCD2398-99,795754239928,Beethoven; Schubert; Chopin,Complete UK World Record Club Solo Recordings,Shura Cherkassky,2,CD,2013,Historical,UK,11.69,$17.99 ,CN18,,,,,,,,,,
Guild Historical,GHCD2400-01,795754240122,"Reger, Max",Recordings 1936-43,Staatskapelle Berlin; Lehmann; Berliner Philharmoniker; Jochum; Frind; Seidler-Winkler; Groot Symfonieorkest van Zender Brussel; Lehmann; Concertgebouw Orkest Amsterdam; van Beinum; Stadtisches Orchester Berlin; Heger,2,CD,2013,Historical,UK,11.69,$17.99 ,CN18,,,,,,,,,,
Guild Historical,GHCD2402,795754240221,Brahms; Wagner,Stokowski 1960,Philadelphia Orchestra; Stokowski,1,CD,2013,Historical,UK,7.01,$10.99 ,CN11,,,,,,,,,,
Guild Historical,GHCD2403,795754240320,Rimsky-Korsakov; Tchaikovsky,Stokowski 1962,Philadelphia Orchestra; Stokowski,1,CD,2013,Historical,UK,7.01,$10.99 ,CN11,,,,,,,,,,
Guild Historical,GHCD2404,795754240429,Blacher; Mozart,George Szell 1958,Casadesus; Cologne Radio Symphony Orchestra; Szell,1,CD,2013,Historical,UK,7.01,$10.99 ,CN11,,,,,,,,,,
Guild Historical,GHCD2405,795754240528,"Mozart, W.A.",Stokowski - Mozart,Philadelphia Orchestra; de Carli; International Festival Youth Orchestra; Stokowski & His Symphony Orchestra; Rachlin; Houston Symphony Orchestra; NBC Symphony Orchestra; Stokowski,1,CD,2013,Historical,UK,7.01,$10.99 ,CN11,,,,,,,,,,
Guild Historical,GHCD2406-07,795754240726,Brahms; Arcangelo; Dvorak,A. Busch Berlin 1921-29,Busch Quartet,2,CD,2014,Historical,UK,11.69,$17.99 ,CN18,,,,,,,,,,
Guild Historical,GHCD2408,795754240825,Glinka; Rimsky-Korsakov,Russian Orchestral Suites,London Symphony Orchestra; Philharmonia Orchestra; Fistoulari,1,CD,2014,Historical,UK,7.01,$10.99 ,CN11,,,,,,,,,,
Guild Historical,GHCD2409,795754240924,"Tchaikovsky, Pyotr Ilyich",Sargent 1955 & 1960,Royal Philharmonic Orchestra; Philharmonia Orchestra; Parikian; Sargent,1,CD,2014,Historical,UK,7.01,$10.99 ,CN11,,,,,,,,,,
Guild Historical,GHCD2410,795754241020,Wagner; Mozart; Borodin,"Gala Night at the Opera, 1962",London; Nilsson; Philadelphia Orchestra; Stokowski,1,CD,2015,Historical,UK,7.01,$10.99 ,CN11,,,,,,,,,,
Guild Historical,GHCD2411,795754241129,Gluck; Cherubini; Berlioz,R. Gorr sings French Opera,Gorr; Orchestre du Theatre National de l’Opera; Orchestre de la Societe des Concerts du Conservatoire,1,CD,2014,Historical,UK,7.01,$10.99 ,CN11,,,,,,,,,,
Guild Historical,GHCD2412,795754241228,"Reger, Max",A. Busch performs Reger 1931-51,Busch Quartet; Wendling-Quartett,1,CD,2015,Historical,UK,7.01,$10.99 ,CN11,,,,,,,,,,
Guild Historical,GHCD2413,795754241327,Giselle; Weldon,Nutcraker,Orchestre du Theatre National de l’Opera Paris; Royal Philharmonic Orchestra,1,CD,2014,Historical,UK,7.01,$10.99 ,CN11,,,,,,,,,,
Guild Historical,GHCD2414,795754241426,"Sibelius, Jean",Sargent 1956 & 1958,BBC Symphony Orchestra; Sargent,1,CD,2014,Historical,UK,7.01,$10.99 ,CN11,,,,,,,,,,
Guild Historical,GHCD2415,795754241525,Amirov; Shostakovich; Kurka,Stokwoski 1960-62,Philharmonic Symphony Orchestra of New York; Stokowski,1,CD,2014,Historical,UK,7.01,$10.99 ,CN11,,,,,,,,,,
Guild Historical,GHCD2416-17,795754241723,Herold; Boieldieu; Glinka,Pierre Dervaux 1957-61,L’Orchestre de l’Association des Concerts Colonne; Nederlands Philharmonisch Orkest Amsterdam; L’Orchestre du Theatre National de l’Opera Paris; Orchestre des Concerts de Paris; Dervaux,2,CD,2014,Historical,UK,11.69,$17.99 ,CN18,,,,,,,,,,
Guild Historical,GHCD2418,795754241822,"Brahms, Johannes",A. Busch 1949 & 1951,A. Busch; H. Busch; Orchestre National de la Radiodiffusion Francaise; Orchester der Stadt Basel,1,CD,2015,Historical,UK,7.01,$10.99 ,CN11,,,,,,,,,,
Guild Historical,GHCD2419,795754241921,Enescu; Borodin; Debussy,Stokowski 1947-49,Abram; Philharmonic-Symphony Orchestra of New York; Stokowski,1,CD,2015,Historical,UK,7.01,$10.99 ,CN11,,,,,,,,,,
Guild Historical,GHCD2420,795754242027,Rachmaninoff; Dohnanyi; Dvorak,Sargent 1948-56,Smith; Philharmonia Orchestra; Sargent,1,CD,2015,Historical,UK,7.01,$10.99 ,CN11,,,,,,,,,,
Guild Historical,GHCD2421,795754242126,Chopin; Schubert ; Strauss II,On With the Dance!,"Royal Philharmonic Orchestra; Royal Opera House Orchestra, Covent Garden; Sargent",1,CD,2015,Historical,UK,7.01,$10.99 ,CN11,,,,,,,,,,
Guild Historical,GHCD2422,795754242225,"Tchaikovsky, Pyotr Ilyich",Goossens & Kindler 1940-41,Cincinnati Symphony Orchestra; National Symphony Orchestra,1,CD,2015,Historical,UK,7.01,$10.99 ,CN11,,,,,,,,,,
Guild Historical,GHCD2423,795754242324,"Rachmaninoff, Sergei","Sargent 1931, 47, 53",London Symphony Orchestra; Smith; Liverpool Philharmonic Orchestra; BBC Symphony Orchestra; Sargent,1,CD,2014,Historical,UK,7.01,$10.99 ,CN11,,,,,,,,,,
Guild Historical,GHCD2424,795754242423,Shilkret; Gould; Creston,20th C. Americana 1945 & 1955,Dorsey; New York City Symphony Orchestra; Radio Italiana Orchestra of Turin; Abato; Hollywood Bowl Symphony Orchestra; Stokowski,1,CD,2016,Historical,UK,7.01,$10.99 ,CN11,,,,,,,,,,
Guild Historical,GHCD2425,795754242522,"Tchaikovsky, Pyotr Ilyich",Sargent & Ricciy 1950 & 1955,Ricci; New Symphony Orchestra; BBC Symphony Orchestra; Sargent,1,CD,2016,Historical,UK,7.01,$10.99 ,CN11,,,,,,,,,,
Guild Historical,GHCD2426,795754242621,Tchaikovsky; Shostakovich,L. Stokowski 1954-61,London Symphony Orchestra; CBS Radio Orchestra; Stokowski,1,CD,2016,Historical,UK,7.01,$10.99 ,CN11,,,,,,,,,,
Guild Historical,GHCD2427,795754242720,Khachaturian; Aram,Khachaturian 1952-59,Ricci; Lympany; London Philharmonic Orchestra; London Symphony Orchestra; Fistoulari,1,CD,2015,Historical,UK,7.01,$10.99 ,CN11,,,,,,,,,,
Guild Historical,GHCD2428,795754242829,"Sibelius, Jean",Stokowski with Heifetz 1929-40,Heifetz; Tabuteau; Philadelphia Orchestra; All-American Youth Orchestra; Stokowski,1,CD,2015,Historical,UK,7.01,$10.99 ,CN11,,,,,,,,,,
