Guild,GMCD7101,795754710120,Britten; Chilcott; Howells,Canticum Novum,Girl Choristers; Boy Choristers; Lay Vicars of Salisbury Cathedral; Halls,1,CD,1994,Choral,UK,9.35,$14.99 ,CN15,,,,,,,,,,
Guild,GMCD7102,795754710229,Bliss; Britten; Parry; Stanford,Coronation Anthem & Hymns,Choir of St. Paul's Cathedral; Dearnley,1,CD,1994,Choral,UK,9.35,$14.99 ,CN15,,,,,,,,,,
Guild,GMCD7103,795754710328,Bach; Corette; Guilmant; Purcell,In Dulci Jubilo,Plunkett; Lutz,1,CD,1994,Instrumental,UK,9.35,$14.99 ,CN15,,,,,,,,,,
Guild,GMCD7104,795754710427,Haydn; Schubert,"Works by Schubert, Haydn",Choir of St. Paul's Cathedral; London Bach Orchestra,1,CD,1994,Choral,UK,9.35,$14.99 ,CN15,,,,,,,,,,
Guild,GMCD7105,795754710526,Brahms; Britten; Campbell,Glory of St. George,"Choir of St. George's Chapel, Windsor; Porter",1,CD,1995,Choral,UK,9.35,$14.99 ,CN15,,,,,,,,,,
Guild,GMCD7106,795754710625,Barnby; Scholefield; Croft; Wade,V1: Favorite Hymns All Seasons,Choir of St. Paul's Cathedral; Scott -,1,CD,1995,Choral,UK,9.35,$14.99 ,CN15,,,,,,,,,,
Guild,GMCD7107,795754710724,Bach; Handel; Mendelssohn; Widor,Oxford Book of Wedding Music,Jeremy Filsell,1,CD,1995,Instrumental,UK,9.35,$14.99 ,CN15,,,,,,,,,,
Guild,GMCD7108,795754710823,Byrd; Sheppard; Tallis; White,Complete Service Anthems & Motets,Clare College Chapel Choir,1,CD,1995,Choral,UK,9.35,$14.99 ,CN15,,,,,,,,,,
Guild,GMCD7109,795754710922,Bach; Byrd; Elgar; Franck,Ave Verum,Clare College Chapel Choir,1,CD,1995,Choral,UK,9.35,$14.99 ,CN15,,,,,,,,,,
Guild,GMCD7110,795754711028,Bourgeois; Dyson; Easdale,Creator Spirit,Choir of Guildford Cathedral,1,CD,1995,Choral,UK,9.35,$14.99 ,CN15,,,,,,,,,,
Guild,GMCD7111,795754711127,Britten; Durfle; Gibbons,Time of Peace,Choir of Belfast Cathedral; Barber,1,CD,1995,Choral,UK,9.35,$14.99 ,CN15,,,,,,,,,,
Guild,GMCD7114,795754711424,Britten; Mayer; Rubbra,Cello & Piano Music,Gill; Pavri,1,CD,1995,Instrumental,UK,9.35,$14.99 ,CN15,,,,,,,,,,
Guild,GMCD7115,795754711523,Dering; Farrant; Gibbons,Tudor Anthems,Clare College Chapel Choir,1,CD,1995,Choral,UK,9.35,$14.99 ,CN15,,,,,,,,,,
Guild,GMCD7116,795754711622,Bairstow; Gibbons; Ridout,Canterbury Celebration,Canterbury Cathedral Choir; Harris,1,CD,1996,Choral,UK,9.35,$14.99 ,CN15,,,,,,,,,,
Guild,GMCD7117,795754711721,Bairstow; Jackson; Noble,Stanford Canticles from Ely,Ely Cathedral Choir; Filsell,1,CD,1996,Choral,UK,9.35,$14.99 ,CN15,,,,,,,,,,
Guild,GMCD7118,795754711820,Attwood; Byrd; Mendelssohn,Music for a Great Cathedral,Choir of St. Paul's Cathedral,1,CD,1996,Choral,UK,9.35,$14.99 ,CN15,,,,,,,,,,
Guild,GMCD7119,795754711929,Howells; Stevens,Piano Music,Jeremy Filsell,1,CD,1996,Instrumental,UK,9.35,$14.99 ,CN15,,,,,,,,,,
Guild,GMCD7120,795754712025,Ferguson; Goossens; Ireland,V1: English Romanticism,Lewis; Filsell,1,CD,1996,Instrumental,UK,9.35,$14.99 ,CN15,,,,,,,,,,
Guild,GMCD7121,795754712124,"Tye, Christopher",Music of Christopher Tye,Cambridge University Chamber Choir,1,CD,1996,Choral,UK,9.35,$14.99 ,CN15,,,,,,,,,,
Guild,GMCD7122,795754712223,Bach; Dexter; Kitson; Lang,Organ Music from Ireland,Dexte; Jackson,1,CD,1995,Instrumental,UK,9.35,$14.99 ,CN15,,,,,,,,,,
Guild,GMCD7123,795754712322,Franck; Reger; Shostakovich,Lamentations,String Orchestra St. Gallen; Schola Vocales Basilienses Basel,1,CD,1996,Vocal,UK,9.35,$14.99 ,CN15,,,,,,,,,,
Guild,GMCD7124,795754712421,Elgar; Goossens,V2: English Romanticism,Lewis; Filsell,1,CD,1996,Instrumental,UK,9.35,$14.99 ,CN15,,,,,,,,,,
Guild,GMCD7125,795754712520,Boccherini; Dvorak; Elgar,Salut d'Amour,Kowalski; Lutz,1,CD,1996,Instrumental,UK,9.35,$14.99 ,CN15,,,,,,,,,,
Guild,GMCD7126,795754712629,Bainton; Byrd; Darke; Gregory,Peace I Leave With You,Choir of Belfast Cathedral; Barber,1,CD,1996,Choral,UK,9.35,$14.99 ,CN15,,,,,,,,,,
Guild,GMCD7127,795754712728,Grieg; Rachmaninoff,Grieg & Rachmaninov,Gill; Pavri,1,CD,1996,Instrumental,UK,9.35,$14.99 ,CN15,,,,,,,,,,
Guild,GMCD7128,795754712827,Gigout; Guilmant; Langlais,John Scott Plays at St Pauls,John Scott,1,CD,1996,Instrumental,UK,9.35,$14.99 ,CN15,,,,,,,,,,
Guild,GMCD7129,795754712926,"Moor, Emanuel",20th C. Cathedral Music,Vasari Singers; Filsell,1,CD,1997,Choral,UK,9.35,$14.99 ,CN15,,,,,,,,,,
Guild,GMCD7130,795754713022,Liddle; Merbecke,David Liddle plays Liddle,David Liddle,1,CD,1997,Instrumental,UK,9.35,$14.99 ,CN15,,,,,,,,,,
Guild,GMCD7131,795754713121,Byrd; Dupre; Gibbons,Music for Passiontide,Guildford Cathedral Choir; Filsell,1,CD,1997,Choral,UK,9.35,$14.99 ,CN15,,,,,,,,,,
Guild,GMCD7132,795754713220,Bridge; Vaughan Williams,Songs of Farewell,Vasari Singers; Filsell,1,CD,1997,Choral,UK,9.35,$14.99 ,CN15,,,,,,,,,,
Guild,GMCD7133,795754713329,"Goossens, Eugene",V3: English Romanticism,Jeremy Filsell,1,CD,1997,Instrumental,UK,9.35,$14.99 ,CN15,,,,,,,,,,
Guild,GMCD7134,795754713428,"Brahms, Johannes",V1: Master Works,Serenata Voices; Beavan; Filsell; Pott,1,CD,1997,Vocal,UK,9.35,$14.99 ,CN15,,,,,,,,,,
Guild,GMCD7135,795754713527,"Boellmann, Leon",V1: French Romanticism,Gledhill; Filsell,1,CD,1997,Instrumental,UK,9.35,$14.99 ,CN15,,,,,,,,,,
Guild,GMCD7136,795754713626,Demessieux; Dupre; Gilles,V2: Master Works,BBC Concert Orchestra; Wordsworth; Filsell,1,CD,1997,Orchestral,UK,9.35,$14.99 ,CN15,,,,,,,,,,
Guild,GMCD7137,795754713725,"Reubke, Julius",V1: German Romanticism,Jeremy Filsell,1,CD,1996,Instrumental,UK,9.35,$14.99 ,CN15,,,,,,,,,,
Guild,GMCD7138,795754713824,"Weber, Carl Maria von",V3: Master Works,London Symphony Orchestra,1,CD,1997,Orchestral,UK,9.35,$14.99 ,CN15,,,,,,,,,,
Guild,GMCD7139,795754713923,Bax; Blatchly; Britten; Pott,Worldes Joie,Schola Cantorum of Oxford; Goode,1,CD,1998,Choral,UK,9.35,$14.99 ,CN15,,,,,,,,,,
Guild,GMCD7140,795754714029,Howells; Tavener; Walton; ,Voice from Heaven,York Chapter House Choir,1,CD,1997,Choral,UK,9.35,$14.99 ,CN15,,,,,,,,,,
Guild,GMCD7141,795754714128,"Pott, Francis",Farewell to Hirta,Watkin; Moody; Pott,1,CD,1997,Instrumental,UK,9.35,$14.99 ,CN15,,,,,,,,,,
Guild,GMCD7142,795754714227,"Schoeck, Othmar",V1: Swiss Romanticism,Barritt; Edwards,1,CD,1997,Instrumental,UK,9.35,$14.99 ,CN15,,,,,,,,,,
Guild,GMCD7143,795754714326,Bach; Cummings; Gruber; Wood,Sing Choirs of Angels,Salisbury Cathedral Choir; Salisbury Brass Ensemble; Halls,1,CD,1997,Choral,UK,9.35,$14.99 ,CN15,,,,,,,,,,
Guild,GMCD7144,795754714425,Bach; Bovet; Durufle; Hollins,V4: Master Works,Jeremy Filsell,1,CD,1998,Instrumental,UK,9.35,$14.99 ,CN15,,,,,,,,,,
Guild,GMCD7145,795754714524,"Barber, Samuel",Choral & Organ Works,Cambridge University Chamber Choir,1,CD,1998,Choral,UK,9.35,$14.99 ,CN15,,,,,,,,,,
Guild,GMCD7146,795754714623,Britten; Faure; Guest; Harris,Remembrance & Resurrection,"Chapel Choir of the Royal Hospital, Chelsea; Filsell",1,CD,1998,Choral,UK,9.35,$14.99 ,CN15,,,,,,,,,,
Guild,GMCD7147,795754714722,Brahms; Elgar; Mozart,How Lovely are thy Dwellings,Choir of the Collegiate Church of St Mary; Bowyer,1,CD,1998,Choral,UK,9.35,$14.99 ,CN15,,,,,,,,,,
Guild,GMCD7148,795754714821,Caldara; Palestrina; Lotti,Crucifixus - Holy Week,Vasari Singers,1,CD,1998,Choral,UK,9.35,$14.99 ,CN15,,,,,,,,,,
Guild,GMCD7149,795754714920,Hollins; Liddle; Widor; Wood; ,Daivd Liddle Plays,David Liddle,1,CD,1998,Instrumental,UK,9.35,$14.99 ,CN15,,,,,,,,,,
Guild,GMCD7150,795754715026,Bartlet; Byrd; Campion,Quiet Conscience,Burrowes; Scott; Miller,1,CD,1998,Choral,UK,9.35,$14.99 ,CN15,,,,,,,,,,
Guild,GMCD7151,795754715125,Howells; Joubert; Kodaly; Part,Peace In Our Time,"Choir of Lincoln College, Oxford; Chalmers",1,CD,1998,Choral,UK,9.35,$14.99 ,CN15,,,,,,,,,,
Guild,GMCD7152,795754715224,Brahms; Darke; Mendelssohn,Christmas Music St. Paul's,Choir of St. Paul's Cathedral; English Brass Ensemble; Dearnley,1,CD,1998,Choral,UK,9.35,$14.99 ,CN15,,,,,,,,,,
Guild,GMCD7153,795754715323,"Kuhn, Max",Music by Max Kuhn,Vasari Singers; Haffner Wind Ensemble of London; Hacker; Dolenc; Fong,1,CD,1998,Chamber,UK,9.35,$14.99 ,CN15,,,,,,,,,,
Guild,GMCD7154,795754715422,Liste; Anton,Music by Anton Liste,Waterhouse; Fong,1,CD,1998,Instrumental,UK,9.35,$14.99 ,CN15,,,,,,,,,,
Guild,GMCD7155,795754715521,Finzi; Holst; Leighton; Schuman,Evening Watch,Queens' College Chapel Choir Cambridge; Weeks,1,CD,1999,Choral,UK,9.35,$14.99 ,CN15,,,,,,,,,,
Guild,GMCD7156,795754715620,"Dupre, Marcel",V1: Complete Organ Works,Jeremy Filsell,1,CD,1999,Instrumental,UK,9.35,$14.99 ,CN15,,,,,,,,,,
Guild,GMCD7157,795754715729,"Dupre, Marcel",V2: Complete Organ Works,Jeremy Filsell,1,CD,1999,Instrumental,UK,9.35,$14.99 ,CN15,,,,,,,,,,
Guild,GMCD7158,795754715828,Bruckner; Dupre; Gorecki,Magnificat,"Choir of Lincoln College, Oxford; Nicholas",1,CD,1999,Choral,UK,9.35,$14.99 ,CN15,,,,,,,,,,
Guild,GMCD7159,795754715927,"Dupre, Marcel",V3: Complete Organ Works,Jeremy Filsell,1,CD,1999,Instrumental,UK,9.35,$14.99 ,CN15,,,,,,,,,,
Guild,GMCD7160,795754716023,Howells; Vaughan Williams,Wedding Hymns,"Choir of Queens' College, Cambridge; Cambridge University Brass Ensemble; Steynor",1,CD,1999,Choral,UK,9.35,$14.99 ,CN15,,,,,,,,,,
Guild,GMCD7161,795754716122,"Kodaly, Zoltan",Choral Works,Vasari Singers; Filsell,1,CD,1999,Choral,UK,9.35,$14.99 ,CN15,,,,,,,,,,
Guild,GMCD7162,795754716221,"Dupre, Marcel",V4: Complete Organ Works,Jeremy Filsell,1,CD,1999,Instrumental,UK,9.35,$14.99 ,CN15,,,,,,,,,,
Guild,GMCD7163,795754716320,"Kayser, Philipp Christoph",Goethe Lieder Chamber Music,Howat; Lewis; Lee; Davies; Morley; Kay; Ceruti Quartet; Davislim; Fong; Zolinsky,1,CD,1999,Chamber,UK,9.35,$14.99 ,CN15,,,,,,,,,,
Guild,GMCD7164,795754716429,"Dupre, Marcel",V5: Complete Organ Works,Jeremy Filsell,1,CD,1999,Instrumental,UK,9.35,$14.99 ,CN15,,,,,,,,,,
Guild,GMCD7165,795754716528,Durufle; Rachmaninoff; Reger,Around the World in 80 Minutes,Nigel Potts,1,CD,1999,Instrumental,UK,9.35,$14.99 ,CN15,,,,,,,,,,
Guild,GMCD7166,795754716627,Howells; Redding; Rutter,Christmas with Chapterhouse Choir,Chapter House Choir; Moore,1,CD,1999,Choral,UK,9.35,$14.99 ,CN15,,,,,,,,,,
Guild,GMCD7169,795754716924,Sammartini; Telemann; Vivaldi,Art of Horacio Franco,Georgian Chamber Orchestra; Franco,1,CD,1999,Orchestral,UK,9.35,$14.99 ,CN15,,,,,,,,,,
Guild,GMCD7170,795754717020,Bach; Brahms; Gruber; Rutter,Silent Night,Choir of Christ's Hospital,1,CD,1999,Choral,UK,9.35,$14.99 ,CN15,,,,,,,,,,
Guild,GMCD7171,795754717129,"Eschmann, Johann Carl",Johann Carl Eschmann,Ceruti Quartet; Lee; Howat; Lewis,1,CD,1999,Chamber,UK,9.35,$14.99 ,CN15,,,,,,,,,,
Guild,GMCD7172,795754717228,"Mozart, W.A.",V1: Late Symphonies,Bournemouth Sinfonietta,1,CD,1999,Orchestral,UK,9.35,$14.99 ,CN15,,,,,,,,,,
Guild,GMCD7173,795754717327,"Dupre, Marcel",V6: Complete Organ Works,Jeremy Filsell,1,CD,1999,Instrumental,UK,9.35,$14.99 ,CN15,,,,,,,,,,
Guild,GMCD7174,795754717426,Carter; Andrew,Canzonetta Sing Carter,Canzonetta,1,CD,1999,Choral,UK,9.35,$14.99 ,CN15,,,,,,,,,,
Guild,GMCD7175,795754717525,Bachofen; Greiter; Hofhaimer,Zurich Arise,Choir of Gonville & Caius College Cambridge,1,CD,1999,Choral,UK,9.35,$14.99 ,CN15,,,,,,,,,,
Guild,GMCD7176,795754717624,Angulo; Rodrigo; Villa-Lobos,Angulo,Bournemouth Sinfonietta; Jimenez,1,CD,2000,Orchestral,UK,9.35,$14.99 ,CN15,,,,,,,,,,
Guild,GMCD7177,795754717723,Schaeuble; Schutter; Brunner,Christ Ascended,Choir of Gonville & Caius College Cambridge,1,CD,1999,Choral,UK,9.35,$14.99 ,CN15,,,,,,,,,,
Guild,GMCD7178,795754717822,"Caldwell, John",Good Friday,"Choir of Lincoln College, Oxford; Oxford Contemporary Sinfonia; Royal Philharmonic Orchestra",1,CD,2000,Choral,UK,9.35,$14.99 ,CN15,,,,,,,,,,
Guild,GMCD7179,795754717921,Borodin; Dvorak,Dvorak & Brodin,St Petersburg Chamber Players; Ioff; Appleman; Ludevig; Massarsky; Uryash,1,CD,2000,Orchestral,UK,9.35,$14.99 ,CN15,,,,,,,,,,
Guild,GMCD7180,795754718027,"Dupre, Marcel",V7: Complete Organ Works,Jeremy Filsell,1,CD,2000,Instrumental,UK,9.35,$14.99 ,CN15,,,,,,,,,,
Guild,GMCD7181,795754718126,"Mozart, W.A.",Sinfonia Concertante,Bournemouth Sinfonietta,1,CD,2000,Orchestral,UK,9.35,$14.99 ,CN15,,,,,,,,,,
Guild,GMCD7182,795754718225,Jongen; Tippett; Widor,V7: Master Works,Ingolstadt Philharmonic; Hauk,1,CD,2000,Orchestral,UK,9.35,$14.99 ,CN15,,,,,,,,,,
Guild,GMCD7183,795754718324,"Dupre, Marcel",V8: Complete Organ Works,Jeremy Filsell,1,CD,2000,Instrumental,UK,9.35,$14.99 ,CN15,,,,,,,,,,
Guild,GMCD7184,795754718423,Liste; Anton,Music by Anton Liste,Zolinsky; S. Davislim; G. Davislim; Rutherford; Fong,1,CD,2000,Instrumental,UK,9.35,$14.99 ,CN15,,,,,,,,,,
Guild,GMCD7185,795754718522,Dubois; Gounod; Guilmant; ,V1: Triumphal Music,Ingolstadt Philharmonic; Hauk,1,CD,2000,Orchestral,UK,9.35,$14.99 ,CN15,,,,,,,,,,
Guild,GMCD7186,795754718621,"Chopin, Frederic",M. Block Plays Chopin,Michel Block,1,CD,2000,Instrumental,UK,9.35,$14.99 ,CN15,,,,,,,,,,
Guild,GMCD7187,795754718720,Dubois; Gruber; Guilmant,V2: Triumphal Music,Ingolstadt Philharmonic; Hauk; Maier; Gonaschwili; Kuraschwili,1,CD,2000,Orchestral,UK,9.35,$14.99 ,CN15,,,,,,,,,,
Guild,GMCD7188,795754718829,"Dupre, Marcel",V9: Complete Organ Works,Jeremy Filsell,1,CD,2000,Instrumental,UK,9.35,$14.99 ,CN15,,,,,,,,,,
Guild,GMCD7189,795754718928,Marek; Jarnach; Frey; Busoni,Eye of the Storm,Ceruti Quartet; Zolinsky; Potts; Lewis; Grant; Pearson,1,CD,2000,Instrumental,UK,9.35,$14.99 ,CN15,,,,,,,,,,
Guild,GMCD7190,795754719024,"Chopin, Frederic",M. Block Plays Chopin,Michel Block,1,CD,2000,Instrumental,UK,9.35,$14.99 ,CN15,,,,,,,,,,
Guild,GMCD7191,795754719123,Langlais; Vaughan Williams,Music for Violin & Organ,Gough Duo,1,CD,2000,Instrumental,UK,9.35,$14.99 ,CN15,,,,,,,,,,
Guild,GMCD7192,795754719222,"Reger, Max",Organ Masterworks,Franz Hauk,1,CD,2000,Instrumental,UK,9.35,$14.99 ,CN15,,,,,,,,,,
Guild,GMCD7193,795754719321,"Dupre, Marcel",V10: Complete Organ Works,Jeremy Filsell,1,CD,2000,Instrumental,UK,9.35,$14.99 ,CN15,,,,,,,,,,
Guild,GMCD7194,795754719420,"Muller-Zurich, Paul",Paul Muller-Zurich,Swiss Radio Orchestra Beromunster; Wieser; Zolinsky; Roberts; Davis; Gledhill; Hacker,1,CD,2000,Chamber,UK,9.35,$14.99 ,CN15,,,,,,,,,,
Guild,GMCD7195,795754719529,Dupre; Jongen,Works of Organ & Orchestra,Ingolstadt Philharmonie; Hauk,1,CD,2000,Orchestral,UK,9.35,$14.99 ,CN15,,,,,,,,,,
Guild,GMCD7196,795754719628,"Orr, Robin",Works by Robin Orr,Northern Sinfonia; Pamela Helen Stephen,1,CD,2000,Orchestral,UK,9.35,$14.99 ,CN15,,,,,,,,,,
Guild,GMCD7197,795754719727,Carrasco; Ford; Espana,Nostalgia for Mexico,Duran; Olechowski,1,CD,2000,Instrumental,UK,9.35,$14.99 ,CN15,,,,,,,,,,
Guild,GMCD7198,795754719826,"Dupre, Marcel",V11: Complete Organ Works,Jeremy Filsell,1,CD,2000,Instrumental,UK,9.35,$14.99 ,CN15,,,,,,,,,,
Guild,GMCD7199,795754719925,Canteloube; Dyson; Delibes,"Pastorale, French Choral Music",Vasari Singers; Filsell,1,CD,2000,Choral,UK,9.35,$14.99 ,CN15,,,,,,,,,,
Guild,GMCD7200,795754720020,Bridge; Ridout; Finzi; Hadley,Music for Strings & Voices,Hampstead Singers; Emmanuel Chamber Orchestra; Filsell; Woolf; Garner; English,1,CD,2000,Choral,UK,9.35,$14.99 ,CN15,,,,,,,,,,
Guild,GMCD7201,795754720129,"Wesley, Samuel",Anthems,Choir of York Minster; Varcoe; Whiteley,1,CD,2000,Choral,UK,9.35,$14.99 ,CN15,,,,,,,,,,
Guild,GMCD7202,795754720228,Herbert; Elgar; English; Heath,Flute + Harp,Noakes; Tingay,1,CD,2000,Instrumental,UK,9.35,$14.99 ,CN15,,,,,,,,,,
Guild,GMCD7203,795754720327,"Dupre, Marcel",V12: Complete Organ Works,Jeremy Filsell,1,CD,2000,Instrumental,UK,9.35,$14.99 ,CN15,,,,,,,,,,
Guild,GMCD7204,795754720426,"Strauss, Richard",Music by Richard Strauss,Philharmonia Orchestra; Kreger; Benedict,1,CD,2000,Orchestral,UK,9.35,$14.99 ,CN15,,,,,,,,,,
Guild,GMCD7205,795754720525,"Tchaikovsky, Pyotr Ilyich",Music by Tchaikovsky,Orquestra Sinfonica de Mineria; Nalli,1,CD,2000,Orchestral,UK,9.35,$14.99 ,CN15,,,,,,,,,,
Guild,GMCD7206,795754720624,Haydn; Kuhn,Piano Concertos,Thew; Camerata Zurich,1,CD,2000,Orchestral,UK,9.35,$14.99 ,CN15,,,,,,,,,,
Guild,GMCD7207,795754720723,"Bach, J.S.",Back to Bach,Stocks; Webb,1,CD,2000,Instrumental,UK,9.35,$14.99 ,CN15,,,,,,,,,,
Guild,GMCD7208,795754720822,"Clarke, Rebecca",Songs & Chamber Works,Wright; Rees; Sturrock,1,CD,2000,Instrumental,UK,9.35,$14.99 ,CN15,,,,,,,,,,
Guild,GMCD7209,795754720921,"Bate, Jennifer",Reflections,Jennifer Bate,1,CD,2001,Instrumental,UK,9.35,$14.99 ,CN15,,,,,,,,,,
Guild,GMCD7210,795754721027,"Liszt, Franz",Organ Works,Nicolas Kynaston,1,CD,2001,Instrumental,UK,9.35,$14.99 ,CN15,,,,,,,,,,
Guild,GMCD7211,795754721126,Chavez; Galindo; Halffter,Huapango,Orquestra Sinfonica de Xalapa; Orquestra Sinfonica de Mineria,1,CD,2001,Orchestral,UK,9.35,$14.99 ,CN15,,,,,,,,,,
Guild,GMCD7212,795754721225,Bach; Handel; Perry; Rowley,In a Monastery Garden,James Culp,1,CD,2001,Instrumental,UK,9.35,$14.99 ,CN15,,,,,,,,,,
Guild,GMCD7213,795754721324,Harvey; Skempton; Tippett; Weir,Flight of Song,"Choir of Queens' College, Cambridge; Steynor",1,CD,2001,Choral,UK,9.35,$14.99 ,CN15,,,,,,,,,,
Guild,GMCD7214,795754721423,"Lakner, Yehoshua",Piano Music,Bachli; Ronner,1,CD,2001,Instrumental,UK,9.35,$14.99 ,CN15,,,,,,,,,,
Guild,GMCD7215,795754721522,Boellmann; Fetis; Guilmant,Masterworks Organ & Orchestra,Ingolstadt Philharmonie; Hauk,1,CD,2001,Orchestral,UK,9.35,$14.99 ,CN15,,,,,,,,,,
Guild,GMCD7216,795754721621,"Arnold, Malcom",Chamber Music,Ceruti Ensemble,1,CD,2001,Chamber,UK,9.35,$14.99 ,CN15,,,,,,,,,,
Guild,GMCD7217,795754721720,"Bach, J.S.",Organ Masterworks,Franz Hauk,1,CD,2001,Instrumental,UK,9.35,$14.99 ,CN15,,,,,,,,,,
Guild,GMCD7218,795754721829,Bach; Byrd; Charpentier; Wagner,Processional & Reflective Music,OffStage Brass; Hawes; Hanna; Jenkins; Morgan,1,CD,2001,Brass,UK,9.35,$14.99 ,CN15,,,,,,,,,,
Guild,GMCD7219,795754721928,Rachmaninoff; Shostakovich,"20th C. Russian Cello - Shostakovich, Rachmaninov",George; Portugheis,1,CD,2001,Instrumental,UK,9.35,$14.99 ,CN15,,,,,,,,,,
Guild,GMCD7220,795754722024,"Dupre, Marcel",Choral Music,Vasari Singers; Filsell,1,CD,2012,Choral,UK,9.35,$14.99 ,CN15,,,,,,,,,,
Guild,GMCD7221,795754722123,"Bach, J.S.",Organ Masterworks,Franz Hauk,1,CD,2001,Instrumental,UK,9.35,$14.99 ,CN15,,,,,,,,,,
Guild,GMCD7222,795754722222,Britten; Lassus; Victoria,Christ Rising,Choir of The Queen's College Oxford,1,CD,2001,Choral,UK,9.35,$14.99 ,CN15,,,,,,,,,,
Guild,GMCD7223,795754722321,Scholefield; Ewing; Gibbons,V2: Favorite Hymns All Seasons,"Choir of The Abbey School, Tewkesbury; Etherington; Nicholas",1,CD,2001,Choral,UK,9.35,$14.99 ,CN15,,,,,,,,,,
Guild,GMCD7224,795754722420,"Raphael, Michael",Jazz Hymns,Maynor; Fredriksen; Olsen,1,CD,2001,Vocal,UK,9.35,$14.99 ,CN15,,,,,,,,,,
Guild,GMCD7225,795754722529,Wills; Arthur,Wondrous Machine,Jeremy Filsell,1,CD,2000,Instrumental,UK,9.35,$14.99 ,CN15,,,,,,,,,,
Guild,GMCD7226,795754722628,Bruckner; Palestrina; Darke,O Magnum Mysterium,"Choir of Lincoln College, Oxford; Smith",1,CD,2001,Choral,UK,9.35,$14.99 ,CN15,,,,,,,,,,
Guild,GMCD7227,795754722727,"Orff, Carl",Carmina Burana,Orchestra Sinfonica de Mineria; Choir of the Academia de Musica de Mineria; Holt; Kelley; Herrera,1,CD,2001,Choral,UK,9.35,$14.99 ,CN15,,,,,,,,,,
Guild,GMCD7228-29,795754722925,"Messiaen, Olivier",Livre du Saint Sacrament,Anne Page,2,CD,2002,Instrumental,UK,9.35,$14.99 ,CD15,,,,,,,,,,
Guild,GMCD7230,795754723021,Beaser; Foss; Fribbins; Griffes,"British Fantasies, American Dreams", Ruffer; Crayford,1,CD,2001,Instrumental,UK,9.35,$14.99 ,CN15,,,,,,,,,,
Guild,GMCD7231,795754723120,Mayr; Mozart,Music by Mayr & Mozart,"Vokalensemble Ingolstadt; Georgian Chamber Orchestra, Ingolstadt; Ulewicz; Mayer; Cooley; Gropper",1,CD,2001,Choral,UK,9.35,$14.99 ,CN15,,,,,,,,,,
Guild,GMCD7232,795754723229,"Bach, J.S.",Masterworks for Clavichord,Derek Adlam,1,CD,2001,Instrumental,UK,9.35,$14.99 ,CN15,,,,,,,,,,
Guild,GMCD7233,795754723328,Bull; Farnaby,The Nightingale & the Sparrow,Derek Adlam,1,CD,2002,Instrumental,UK,9.35,$14.99 ,CN15,,,,,,,,,,
Guild,GMCD7234,795754723427,Adams; Bizet; Gruber; Handel,Christmas with Handbells,Columba Ringers St. Columba College,1,CD,2002,Instrumental,UK,9.35,$14.99 ,CN15,,,,,,,,,,
Guild,GMCD7235,795754723526,Dvorak; Herbert,Dvorak & Herbert,Kreger; Philharmonia Orchestra,1,CD,2001,Orchestral,UK,9.35,$14.99 ,CN15,,,,,,,,,,
Guild,GMCD7236,795754723625,"Wilby, Philip",Lincoln Windows,"Choir of Lincoln College, Oxford; Smith",1,CD,2002,Choral,UK,9.35,$14.99 ,CN15,,,,,,,,,,
Guild,GMCD7237,795754723724,Freund; Schoeck; Kletzki,Romantic Swiss Song,Innes; Coleman; van Hulle; Rushton,1,CD,2002,Vocal,UK,9.35,$14.99 ,CN15,,,,,,,,,,
Guild,GMCD7238,795754723823,"Rutti, Carl",Sermon on the Mount,Escorial Choir; Rutti,1,CD,2002,Choral,UK,9.35,$14.99 ,CN15,,,,,,,,,,
Guild,GMCD7239,795754723922,Alain; Dupre; Langlais; Messiaen,La France au Calvaire by Dupre,Vasari Singers; Filsell,1,CD,2002,Choral,UK,9.35,$14.99 ,CN15,,,,,,,,,,
Guild,GMCD7240,795754724028,Helmschrott; Langlais; Poulenc,"Masterworks Organ, Orchestra & Percussion","Georgian Chamber Orchestra, Ingolstadt; Hauk; Kesting",1,CD,2002,Orchestral,UK,9.35,$14.99 ,CN15,,,,,,,,,,
Guild,GMCD7241,795754724127,"Baer, Walter",Piano Works,Andrew Zolinsky,1,CD,2002,Instrumental,UK,9.35,$14.99 ,CN15,,,,,,,,,,
Guild,GMCD7242,795754724226,Rachmaninoff; Tchaikovsky,Music by Rachmaninoff & Tchaikovsky,Barbican Trio,1,CD,2002,Instrumental,UK,9.35,$14.99 ,CN15,,,,,,,,,,
Guild,GMCD7243,795754724325,Albeniz; ; de Falla; Eslava; Sor,O Crux,Coro Cervantes,1,CD,2002,Choral,UK,9.35,$14.99 ,CN15,,,,,,,,,,
Guild,GMCD7244,795754724424,Beeson; Brahms; Flegier,Low Bass,Maynor; Woitach,1,CD,2002,Vocal,UK,9.35,$14.99 ,CN15,,,,,,,,,,
Guild,GMCD7245,795754724523,Engel; Kreek; Bach; Nystedt,Te Deum,"Estonian Philharmonic Chamber Choir; Mikk uleoja; Oja; Urb;, Ensemble Art of Brass, Vienna; Hauk",1,CD,2002,Choral,UK,9.35,$14.99 ,CN15,,,,,,,,,,
Guild,GMCD7246,795754724622,Bruckner; Jansson; Jennefelt,Voice of Africa,University of Pretoria Camerata,1,CD,2002,Choral,UK,9.35,$14.99 ,CN15,,,,,,,,,,
Guild,GMCD7247,795754724721,Berlin; Chaplin; Ellington,From Another American,Maynor; Olsen,1,CD,2002,Vocal,UK,9.35,$14.99 ,CN15,,,,,,,,,,
Guild,GMCD7248,795754724820,Bachofen; Meyer; Schmidlin,Sacred Vocal Music,"Choir of Gonville & Caius College, Cambridge; Cambridge Baroque Camerata",1,CD,2002,Choral,UK,9.35,$14.99 ,CN15,,,,,,,,,,
Guild,GMCD7249,795754724929,"Mendelssohn, Felix",Organ Sonatas,Reg Elson,1,CD,2003,Instrumental,UK,9.35,$14.99 ,CN15,,,,,,,,,,
Guild,GMCD7250,795754725025,Haller; Vogel; Blum; Schaeuble,20th C. Concertos,Camerata Zurich; Jundt; Hafliger,1,CD,2002,Orchestral,UK,9.35,$14.99 ,CN15,,,,,,,,,,
Guild,GMCD7251-52,795754725223,"Mayr, Simon",La Passione,Vocalensemble Ingolstadt; Georgisches Kammerorchester Ingolstadt,2,CD,2002,Choral,UK,17.93,$27.99 ,CN28,,,,,,,,,,
Guild,GMCD7253,795754725322,Burkhard; Brunner; Schaeuble,Swiss Organ Music of the 20th C.,Kammerorchester Basel; Bines,1,CD,2003,Orchestral,UK,9.35,$14.99 ,CN15,,,,,,,,,,
Guild,GMCD7254,795754725421,Schoeck; Schutter; Lorenzo,Hesperos,Leibundgut; Stoecklin,1,CD,2002,Vocal,UK,9.35,$14.99 ,CN15,,,,,,,,,,
Guild,GMCD7255,795754725520,Bachofen; Ott; Schmidlin,Seasons in Zurich,Purcell Singers; Howarth; Deats; Jacbos,1,CD,2002,Choral,UK,9.35,$14.99 ,CN15,,,,,,,,,,
Guild,GMCD7256,795754725629,Bach; Handel; Rowlands; Wesley,Love Divine,"Choir of Lincoln College, Oxford; Bucknall",1,CD,2003,Choral,UK,9.35,$14.99 ,CN15,,,,,,,,,,
Guild,GMCD7257,795754725728,Avrazi; Gjoni; Harapi; Ibrahimi,Kenge,Kirsten Johnson,1,CD,2003,Instrumental,UK,9.35,$14.99 ,CN15,,,,,,,,,,
Guild,GMCD7258-59,795754725926,"Bach, J.S.", French Suites & Overture,Paul Parsons,2,CD,2003,Instrumental,UK,17.93,$27.99 ,CN28,,,,,,,,,,
Guild,GMCD7260,795754726022,"Haydn, Joseph",Derek Adlam Plays Haydn,Derek Adlam,1,CD,2003,Instrumental,UK,9.35,$14.99 ,CN15,,,,,,,,,,
Guild,GMCD7261,795754726121,Engel; Stravinsky; von Einem,Violin & Piano Duos,Kanettis; Kontarsky; Latzko,1,CD,2003,Instrumental,UK,9.35,$14.99 ,CN15,,,,,,,,,,
Guild,GMCD7262-63,795754726329,"Bach, J.S.",Clavierubung III,David Ponsford,2,CD,2003,Instrumental,UK,17.93,$27.99 ,CN28,,,,,,,,,,
Guild,GMCD7264,795754726428,Langlais; Paer; Schneider; Widor,Works for Organ & Orchestra,"Georgian Chamber Orchestera, Ingolstadt; Hauk",1,CD,2003,Orchestral,UK,9.35,$14.99 ,CN15,,,,,,,,,,
Guild,GMCD7265,795754726527,Britten; Brockless; Harvey,Songs of Heaven & Earth,"Choir of Queens' College, Cambridge; Hayes",1,CD,2003,Choral,UK,9.35,$14.99 ,CN15,,,,,,,,,,
Guild,GMCD7266,795754726626,Cano; Casals; Ginastera; Mompou,Oratio,Coro Cervantes,1,CD,2003,Choral,UK,9.35,$14.99 ,CN15,,,,,,,,,,
Guild,GMCD7267,795754726725,Chilcott; Rose; Gershwin,Deep Purple,Vasari Singers,1,CD,2003,Choral,UK,9.35,$14.99 ,CN15,,,,,,,,,,
Guild,GMCD7268-69-70,795754727029,"Mayr, Simon",Atalia,Mayr-Chor; Jette; Martin; Cooley; Janiszewski; Orescanin,3,CD,2003,Opera,UK,27.29,$41.99 ,CN42,,,,,,,,,,
Guild,GMCD7271,795754727128,Bullock; Dearmer; Faure,Portsmouth Remembers,Portsmouth Cathedral Choir; Regent Brass Ensemble; Thorne; Field; Eastwood,1,CD,2004,Choral,UK,9.35,$14.99 ,CN15,,,,,,,,,,
Guild,GMCD7272,795754727227,Burgon; Victoria; Maclean,Songs of the Soul,Saint Louis Chamber Chorus,1,CD,2005,Choral,UK,9.35,$14.99 ,CN15,,,,,,,,,,
Guild,GMCD7273,795754727326,"Eschmann, Johann Carl",Fruhlingsbluthen,Jeremy Filsell,1,CD,2004,Instrumental,UK,9.35,$14.99 ,CN15,,,,,,,,,,
Guild,GMCD7274,795754727425,"Beethoven, Ludwig van",Symphonies No. 1 & 8,Locrian Ensemble,1,CD,2004,Chamber,UK,9.35,$14.99 ,CN15,,,,,,,,,,
Guild,GMCD7275,795754727524,Bridge; Carse; Clarke; Coates,Heartache,Piston; Shamoniaa,1,CD,2004,Instrumental,UK,9.35,$14.99 ,CN15,,,,,,,,,,
Guild,GMCD7276,795754727623,Bach; Byrd; Palestrina; Tavener,"Come, Holy Spirit","Choir of The Queen's College, Oxford; Parsons",1,CD,2004,Choral,UK,9.35,$14.99 ,CN15,,,,,,,,,,
Guild,GMCD7277,795754727722,"Schulz-Beuthen, Heinrich",Piano Music,Kirsten Johnson,1,CD,2004,Instrumental,UK,9.35,$14.99 ,CN15,,,,,,,,,,
Guild,GMCD7278,795754727821,Dupre; Langlais; Litaize,Organ Works,Colin Walsh,1,CD,2004,Instrumental,UK,9.35,$14.99 ,CN15,,,,,,,,,,
Guild,GMCD7279,795754727920,Nassidse; Loboda; Zinzadse,Music from Georgia,"Georgian Chamber Orchestra, Ingolstadt",1,CD,2004,Chamber,UK,9.35,$14.99 ,CN15,,,,,,,,,,
